Code Number,Code Name,Paper Name,URL
333,RNA code -A (miscellaneous),"Štambuk, N., Konjevoda, P., Turčić, P., Kövér, K., Kujundžić, R. N., Manojlović, Z., & Gabričević, M. (2018). Genetic coding algorithm for sense and antisense peptide interactions. Biosystems, 164, 199- 216.",https://doi.org/10.1016/j.biosystems.2017.10.009
333,RNA code -A (miscellaneous),"Ribeiro, D. R., Nunes, A., Ribeiro, D., & Soares, A. R. (2023). The hidden RNA code: implications of the RNA epitranscriptome in the context of viral infections [Mini Review]. Front Genet, Volume 14 - 2023.",https://doi.org/10.3389/fgene.2023.1245683
333,RNA code -A (miscellaneous),"Zhang, Y., Shi, J., & Chen, Q. (2023). Towards the understanding of “Herbal RNA Code” for traditional medicine. Cell Res, 33(12), 900-901.",https://doi.org/10.1038/s41422-023-00851-x
333,RNA code -A (miscellaneous),"The International Human RNome Project Consortium. (2025). Unlocking the regulatory code of RNA: launching the Human RNome Project. Genome Biol, 26(1), 367.",https://doi.org/10.1186/s13059-025-03824-y
333,RNA code -A (miscellaneous),"Plank, H. B., Zhang, X., Rawal, H. C., Yu, J., Zhou, C., Chen, Q., & Zhou, T. (2026). Dissecting the small RNA code of inflammatory bowel disease. Molecular Medicine, 32(1), 21.",https://doi.org/10.1186/s10020-025-01412-1
333,RNA code -A (miscellaneous),"Sun, Y., Wu, J., Chen, G., Ma, H., Li, W., Tan, H., & Yang, K. (2026). Rewriting the RNA code: an m(6)a- centric framework to classify tumors and guide combination therapies. Front Immunol, 17, 1749911.",https://doi.org/10.3389/fimmu.2026.1749911
334,RNA code -B (lnc),"Aprea, J., & Calegari, F. (2015). Long non-coding RNAs in corticogenesis: deciphering the non-coding code of the brain. Embo j, 34(23), 2865-2884.",https://doi.org/10.15252/embj.201592655
334,RNA code -B (lnc),"Zhao, X. Y., & Lin, J. D. (2015). Long Noncoding RNAs: A New Regulatory Code in Metabolic Control. Trends Biochem Sci, 40(10), 586-596.",https://doi.org/10.1016/j.tibs.2015.08.002
334,RNA code -B (lnc),"Zhang, A., Zhang, J., Kaipainen, A., Lucas, J. M., & Yang, H. (2016). Long non-coding RNA: A newly deciphered “code” in prostate cancer. Cancer Letters, 375(2), 323-330.",https://doi.org/10.1016/j.canlet.2016.03.003
334,RNA code -B (lnc),"Wu, D., Poddar, A., Ninou, E., Hwang, E., Cole, M. A., Liu, S. J., . . . Lim, D. A. (2022). Dual genome- wide coding and lncRNA screens in neural induction of induced pluripotent stem cells. Cell Genomics, 2(11).",https://doi.org/10.1016/j.xgen.2022.100177
334,RNA code -B (lnc),"Chen, W., Pan, Z., Feng, Z., Wang, X., & Zhu, S. (2024). Deciphering the code: the pivotal role of lncRNAs in advancing TNBC therapy [Review]. Frontiers in Oncology, Volume 14 - 2024.",https://doi.org/10.3389/fonc.2024.1450980
334,RNA code -B (lnc),"Yonis, N., Mousa, A., Yousef, M. H., Ghouneimy, A. M., Dabbish, A. M., Abdelzaher, H., . . . Abdelnaser, A. (2025). Cracking the code: lncRNA-miRNA-mRNA integrated network analysis unveiling lncRNAs as promising non-invasive NAFLD biomarkers toward precision diagnosis. Comput Biol Chem, 115, 108325.",https://doi.org/10.1016/j.compbiolchem.2024.108325
334,RNA code -B (lnc),"Alsa'd, A. A., Al-Hasnaawei, S., Renuka Jyothi, S., Nayak, P. P., Bethanney Janney, J., Arora, V., & Sinha, A. (2026). From code to cancer: CircRNAs and lncRNAs regulate kinesin functions in tumorigenesis. Exp Cell Res, 457(2), 114954.",https://doi.org/10.1016/j.yexcr.2026.114954
335,RNA code -C (operational),"Schimmel, P., R. Giegé, D. Moras and S. Yokoyama (1993). “An operational RNA code for amino acids and possible relationship to genetic code.” Proceedings of the National Academy of Sciences 90(19): 8763-8768.",https://www.pnas.org/doi/10.1073/pnas.90.19.8763
335,RNA code -C (operational),"Schimmel, P. (1995). An operational RNA code for amino acids and variations in critical nucleotide sequences in evolution. J Mol Evol, 40(5), 531-536.",https://doi.org/10.1007/bf00166621
335,RNA code -C (operational),"Schimmel, P., & Ripmaster, T. (1995). Modular design of components of the operational RNA code for alanine in evolution. Trends Biochem Sci, 20(9), 333-334.",https://doi.org/10.1016/s0968-0004(00)89067-2
335,RNA code -C (operational),"Stehlin, C., Burke, B., Yang, F., Liu, H., Shiba, K., & Musier-Forsyth, K. (1998). Species-specific differences in the operational RNA code for aminoacylation of tRNAPro. Biochemistry, 37(23), 8605- 8613.",https://doi.org/10.1021/bi980364s
335,RNA code -C (operational),"Xu, F., Chen, X., Xin, L., Chen, L., Jin, Y., & Wang, D. (2001). Species-specific differences in the operational RNA code for aminoacylation of tRNA(Trp). Nucleic Acids Res, 29(20), 4125-4133.",https://doi.org/10.1093/nar/29.20.4125
335,RNA code -C (operational),"Jones, T. E., Brown, C. L., Geslain, R., Alexander, R. W., & Ribas de Pouplana, L. (2008). An operational RNA code for faithful assignment of AUG triplets to methionine. Mol Cell, 29(3), 401-407.",https://doi.org/10.1016/j.molcel.2007.12.021
335,RNA code -C (operational),"Shaul, S., D. Berel, Y. Benjamini and D. Graur (2010). “Revisiting the operational RNA code for amino acids: Ensemble attributes and their implications.” Rna 16(1): 141-153.",https://rnajournal.cshlp.org/content/16/1/141.long
336,RNA code -D (sno),"Li, Y., Chen, X., Xiao, S., Wang, H., Li, B., Zhang, M., & Wang, K. (2025). Unlocking the life code: a review of SnoRNA functional diversity and disease relevance. Cell Communication and Signaling, 23(1), 266.",https://doi.org/10.1186/s12964-025-02274-0
337,RNA degradation code,"Soles, L. V., Liu, L., Zou, X., Yoon, Y., Li, S., Tian, L., . . . Shi, Y. (2025). A nuclear RNA degradation code is recognized by PAXT for eukaryotic transcriptome surveillance. Molecular Cell, 85(8), 1575- 1588.e1579.",https://doi.org/10.1016/j.molcel.2025.03.010
338,RNA editing/modification code,"Flamand, M. N., Tegowski, M., & Meyer, K. D. (2023). The Proteins of mRNA Modification: Writers, Readers, and Erasers. Annu Rev Biochem, 92(Volume 92, 2023), 145-173.",https://doi.org/10.1146/annurev-biochem-052521-035330
338,RNA editing/modification code,"Xuan, J., Chen, L., Chen, Z., Pang, J., Huang, J., Lin, J., . . . Yang, J. (2023). RMBase v3.0: decode the landscape, mechanisms and functions of RNA modifications. Nucleic Acids Res, 52(D1), D273-D284.",https://doi.org/10.1093/nar/gkad1070
338,RNA editing/modification code,"Yang, Y., Ritzenhofen, K., Otrzonsek, J., Xie, J., Schallenberg-Rüdinger, M., & Knoop, V. (2023). Beyond a PPR-RNA recognition code: Many aspects matter for the multi-targeting properties of RNA editing factor PPR56. PLoS Genet, 19(8), e1010733.",https://doi.org/10.1371/journal.pgen.1010733
338,RNA editing/modification code,"Sachse, M., & Stellos, K. (2024). Unraveling the RNA code: a uridine RNA modification drives glycoRNA biogenesis. Signal Transduction and Targeted Therapy, 9(1), 334.",https://doi.org/10.1038/s41392-024-02056-z
338,RNA editing/modification code,"Fang, H., He, J., Du, D., Wang, X., Xu, X., Lu, L., . . . Zhou, M. (2025). Deciphering the secret codes in N7-methylguanosine modification: Context-dependent function of methyltransferase-like 1 in human diseases. Clin Transl Med, 15(2), e70240.",https://doi.org/10.1002/ctm2.70240
338,RNA editing/modification code,"Yu, H., Ma, Z., Su, S., Xu, Z., & Yi, H. (2025). RNA modification: a promising code to unravel the puzzle of autoimmune diseases and CD4(+) T cell differentiation. Front Immunol, 16, 1563150.",https://doi.org/10.3389/fimmu.2025.1563150
338,RNA editing/modification code,"Min, D. J., Lee, S., Lee, Y.-s., & Cho, J. (2026). Two codes of RNA editing by deamination in human diseases. Experimental & Molecular Medicine, 58(2), 382-395.",https://doi.org/10.1038/s12276-025-01633-8
339,RNAi code,"Faria, M. (2007). RNA As Code Makers: A Biosemiotic View Of RNAi And Cell Immunity. Introduction to Biosemiotics: The New Biological Synthesis. M. Barbieri. Dordrecht, Springer Netherlands: 347- 364.",https://link.springer.com/chapter/10.1007/1-4020-4814-9_14
339,RNAi code,"Siomi, H. and M. C. Siomi (2009). “On the road to reading the RNA-interference code.” Nature 457(7228): 396-404.",https://www.nature.com/articles/nature07754
339,RNAi code,"Wright, J. E., D. Gaidatzis, M. Senften, B. M. Farley, E. Westhof, S. P. Ryder and R. Ciosk (2011). ""A quantitative RNA code for mRNA target selection by the germline fate determinant GLD-1."" Embo j 30(3): 533-545.",https://www.embopress.org/doi/full/10.1038/emboj.2010.334
340,RNA recognition code,"Pitici, F., D. L. Beveridge and A. M. Baranger (2002). ""Molecular dynamics simulation studies of induced fit and conformational capture in U1A-RNA binding: do molecular substates code for specificity?"" Biopolymers 65(6): 424-435.",https://onlinelibrary.wiley.com/doi/10.1002/bip.10251
340,RNA recognition code,"Yeo, G. W., N. G. Coufal, T. Y. Liang, G. E. Peng, X. D. Fu and F. H. Gage (2009). ""An RNA code for the FOX2 splicing regulator revealed by mapping RNA-protein interactions in stem cells."" Nat Struct Mol Biol 16(2): 130-137.",https://www.nature.com/articles/nsmb.1545
340,RNA recognition code,"Yarus, M., J. J. Widmann and R. Knight (2009). ""RNA-amino acid binding: a stereochemical era for the genetic code."" J Mol Evol 69(5): 406-429.",https://link.springer.com/article/10.1007/s00239-009-9270-1
340,RNA recognition code,"Filipovska, A., M. F. Razif, K. K. Nygård and O. Rackham (2011). “A universal code for RNA recognition by PUF proteins.” Nat Chem Biol 7(7): 425-427.",https://www.nature.com/articles/nchembio.577
340,RNA recognition code,"Chen, Y. and G. Varani (2011). “Finding the missing code of RNA recognition by PUF proteins.” Chem Biol 18(7): 821-823.",https://www.sciencedirect.com/science/article/pii/S1074552111002304?
340,RNA recognition code,"Barkan, A., M. Rojas, S. Fujii, A. Yap, Y. S. Chong, C. S. Bond and I. Small (2012). ""A combinatorial amino acid code for RNA recognition by pentatricopeptide repeat proteins."" PLoS Genet 8(8): e1002910.",https://journals.plos.org/plosgenetics/article?id=10.1371/journal.pgen.1002910
340,RNA recognition code,"Cléry, A., J. Boudet and F. H. Allain (2013). “Single-stranded nucleic acid recognition: is there a code after all?” Structure 21(1): 4-6.",https://www.cell.com/structure/fulltext/S0969-2126(12)00461-3
340,RNA recognition code,"Yagi, Y., Hayashi, S., Kobayashi, K., Hirayama, T., & Nakamura, T. (2013). Elucidation of the RNA Recognition Code for Pentatricopeptide Repeat Proteins Involved in Organelle RNA Editing in Plants. PLoS One, 8(3), e57286.",https://doi.org/10.1371/journal.pone.0057286
340,RNA recognition code,"Yin, P., Li, Q., Yan, C., Liu, Y., Liu, J., Yu, F., . . . Yan, N. (2013). Structural basis for the modular recognition of single-stranded RNA by PPR proteins. Nature, 504(7478), 168-171.",https://doi.org/10.1038/nature12651
340,RNA recognition code,"Hennig, J., F. Gebauer and M. Sattler (2014). “Breaking the protein-RNA recognition code.” Cell Cycle 13(23): 3619-3620.",https://www.tandfonline.com/doi/full/10.4161/15384101.2014.986625
340,RNA recognition code,"Campbell, Z. T., C. T. Valley and M. Wickens (2014). ""A protein-RNA specificity code enables targeted activation of an endogenous human transcript."" Nat Struct Mol Biol 21(8): 732-738.",https://www.nature.com/articles/nsmb.2847
340,RNA recognition code,"Nahalka, J. (2014). Protein–RNA recognition: Cracking the code. J Theor Biol, 343, 9-15.",https://doi.org/10.1016/j.jtbi.2013.11.006
340,RNA recognition code,"Nawy, T. (2014). ""A protein code to target RNA."" Nat Methods 11(9): 888-889.",https://www.nature.com/articles/nmeth.3087
340,RNA recognition code,"Hall, T. M. T. (2016). De-coding and re-coding RNA recognition by PUF and PPR repeat proteins. Curr Opin Struct Biol, 36, 116-121.",https://doi.org/10.1016/j.sbi.2016.01.010
340,RNA recognition code,"Carter, C. W., Jr. and P. R. Wills (2018). ""Hierarchical groove discrimination by Class I and II aminoacyl-tRNA synthetases reveals a palimpsest of the operational RNA code in the tRNA acceptor- stem bases."" Nucleic Acids Res 46(18): 9667-9683.",https://academic.oup.com/nar/article-lookup/doi/10.1093/nar/gky600
340,RNA recognition code,"Yan, J., Yao, Y., Hong, S., Yang, Y., Shen, C., Zhang, Q., . . . Yin, P. (2019). Delineation of pentatricopeptide repeat codes for target RNA prediction. Nucleic Acids Res, 47(7), 3728-3738.",https://doi.org/10.1093/nar/gkz075
340,RNA recognition code,"Nahalka, J. (2022). Transcription of the Envelope Protein by 1-L Protein–RNA Recognition Code Leads to Genes/Proteins That Are Relevant to the SARS-CoV-2 Life Cycle and Pathogenesis. Curr Issues Mol Biol, 44(2), 791-816.",https://www.mdpi.com/1467-3045/44/2/55
340,RNA recognition code,"Roca-Martínez, J., Dhondge, H., Sattler, M., & Vranken, W. F. (2023). Deciphering the RRM-RNA recognition code: A computational analysis. PLOS Computational Biology, 19(1), e1010859.",https://doi.org/10.1371/journal.pcbi.1010859
341,RNA Structure code,"Hou, Y. M. and P. Schimmel (1988). “A simple structural feature is a major determinant of the identity of a transfer RNA.” Nature 333(6169): 140-145.",https://www.nature.com/articles/333140a0
341,RNA Structure code,"Izumi, H., Nafie, L. A., & Dukor, R. K. (2025). Supersecondary Structure Code for RNA: Trace of Conformational Change on the Mycoplasma pneumoniae Ribosome and the R-Loop Formation of Cas9. ACS Omega, 10(5), 4998-5005.",https://doi.org/10.1021/acsomega.4c10681
342,γ RORt code,"Brown, C. C. (2026). Runx writes the RORγt code for immune tolerance. Immunity, 59(4), 928-930.",https://doi.org/10.1016/j.immuni.2026.03.021
343,R-Spondin code,"Niehrs, C., Seidl, C., & Lee, H. (2024). An 'R-spondin code' for multimodal signaling ON-OFF states. Bioessays, 46(10), 2400144.",https://doi.org/10.1002/bies.202400144
344,Scent codes,"Wright, G. A. and F. P. Schiestl (2009). “The evolution of floral scent: the influence of olfactory learning by insect pollinators on the honest signalling of floral rewards.” Functional Ecology 23(5): 841-851.",https://besjournals.onlinelibrary.wiley.com/doi/full/10.1111/j.1365-2435.2009.01627.x
344,Scent codes,"Ferrero, D. M. and S. D. Liberles (2010). “The secret codes of mammalian scents.” WIREs Systems Biology and Medicine 2(1): 23-33.",https://wires.onlinelibrary.wiley.com/doi/abs/10.1002/wsbm.39
345,Second messenger code,"Nicol, X., Hong, K. P., & Spitzer, N. C. (2011). Spatial and temporal second messenger codes for growth cone turning. Proceedings of the National Academy of Sciences, 108(33), 13776-13781.",https://doi.org/10.1073/pnas.1100247108
346,Secretory code,"Weissmann, G., Korchak, H. M., Perez, H. D., Smolen, J. E., Goldstein, I. M., & Hoffstein, S. T. (1979). The secretory code of the neutrophil. J Reticuloendothel Soc, 26(Suppl), 687-700. Smolen, J. E., Korchak, H. M., & Weissmann, G. (1981). The ""secretory code"" of the neutrophil. Methods Cell Biol, 23, 461-481.",https://pubmed.ncbi.nlm.nih.gov/230347/
347,Seed code,"Kamble, N. U. (2025). Cracking the seed code: How nitrate directly breaks ABA signaling for germination. Plant Cell, 37(6).",https://doi.org/10.1093/plcell/koaf072
348,Segregation code,"Monda, J. K. and I. M. Cheeseman (2015). “Chromosome Segregation: A Spatial Code to Correct Kinetochore-Microtubule Attachments.” Curr Biol 25(14): R601-603.",https://www.cell.com/current-biology/fulltext/S0960-9822(15)00659-4
349,Semaphorin code,"Cohen, S., L. Funkelstein, J. Livet, G. Rougon, C. E. Henderson, V. Castellani and F. Mann (2005). ""A semaphorin code defines subpopulations of spinal motor neurons during mouse development."" Eur J Neurosci 21(7): 1767-1776.",https://onlinelibrary.wiley.com/doi/10.1111/j.1460-9568.2005.04021.x
349,Semaphorin code,"Berke, B. and H. Keshishian (2011). “Cracking the combinatorial semaphorin code.” Neuron 70(2): 175-177.",https://www.cell.com/neuron/fulltext/S0896-6273(11)00312-6
349,Semaphorin code,"Wu, Z., L. B. Sweeney, J. C. Ayoob, K. Chak, B. J. Andreone, T. Ohyama, R. Kerr, L. Luo, M. Zlatic and A. L. Kolodkin (2011). ""A combinatorial semaphorin code instructs the initial steps of sensory circuit assembly in the Drosophila CNS."" Neuron 70(2): 281-298.",https://www.cell.com/neuron/fulltext/S0896-6273(11)00247-9
350,Senescence code,"Paluvai, H., E. Di Giorgio and C. Brancolini (2020). ""The Histone Code of Senescence."" Cells 9(2).",https://www.mdpi.com/2073-4409/9/2/466
350,Senescence code,"Suter, T., Friedman, M. J., Tazearslan, C., Gamliel, A., Merkurjev, D., Ohgi, K., . . . Suh, Y. (2026). A Histone Code Functionally Linked to Replicative Senescence. Aging Cell, 25(1), e70343.",https://doi.org/10.1111/acel.70343
351,Sensory code,"Felsten, G. and G. S. Wasserman (1979). “The photoreceptor sensory code for pattern identification during visual masking.” Sens Processes 3(3): 230-239.",https://pubmed.ncbi.nlm.nih.gov/555552/
352,SeqCode,"Hedlund, B. P., M. Chuvochina, P. Hugenholtz, K. T. Konstantinidis, A. E. Murray, M. Palmer, D. H. Parks, A. J. Probst, A. L. Reysenbach, R. L. Rodriguez, R. Rossello-Mora, I. C. Sutcliffe, S. N. Venter and W. B. Whitman (2022). “SeqCode: a nomenclatural code for prokaryotes described from sequence data.” Nat Microbiol 7(10): 1702-1708.",
353,Sequence codes,"Trifonov, E. N. (1987). “Translation framing code and frame-monitoring mechanism as suggested by the analysis of mRNA and 16 S rRNA nucleotide sequences.” Journal of Molecular Biology 194(4): 643-652.",https://www.sciencedirect.com/science/article/abs/pii/0022283687902415
353,Sequence codes,"Trifonov, E. N. (1988). “Codes of nucleotide sequences.” Mathematical Biosciences 90(1): 507-517.",https://www.sciencedirect.com/science/article/abs/pii/0025556488900806
353,Sequence codes,"Trifonov, E. N. (1989). “The multiple codes of nucleotide sequences.” Bulletin of Mathematical Biology 51(4): 417-432.",https://www.sciencedirect.com/science/article/abs/pii/S0092824089800874
353,Sequence codes,"Vogt, P. (1990). ""Potential genetic functions of tandem repeated DNA sequence blocks in the human genome are based on a highly conserved ""chromatin folding code""."" Hum Genet 84(4): 301-336.",https://link.springer.com/article/10.1007/BF00196228
353,Sequence codes,"Trifonov, E. N. (1999). “Elucidating sequence codes: three codes for evolution.” Ann N Y Acad Sci 870: 330-338.",https://nyaspubs.onlinelibrary.wiley.com/doi/abs/10.1111/j.1749-6632.1999.tb08894.x
353,Sequence codes,"Sotolongo, B. and W. S. Ward (2000). “DNA loop domain organization: the three-dimensional genomic code.” J Cell Biochem Suppl Suppl 35: 23-26.",https://onlinelibrary.wiley.com/doi/10.1002/1097-4644(2000)79:35+%3C23::AID-JCB1122%3E3.0.CO;2-N
353,Sequence codes,"Trifonov, E. N. (2008). Codes of Biosequences. The Codes of Life: The Rules of Macroevolution. M. Barbieri and J. Hoffmeyer. Dordrecht, Springer Netherlands: 3-14.",https://link.springer.com/chapter/10.1007/978-1-4020-6340-4_1
353,Sequence codes,"Trifonov, E. N. (2011). “Thirty years of multiple sequence codes.” Genomics Proteomics Bioinformatics 9(1-2): 1-6.",https://www.sciencedirect.com/science/article/pii/S1672022911600016
353,Sequence codes,"Trifonov, E. N. (2011). ""Cracking the chromatin code: precise rule of nucleosome positioning."" Phys Life Rev 8(1): 39-50.",https://linkinghub.elsevier.com/retrieve/pii/S1571-0645(11)00005-4
353,Sequence codes,"Ciribilli, Y., P. Monti, A. Bisio, H. T. Nguyen, A. S. Ethayathulla, A. Ramos, G. Foggetti, P. Menichini, D. Menendez, M. A. Resnick, H. Viadiu, G. Fronza and A. Inga (2013). “Transactivation specificity is conserved among p53 family proteins and depends on a response element sequence code.” Nucleic Acids Res 41(18): 8637-8653.",https://academic.oup.com/nar/article/41/18/8637/1035361
353,Sequence codes,"Durán, E., S. Djebali, S. González, O. Flores, J. M. Mercader, R. Guigó, D. Torrents, M. Soler-López and M. Orozco (2013). ""Unravelling the hidden DNA structural/physical code provides novel insights on promoter location."" Nucleic Acids Res 41(15): 7220-7230.",https://academic.oup.com/nar/article/41/15/7220/2411146
353,Sequence codes,"Herbert, A. (2019). ""A Genetic Instruction Code Based on DNA Conformation."" Trends Genet 35(12): 887-890.",https://www.cell.com/trends/genetics/fulltext/S0168-9525(19)30194-5
353,Sequence codes,"Ling, J., K. Y. Umezawa, T. Scott and S. Small (2019). ""Bicoid-Dependent Activation of the Target Gene hunchback Requires a Two-Motif Sequence Code in a Specific Basal Promoter."" Mol Cell 75(6): 1178- 1187.e1174.",https://www.cell.com/molecular-cell/fulltext/S1097-2765(19)30495-2
353,Sequence codes,"Marzec, M. (2021). ""Uncovering the Mechanical Code of DNA Using 'Loop-seq'."" Trends Genet 37(6): 494-495.",https://linkinghub.elsevier.com/retrieve/pii/S0168-9525(21)00049-4
353,Sequence codes,"Esposito, A., S. Bianco, A. M. Chiariello, A. Abraham, L. Fiorillo, M. Conte, R. Campanile and M. Nicodemi (2022). ""Polymer physics reveals a combinatorial code linking 3D chromatin architecture to 1D chromatin states."" Cell Rep 38(13): 110601.",https://www.cell.com/cell-reports/fulltext/S2211-1247(22)00349-7
353,Sequence codes,"Pflughaupt, P., Abdullah, Adib A., Masuda, K., & Sahakyan, Aleksandr B. (2024). Towards the genomic sequence code of DNA fragility for machine learning. Nucleic Acids Res, 52(21), 12798-12816.",https://doi.org/10.1093/nar/gkae914
354,Serin code,"Su, P., Yang, Y., & Zheng, H. (2026). The ""serine code"" of metabolic reprogramming: multidimensional roles of the serine synthesis pathway in tumors and novel breakthroughs for targeted therapy. Front Immunol, 17, 1779543.",https://doi.org/10.3389/fimmu.2026.1779543
355,Serotonin code,"Tchenio, A., Valentinova, K., & Mameli, M. (2016). Can the Lateral Habenula Crack the Serotonin Code? [Mini Review]. Front Synaptic Neurosci, Volume 8 - 2016.",https://doi.org/10.3389/fnsyn.2016.00034
355,Serotonin code,"Harkin, E. F., Grossman, C. D., Cohen, J. Y., Béïque, J.-C., & Naud, R. (2023). Serotonin predictively encodes value. bioRxiv, 2023.2009.2019.558526.",https://doi.org/10.1101/2023.09.19.558526
355,Serotonin code,"Harkin, E. F., Béïque, J.-C., & Naud, R. (2025). Extracting Value Coding Features from Individual Serotonin Neurons. bioRxiv, 2025.2007.2028.667134.",https://doi.org/10.1101/2025.07.28.667134
355,Serotonin code,"Harkin, E. F., Grossman, C. D., Cohen, J. Y., Béïque, J.-C., & Naud, R. (2025). A prospective code for value in the serotonin system. Nature, 641(8064), 952-959.",https://doi.org/10.1038/s41586-025-08731-7
356,Signal integration code,"Kim, J. H., J. M. Lee, H. J. Nam, H. J. Choi, J. W. Yang, J. S. Lee, M. H. Kim, S. I. Kim, C. H. Chung, K. I. Kim and S. H. Baek (2007). “SUMOylation of pontin chromatin-remodeling complex reveals a signal integration code in prostate cancer cells.” Proc Natl Acad Sci U S A 104(52): 20793-20798.",https://www.pnas.org/doi/10.1073/pnas.0710343105
357,Signal transduction code,"Prank, K., F. Gabbiani and G. Brabant (2000). ""Coding efficiency and information rates in transmembrane signaling."" Biosystems 55(1): 15-22.",https://www.sciencedirect.com/science/article/abs/pii/S0303264799000787
357,Signal transduction code,"Barbieri, M. (2003). The organic codes. An introduction to semantic biology., Cambridge University Press.",https://www.cambridge.org/core/books/organic-codes/7015316BD6B4F5F466CAC59FD31CD7F3
357,Signal transduction code,"Bruni, L. E. (2007). Cellular Semiotics And Signal Transduction. Introduction to Biosemiotics: The New Biological Synthesis. M. Barbieri. Dordrecht, Springer Netherlands: 365-408.",https://link.springer.com/chapter/10.1007/1-4020-4814-9_15
357,Signal transduction code,"Faria, M. (2008). Signal Transduction Codes and Cell Fate. The Codes of Life: The Rules of Macroevolution. M. Barbieri and J. Hoffmeyer. Dordrecht, Springer Netherlands: 265-283.",https://link.springer.com/chapter/10.1007/978-1-4020-6340-4_12
357,Signal transduction code,"Bengtsson, F. and H. Jörntell (2009). “Sensory transmission in cerebellar granule cells relies on similarly coded mossy fiber inputs.” Proc Natl Acad Sci U S A 106(7): 2389-2394.",https://www.pnas.org/doi/10.1073/pnas.0808428106
357,Signal transduction code,"Maraldi, N. M. (2019). ""In search of a primitive signaling code."" Biosystems 183: 103984.",https://www.sciencedirect.com/science/article/abs/pii/S0303264719301431
358,Sirtuin code,"Zhao, Y., Han, Y., Wang, B., & Wang, T. (2025). Sirtuins in Osteosarcoma: Cracking the Code and Opening Up New Treatment Options. Current Pharmaceutical Biotechnology.",https://doi.org/10.2174/0113892010374421250419163509
359,Social information code,"Knutson, B. and G. E. Wimmer (2007). ""Splitting the difference: how does the brain code reward episodes?"" Ann N Y Acad Sci 1104: 54-69.",https://nyaspubs.onlinelibrary.wiley.com/doi/abs/10.1196/annals.1390.020
359,Social information code,"Kahnt, T., J. Heinzle, S. Q. Park and J. D. Haynes (2010). “The neural code of reward anticipation in human orbitofrontal cortex.” Proc Natl Acad Sci U S A 107(13): 6010-6015.",https://www.pnas.org/doi/10.1073/pnas.0912838107
359,Social information code,"Hale, L. A., E. S. Lee, A. K. Pantazis, N. Chronis and S. H. Chalasani (2016). ""Altered Sensory Code Drives Juvenile-to-Adult Behavioral Maturation in Caenorhabditis elegans."" eNeuro 3(6).",https://www.eneuro.org/content/3/6/ENEURO.0175-16.2016
359,Social information code,"Ponsot, E., J. J. Burred, P. Belin and J. J. Aucouturier (2018). “Cracking the social code of speech prosody using reverse correlation.” Proc Natl Acad Sci U S A 115(15): 3972-3977.",https://www.pnas.org/doi/abs/10.1073/pnas.1716090115
