Number,Code Name,Description,Citations,URLs
212,Matrix code,The Pericellular Matrix Code,"Baumann, B. T., Nieuwstraten, J., Konrads, C., Guilak, F., & Danalache, M. (2025). Cracking the Pericellular Matrix Code: Exploring how MMP-2, -3, and -7 influence matrix breakdown and biomechanical properties. Osteoarthritis Cartilage, 33(2), 241-246.","[""https://doi.org/10.1016/j.joca.2024.09.006"", ""https://www.science.org/doi/10.1126/sciadv.abg4617""]"
213,Mechanical code,The Mechanical Codes SEE also Curvature Code,"Das, R., L. C. Lin, F. Català-Castro, N. Malaiwong, N. Sanfeliu-Cerdán, M. Porta-de-la-Riva, A. Pidde and M. Krieg (2021). ""An asymmetric mechanical code ciphers curvature-dependent proprioceptor activity."" Sci Adv 7(38): eabg4617.","[""https://rupress.org/jcb/article/162/1/37/33324/Changes-in-histone-acetylation-during-mouse-oocyte"", ""https://www.science.org/doi/10.1126/sciadv.abg4617""]"
214,Meiosis codes,The Meiosis Codes,"Kim, J.-M., H. Liu , M. Tazaki, M. Nagata and F. Aoki (2003). “Changes in histone acetylation during mouse oocyte meiosis.” Journal of Cell Biology 162(1): 37-46. Ivanovska, I., T. Khandan, T. Ito and T. L. Orr-Weaver (2005). “A histone code in meiosis: the histone kinase, NHK-1, is required for proper chromosomal architecture in Drosophila oocytes.” Genes & Development 19(21): 2571-2582. Xu, D., J. Bai, Q. Duan, M. Costa and W. Dai (2009). “Covalent modifications of histones during mitosis and meiosis.” Cell Cycle 8(22): 3688-3694.","[""http://genesdev.cshlp.org/content/19/21/2571.full"", ""https://rupress.org/jcb/article/162/1/37/33324/Changes-in-histone-acetylation-during-mouse-oocyte"", ""https://www.tandfonline.com/doi/abs/10.4161/cc.8.22.9908""]"
215,Melatonin codes,The Melatonin Codes SEE also Circardian codes,"Wayne, N. L., B. Malpaux and F. J. Karsch (1988). “How does melatonin code for day length in the ewe: duration of nocturnal melatonin release or coincidence of melatonin with a light-entrained sensitive period?” Biol Reprod 39(1): 66-75. Karsch, F. J., B. Malpaux, N. L. Wayne and J. E. Robinson (1988). “Characteristics of the melatonin signal that provide the photoperiodic code for timing seasonal reproduction in the ewe.” Reprod Nutr Dev (1980) 28(2b): 459-472. Stehle, J. H., C. von Gall, C. Schomerus and H. W. Korf (2001). “Of rodents and ungulates and melatonin: creating a uniform code for darkness by different signaling mechanisms.” J Biol Rhythms 16(4): 312-325.","[""https://academic.oup.com/biolreprod/article/39/1/66/2763526?login=false"", ""https://doi.org/10.1080/07494468900640201"", ""https://journals.sagepub.com/doi/10.1177/074873001129002033"", ""https://rnd.edpsciences.org/articles/rnd/abs/1988/03/RND_0181-1916_1988_28_2B_ART0011/RND_0181-1916_1988_28_2B_ART0011.html""]"
216,Melody code,The Neural Melody Code,"Narmour, E. (1989). The “genetic code” of melody: Cognitive structures generated by the implication-realization model. Contemporary Music Review, 4(1), 45-63. Samson, S., & Zatorre, R. J. (1991). Recognition memory for text and melody of songs after unilateral temporal lobe lesion: Evidence for dual encoding. Journal of Experimental Psychology: Learning, Memory, and Cognition, 17(4), 793–804. Plantinga, J., & Trainor, L. J. (2005). Memory for melody: infants use a relative pitch code. Cognition, 98(1), 1-11. Sankaran, N., Leonard, M. K., Theunissen, F., & Chang, E. F. (2024). Encoding of melody in the human auditory cortex. Sci Adv, 10(7), eadk0010.","[""https://doi.org/10.1016/j.cognition.2004.09.008"", ""https://doi.org/10.1037/0278-7393.17.4.793"", ""https://doi.org/10.1080/07494468900640201"", ""https://doi.org/10.1126/sciadv.adk0010"", ""https://pubmed.ncbi.nlm.nih.gov/3090630/""]"
217,Membrane code,The Membrane Code,"Halbhuber, K. J., W. Linss, N. Zimmermann, H. Oehring and L. Pätzold (1986). “Cytochemical and cellbiological investigations of the signal function of the erythrocyte plasmalemma–the membrane structure as code for cell life span.” Acta Histochem Suppl 33: 23-44. Lundin, C., H. Kim, I. Nilsson, S. H. White and G. von Heijne (2008). ""Molecular code for protein insertion in the endoplasmic reticulum membrane is similar for N(in)-C(out) and N(out)-C(in) transmembrane helices."" Proc Natl Acad Sci U S A 105(41): 15702-15707.","[""https://pubmed.ncbi.nlm.nih.gov/3090630/"", ""https://www.pnas.org/doi/10.1073/pnas.0804842105""]"
218,Memory code,The Memory Code,"Eichenbaum, H. (2001). “The hippocampus and declarative memory: cognitive mechanisms and neural codes.” Behavioural Brain Research 127(1): 199-207. Jensen, O. (2001). ""Information transfer between rhythmically coupled networks: reading the hippocampal phase code."" Neural Comput 13(12): 2743-2761. Chapouthier, G. (2004). From the Search for a Molecular Code of Memory to the Role of Neurotransmitters: A Historical Perspective. Neural Plast, 11(3-4), 318075. Wood, M. A., J. D. Hawk and T. Abel (2006). “Combinatorial chromatin modifications and memory storage: a code for memory?” Learn Mem 13(3): 241-244. Tsien, J. Z. (2007). ""The memory code. Researchers are closing in on the rules that the brain uses to lay down memories. Discovery of this memory code could lead to the design of smarter computers and robots and even to new ways to peer into the human mind."" Sci Am 297(1): 52-59. Jaramillo, J. and R. Kempter (2017). ""Phase precession: a neural code underlying episodic memory?"" Curr Opin Neurobiol 43: 130-138. Snider, K. H., K. A. Sullivan and K. Obrietan (2018). “Circadian Regulation of Hippocampal-Dependent Memory: Circuits, Synapses, and Molecular Mechanisms.” Neural Plast 2018: 7292540.","[""http://learnmem.cshlp.org/content/13/3/241"", ""https://direct.mit.edu/neco/article-abstract/13/12/2743/6552/Information-Transfer-Between-Rhythmically-Coupled"", ""https://doi.org/10.1155/NP.2004.151"", ""https://www.hindawi.com/journals/np/2018/7292540/"", ""https://www.sciencedirect.com/science/article/abs/pii/S0166432801003655"", ""https://www.sciencedirect.com/science/article/abs/pii/S0959438817300533"", ""https://www.scientificamerican.com/article/the-memory-code/""]"
219,Mercury Methylation Code,The Mercury Methylation Code,"Poulain, A. J., & Barkay, T. (2013). Cracking the Mercury Methylation Code. Science, 339(6125), 1280- 1281.","[""https://doi.org/10.1126/science.1235591"", ""https://www.frontiersin.org/articles/10.3389/fnmol.2021.592951/full""]"
220,MeshCODE,The Memory Code,"Goult, B. T. (2021). “The Mechanical Basis of Memory – the MeshCODE Theory.” Frontiers in Molecular Neuroscience 14. Barnett, S. F. H. and B. T. Goult (2022). “The MeshCODE to scale – Visualising synaptic binary information.” bioRxiv: 2022.2006.2016.496395.","[""https://www.biorxiv.org/content/10.1101/2022.06.16.496395v1"", ""https://www.frontiersin.org/articles/10.3389/fnmol.2021.592951/full"", ""https://www.sciencedirect.com/science/article/abs/pii/S0303264721001337""]"
221,Meta code,The Metacode,"Paredes, O., J. A. Morales, A. P. Mendizabal and R. Romo-Vázquez (2021). “Metacode: One code to rule them all.” Biosystems 208: 104486.","[""https://www.science.org/doi/10.1126/science.169570"", ""https://www.sciencedirect.com/science/article/abs/pii/S0303264721001337""]"
222,Metabolic code,The Metabolic Code,"Tomkins, G. M. (1975). “The Metabolic Code.” Science 189(4205): 760-763. Rousseau, G. G., & Baxter, J. D. (1979). Glucocorticoids and the metabolic code. Monogr Endocrinol, 12, 613-629. Zhao, X. Y. and J. D. Lin (2015). ""Long Noncoding RNAs: A New Regulatory Code in Metabolic Control."" Trends Biochem Sci 40(10): 586-596. Korošak, D. and M. Slak Rupnik (2018). “Collective Sensing of β-Cells Generates the Metabolic Code.” Front Physiol 9: 31. Neu, C., B. Ibrahim and P. Dittrich (2018). “Molecular Codes in Large Metabolic Network.” MATCH Commun. Math. Comput. Chem. 80: 587-604. Bukowski, M., M. Kosecka-Strojek, A. Madry, R. Zagorski-Przybylo, T. Zadlo, K. Gawron and B. Wladyka (2022). “Staphylococcal saoABC Operon Codes for a DNA-Binding Protein SaoC Implicated in the Response to Nutrient Deficit.” International Journal of Molecular Sciences 23(12): 6443.","[""https://doi.org/10.1007/978-3-642-81265-1_34"", ""https://linkinghub.elsevier.com/retrieve/pii/S0968-0004(15)00142-5"", ""https://match.pmf.kg.ac.rs/electronic_versions/Match80/n3/match80n3_587-604.pdf"", ""https://www.frontiersin.org/articles/10.3389/fphys.2018.00031/full"", ""https://www.mdpi.com/1422-0067/23/12/6443/"", ""https://www.science.org/doi/10.1126/science.169570""]"
223,Methylation code (DNA),The DNA Methylation Code,"Papin, C., A. Ibrahim, S. L. Gras, A. Velt, I. Stoll, B. Jost, H. Menoni, C. Bronner, S. Dimitrov and A. Hamiche (2017). “Combinatorial DNA methylation codes at repetitive elements.” Genome Res 27(6): 934-946.","[""https://doi.org/10.1111/cpr.13224"", ""https://genome.cshlp.org/content/27/6/934.long""]"
224,Methlyation code (RNA),The RNA Methlyation Code,"Song, D., & Shyh-Chang, N. (2022). An RNA methylation code to regulate protein translation and cell fate. Cell Prolif, 55(5), e13224.","[""https://doi.org/10.1016/j.critrevonc.2025.104813"", ""https://doi.org/10.1111/cpr.13224""]"
225,MHC code,The Major Histocompatibility Complex class II Code,"Liu, J., Song, X., Guo, W., Liu, W., Xu, S., Yang, Y., . . . Lei, Z. (2025). Unlock the code of MHC II-enabled Cancer immunotherapy. Critical Reviews in Oncology/Hematology, 214, 104813.","[""https://doi.org/10.1016/j.critrevonc.2025.104813"", ""https://onlinelibrary.wiley.com/doi/10.1002/bies.201700032""]"
226,Microbiome code,The Microbiome Composition Code,"Rosen, C. E. and N. W. Palm (2017). “Functional Classification of the Gut Microbiota: The Key to Cracking the Microbiota Composition Code: Functional classifications of the gut microbiota reveal previously hidden contributions of indigenous gut bacteria to human health and disease.” Bioessays 39(12). Sultana, M., Hossain, A., Noor, E. M., & Begum, A. (2026). Microbial Genomics: Unraveling the Healthomic Code. In A. H. M. N. Nabi & H. Uddin Shekhar (Eds.), Biotechnological Advances in Healthomics (pp. 13-33). Springer Nature Singapore. Tana, C., Bernardinello, N., & Spagnolo, P. (2026). Editorial: Unlocking the microbial code: potential role in sarcoidosis pathogenesis and treatment [Editorial]. Front Immunol, Volume 17 - 2026. Zhang, Y., Jia, Z., & Zhang, T. (2026). Microbes: the invisible codes of forensic science. Journal of Applied Microbiology, 137(3).","[""https://doi.org/10.1007/978-981-95-3612-2_2"", ""https://doi.org/10.1093/jambio/lxag043"", ""https://doi.org/10.3389/fimmu.2026.1796347"", ""https://onlinelibrary.wiley.com/doi/10.1002/bies.201700032""]"
227,Microenvironmental code,The Microenvironmental Codes SEE also Cancer Code,"Zhou, Q. Q., Ren, Y. M., Shi, S. M., & Liu, T. F. (2025). Microenvironmental code of pancreatic ductal adenocarcinoma: The prognostic symphony of budding, matrix and lymphocytes. World J Gastrointest Oncol, 17(10), 110523.","[""https://doi.org/10.4251/wjgo.v17.i10.110523"", ""https://nyaspubs.onlinelibrary.wiley.com/doi/abs/10.1111/j.1749-6632.1986.tb38483.x""]"
228,Microtubular code,The Microtubular Code,"Koruga, D. L. (1986). ""Microtubular screw symmetry: packing of spheres as a latent bioinformation code."" Ann N Y Acad Sci 466: 953-955.","[""https://doi.org/10.1016/j.envpol.2024.125586"", ""https://nyaspubs.onlinelibrary.wiley.com/doi/abs/10.1111/j.1749-6632.1986.tb38483.x""]"
229,Mineral code,The Mineral Codes,"Ding, Z., Han, G., Tian, Y., Qu, R., Liu, J., Wang, D., & Zhao, Y. (2025). Deciphering the mineral code of urinary stones: A first look at zinc isotopes. Environmental Pollution, 367, 125586.","[""https://doi.org/10.1016/j.envpol.2024.125586"", ""https://www.tandfonline.com/doi/abs/10.4161/cc.9.8.11202""]"
230,miRNA codes,The Micro-RNA Codes,"Forman, J. J. and H. A. Coller (2010). “The code within the code: microRNAs target coding regions.” Cell Cycle 9(8): 1533-1541. Shin, C., J. W. Nam, K. K. Farh, H. R. Chiang, A. Shkumatava and D. P. Bartel (2010). ""Expanding the microRNA targeting code: functional sites with centered pairing."" Mol Cell 38(6): 789-802. Pepe, S. (2012). “MicroRNAs in heart, lung and circulation (and beyond): life’s ubiquitous code for regulating complex function.” Heart Lung Circ 21(3): 127-128. Gheinani, A. H., Burkhard, F. C., & Monastyrskaya, K. (2013). Deciphering microRNA code in pain and inflammation: lessons from bladder pain syndrome. Cellular and Molecular Life Sciences, 70(20), 3773-3789. Cora, D. and M. Caselle (2018). “The Epithelial-Mesenchymal Transition, as Hacked by a microRNA Combinatorial Code.” Cell Syst 7(1): 3-4. Verduci, L., S. Strano, Y. Yarden and G. Blandino (2019). ""The circRNA-microRNA code: emerging implications for cancer diagnosis and treatment."" Mol Oncol 13(4): 669-680. Garcia-Martin, R., Wang, G., Brandão, B. B., Zanotto, T. M., Shah, S., Kumar Patel, S., . . . Kahn, C. R. (2022). MicroRNA sequence codes for small extracellular vesicle release and cellular retention. Nature, 601(7893), 446-451. Murakami, S., & Jaffrey, S. R. (2022). Hidden codes in mRNA: Control of gene expression by m6A. Molecular Cell, 82(12), 2236-2251. Fujii, Y. R. (2023). The MicroRNA Quantum Code Book. Springer Singapore.","[""https://doi.org/10.1007/978-981-19-8586-7"", ""https://doi.org/10.1007/s00018-013-1275-7"", ""https://doi.org/10.1016/j.molcel.2022.05.029"", ""https://doi.org/10.1038/s41586-021-04234-3"", ""https://febs.onlinelibrary.wiley.com/doi/10.1002/1878-0261.12468"", ""https://linkinghub.elsevier.com/retrieve/pii/S1443-9506(12)00030-3"", ""https://www.cell.com/cell-systems/fulltext/S2405-4712(18)30282-5"", ""https://www.cell.com/molecular-cell/fulltext/S1097-2765(10)00446-6"", ""https://www.nature.com/articles/srep21907"", ""https://www.tandfonline.com/doi/abs/10.4161/cc.9.8.11202""]"
231,Mirror code,The Cholesterol Recognition/Mirror Code,"Fantini, J., C. Di Scala, L. S. Evans, P. T. F. Williamson and F. J. Barrantes (2016). “A mirror code for protein-cholesterol interactions in the two leaflets of biological membranes.” Scientific Reports 6(1): 21907.","[""https://www.nature.com/articles/srep21907""]"
232,Mitochondrial genetic code,The Mitochondrial Genetic Code,"Swire, J., O. P. Judson and A. Burt (2005). “Mitochondrial genetic codes evolve to match amino acid requirements of proteins.” J Mol Evol 60(1): 128-139. Sengupta, S., X. Yang and P. G. Higgs (2007). “The Mechanisms of Codon Reassignments in Mitochondrial Genetic Codes.” Journal of Molecular Evolution 64(6): 662-688.","[""https://link.springer.com/article/10.1007/s00239-004-0077-9"", ""https://link.springer.com/article/10.1007/s00239-006-0284-7"", ""https://link.springer.com/article/10.1007/s00412-007-0138-0""]"
233,Mitosis codes,The Mitosis Codes SEE also Tubulin codes,"Bloom, K. S. (2008). “Beyond the code: the mechanical properties of DNA as they relate to mitosis.” Chromosoma 117(2): 103-110. Georgatos, S. D., Y. Markaki, A. Christogianni and A. S. Politou (2009). “Chromatin remodeling during mitosis: a structure-based code?” Front Biosci (Landmark Ed) 14(6): 2017-2027. Barisic, M. and H. Maiato (2015). “Cracking the (tubulin) code of mitosis.” Oncotarget 6(23): 19356- 19357. Ferreira, L. T., A. C. Figueiredo, B. Orr, D. Lopes and H. Maiato (2018). Chapter 3 – Dissecting the role of the tubulin code in mitosis. Methods in Cell Biology. H. Maiato and M. Schuh, Academic Press. 144: 33-74. Lopes, D. and H. Maiato (2020). “The Tubulin Code in Mitosis and Cancer.” Cells 9(11): 2356.","[""https://link.springer.com/article/10.1007/s00412-007-0138-0"", ""https://www.cell.com/neuron/fulltext/S0896-6273(03)00728-1"", ""https://www.imrpress.com/journal/FBL/14/6/10.2741/3360"", ""https://www.mdpi.com/2073-4409/9/11/2356"", ""https://www.oncotarget.com/article/5108/"", ""https://www.sciencedirect.com/science/article/abs/pii/S0091679X18300402""]"
234,Mnemonic code,The Mnemonic codes,"Goosens, K. A., J. A. Hobin and S. Maren (2003). ""Auditory-evoked spike firing in the lateral amygdala and Pavlovian fear conditioning: mnemonic code or fear bias?"" Neuron 40(5): 1013-1022. Patai, E. Z. and H. J. Spiers (2016). “Cracking the mnemonic code.” Nat Neurosci 20(1): 8-9.","[""https://www.cell.com/neuron/fulltext/S0896-6273(03)00728-1"", ""https://www.nature.com/articles/nn.4466"", ""https://www.tandfonline.com/doi/abs/10.4161/cc.19990""]"
235,Modification code,The RNA Polymerase Modification Codes,"Brookes, E. and A. Pombo (2012). “Code breaking: The RNAPII modification code in pluripotency.” Cell Cycle 11(7): 1267-1268.","[""https://www.sciencedirect.com/science/article/abs/pii/S0303264722001198"", ""https://www.tandfonline.com/doi/abs/10.4161/cc.19990""]"
236,Modularity codes,The Modularity Codes,"Prinz, R. (2022). “The modularity codes.” Biosystems 219: 104735.","[""https://rupress.org/jcb/article/179/6/1193/54124/A-molecular-specificity-code-for-the-three"", ""https://www.sciencedirect.com/science/article/abs/pii/S0303264722001198""]"
237,Molecular codes,The Molecular Codes,"Raykhel, I., H. Alanen, K. Salo, J. Jurvansuu, V. D. Nguyen, M. Latva-Ranta and L. Ruddock (2007). ""A molecular specificity code for the three mammalian KDEL receptors."" J Cell Biol 179(6): 1193-1204. De Beule, J., E. Hovig and M. Benson (2011). “Introducing Dynamics into the Field of Biosemiotics.” Biosemiotics 4(1): 5-24.","[""https://link.springer.com/article/10.1007/s12304-010-9101-1"", ""https://rupress.org/jcb/article/179/6/1193/54124/A-molecular-specificity-code-for-the-three""]"
238,Monocyte code,The Monocyte Codes SEE also Fibrotic Code,"Hedrick, C. C. (2024). Single-Cell Sleuthing: Cracking the Monocyte Code for Cardiovascular Clues. Circ Res, 135(6), 701-703. Curioni, A. V., Crestani, B., & Helou, D. G. (2026). Reading the monocyte code in idiopathic pulmonary fibrosis. Eur Respir J, 67(5).","[""https://doi.org/10.1161/CIRCRESAHA.124.325134"", ""https://doi.org/10.1183/13993003.00349-2026"", ""https://www.nature.com/articles/s41598-017-14170-w""]"
239,Morphogenetic code,The Morphogenetic Code,"Matsuda, K., H. Gotoh, Y. Tajika, T. Sushida, H. Aonuma, T. Niimi, M. Akiyama, Y. Inoue and S. Kondo (2017). “Complex furrows in a 2D epithelial sheet code the 3D structure of a beetle horn.” Sci Rep 7(1): 13939. Tassinari, R., C. Cavallini, E. Olivi, V. Taglioli, C. Zannini and C. Ventura (2021). ""Unveiling the morphogenetic code: A new path at the intersection of physical energies and chemical signaling."" World J Stem Cells 13(10): 1382-1393. Tassinari, R., C. Cavallini, E. Olivi, F. Facchin, V. Taglioli, C. Zannini, M. Marcuzzi and C. Ventura (2022). “Cell Responsiveness to Physical Energies: Paving the Way to Decipher a Morphogenetic Code.” Int J Mol Sci 23(6). Qin, J., Kinobe, R., Schaeffer, P. M., & Hong, Y. (2025). The bacterial cell envelope as a morphogenetic code for biofilm development. Microbiology Australia, 46(4), 227-230.","[""https://doi.org/10.1071/ma25064"", ""https://www.cell.com/current-biology/fulltext/S0960-9822(95)00100-X"", ""https://www.mdpi.com/1422-0067/23/6/3157"", ""https://www.nature.com/articles/s41598-017-14170-w"", ""https://www.wjgnet.com/1948-0210/full/v13/i10/1382.htm""]"
240,Motor neuron code,The Motor Neuron Codes,"Lumsden, A. (1995). ""Neural development. A 'LIM code' for motor neurons?"" Curr Biol 5(5): 491-495. Thor, S., S. G. Andersson, A. Tomlinson and J. B. Thomas (1999). ""A LIM-homeodomain combinatorial code for motor-neuron pathway selection."" Nature 397(6714): 76-80. Glaze, C. M. and T. W. Troyer (2007). ""Behavioral measurements of a temporally precise motor code for birdsong."" J Neurosci 27(29): 7631-7639. Stein, W., O. Straub, J. Ausborn, W. Mader and H. Wolf (2008). “Motor pattern selection by combinatorial code of interneuronal pathways.” J Comput Neurosci 25(3): 543-561.","[""https://link.springer.com/article/10.1007/s10827-008-0093-7"", ""https://www.cell.com/current-biology/fulltext/S0960-9822(95)00100-X"", ""https://www.jneurosci.org/content/27/29/7631.long"", ""https://www.nature.com/articles/16275""]"
241,mRNA degradation code,The mRNA Degradation Code SEE also  mRNA Stability Code,"Alonso, C. R. (2012). A complex &#x2018;mRNA degradation code&#x2019; controls gene expression during animal development. Trends in Genetics, 28(2), 78-88.","[""https://doi.org/10.1016/j.tig.2011.10.005"", ""https://doi.org/10.1016/j.tig.2016.08.007""]"
242,mRNA stability code,The Universal mRNA Stability Code SEE also mRNA Degradation Code,"Chen, Y.-H., & Coller, J. (2016). A Universal Code for mRNA Stability? Trends in Genetics, 32(11), 687- 688.","[""https://doi.org/10.1016/j.tig.2016.08.007"", ""https://doi.org/10.1076/jnmr.30.2.107.7115""]"
243,Musical code,The Musical Codes,"Cariani, P. (2001). Temporal Codes, Timing Nets, and Music Perception. Journal of New Music Research, 30(2), 107-135. Reybrouck, M. (2008). The Musical Code between Nature and Nurture: Ecosemiotic and Neurobiological Claims. The Codes of Life: The Rules of Macroevolution. M. Barbieri and J. Hoffmeyer. Dordrecht, Springer Netherlands: 395-434.","[""https://doi.org/10.1076/jnmr.30.2.107.7115"", ""https://link.springer.com/chapter/10.1007/978-1-4020-6340-4_18""]"
244,Mutualism code,The Mutualism Ant-Plant Code,"Letourneau, D. K. (1990). “Code of ant-plant mutualism broken by parasite.” Science 248(4952): 215- 217.","[""https://www.jneurosci.org/content/23/32/10214"", ""https://www.science.org/doi/10.1126/science.248.4952.215""]"
245,Myelin code,The Myelin Code,"Farhadi, H. F., P. Lepage, R. Forghani, H. C. H. Friedman, W. Orfali, L. Jasmin, W. Miller, T. J. Hudson and A. C. Peterson (2003). “A Combinatorial Network of Evolutionarily Conserved Myelin Basic Protein Regulatory Sequences Confers Distinct Glial-Specific Phenotypes.” The Journal of Neuroscience 23(32): 10214-10223. Wood, H. (2004). “A time code for myelin.” Nature Reviews Neuroscience 5(1): 9-9.","[""https://link.springer.com/article/10.1007/BF00613802"", ""https://www.jneurosci.org/content/23/32/10214"", ""https://www.nature.com/articles/nrn1306""]"
246,Navigation codes,The Navigation / Orientation / Movement Codes,"Camhi, J. M. and A. Levy (1989). ""The code for stimulus direction in a cell assembly in the cockroach."" J Comp Physiol A 165(1): 83-97. Frens, M. A., Y. Suzuki, H. Scherberger, K. Hepp and V. Henn (1998). ""The collicular code of saccade direction depends on the roll orientation of the head relative to gravity."" Exp Brain Res 120(3): 283- 290. Erdi, P., Z. Huhn and T. Kiss (2005). “Hippocampal theta rhythms from a computational perspective: code generation, mood regulation and navigation.” Neural Netw 18(9): 1202-1211. Bremner, A. J., D. Mareschal, S. Lloyd-Fox and C. Spence (2008). ""Spatial localization of touch in the first year of life: early influence of a visual spatial code and the development of remapping across changes in limb position."" J Exp Psychol Gen 137(1): 149-162. Nadler, J. W., M. Nawrot, D. E. Angelaki and G. C. DeAngelis (2009). “MT neurons combine visual motion with a smooth eye movement signal to code depth-sign from motion parallax.” Neuron 63(4): 523-532. Takahashi, M., J. Lauwereyns, Y. Sakurai and M. Tsukada (2009). ""A code for spatial alternation during fixation in rat hippocampal CA1 neurons."" J Neurophysiol 102(1): 556-567. Khosravi-Hashemi, N. and M. J. Chacron (2012). “Bursts and isolated spikes code for opposite movement directions in midbrain electrosensory neurons.” PloS One 7(6): e40339.","[""https://journals.physiology.org/doi/full/10.1152/jn.91159.2008"", ""https://journals.plos.org/plosone/article?id=10.1371/journal.pone.0040339"", ""https://link.springer.com/article/10.1007/BF00613802"", ""https://link.springer.com/article/10.1007/s002210050402"", ""https://linkinghub.elsevier.com/retrieve/pii/S0896-6273(09)00584-4"", ""https://psycnet.apa.org/record/2008-01081-010"", ""https://www.sciencedirect.com/science/article/abs/pii/S0893608005001942""]"
247,Nerve growth code,The Nerve Growth Factor Code,"Ottoson, D. (1999). “The unravelling of the code of nerve growth: a modern Saga of the dedication to science.” Brain Res Bull 50(5-6): 473-474. Beaujean, D., Rosenbaum, C., Müller, H.-W., Willemsen, J. J., Lenders, J., & Bornstein, S. R. (2003). Combinatorial code of growth factors and neuropeptides define neuroendocrine differentiation in PC12 cells. Exp Neurol, 184(1), 348-358. Morris, A. J., Parker, R. S., Nazzal, M. K., Natoli, R. M., Fehrenbacher, J. C., Kacena, M. A., & White, F. A. (2024). Cracking the Code: The Role of Peripheral Nervous System Signaling in Fracture Repair. Current Osteoporosis Reports, 22(1), 193-204.","[""https://link.springer.com/article/10.1007/BF00610965"", ""https://link.springer.com/article/10.1007/s11914-023-00846-y"", ""https://www.sciencedirect.com/science/article/abs/pii/S0014488603003625"", ""https://www.sciencedirect.com/science/article/abs/pii/S0361923099001409""]"
248,Neural codes – A (general),The General Neural Codes,"Rose, G. J., M. Kawasaki and W. Heiligenberg (1988). ""'Recognition units' at the top of a neuronal hierarchy? Prepacemaker neurons in Eigenmannia code the sign of frequency differences unambiguously."" J Comp Physiol A 162(6): 759-772. Bialek, W., F. Rieke, R. R. de Ruyter van Steveninck and D. Warland (1991). “Reading a neural code.” Science 252(5014): 1854-1857.","[""https://link.springer.com/article/10.1007/BF00610965"", ""https://www.science.org/doi/10.1126/science.2063199""]"
