Number,Code Name,Description,Citations,URLs
325,Recombination codes,The Genetic Recombination Codes,"Jabbari, K., J. Wirtz, M. Rauscher and T. Wiehe (2019). “A common genomic code for chromatin architecture and recombination landscape.” PloS One 14(3): e0213278. Paulet, L., A. Trecourt, A. Leary, J. Peron, F. Descotes, M. Devouassoux-Shisheboran, K. Leroy, B. You and J. Lopez (2022). “Cracking the homologous recombination deficiency code: how to identify responders to PARP inhibitors.” Eur J Cancer 166: 87-99.","[""https://journals.plos.org/plosone/article?id=10.1371/journal.pone.0213278"", ""https://link.springer.com/article/10.1007/s004270050204"", ""https://www.ejcancer.com/article/S0959-8049(22)00070-3/fulltext""]"
326,Regeneration code,The Regeneration Codes,"Bayascas, J. R., E. Castillo and E. Saló (1998). ""Platyhelminthes have a hox code differentially activated during regeneration, with genes closely related to those of spiralian protostomes."" Dev Genes Evol 208(8): 467-473. Cencioni, C., F. Spallotta, A. Farsetti, A. M. Zeiher and C. Gaetano (2017). ""Deciphering Histone Code Enigmas Sheds New Light on Cardiac Regeneration."" Circ Res 120(9): 1370-1372. de Jong, D. M. and E. C. Seaver (2016). ""A Stable Thoracic Hox Code and Epimorphosis Characterize Posterior Regeneration in Capitella teleta."" PLoS One 11(2): e0149724.","[""https://journals.plos.org/plosone/article?id=10.1371/journal.pone.0149724"", ""https://link.springer.com/article/10.1007/s004270050204"", ""https://www.ahajournals.org/doi/10.1161/CIRCRESAHA.117.310919""]"
327,Redox code,The Redox Code,"Helmann, J. D. (2002). “OxyR: a molecular code for redox sensing?” Sci STKE 2002(157): pe46. Jones, D. P. and H. Sies (2015). “The Redox Code.” Antioxid Redox Signal 23(9): 734-746. Vučetić, M., Cormerais, Y., Parks, S. K., & Pouysségur, J. (2017). The Central Role of Amino Acids in Cancer Redox Homeostasis: Vulnerability Points of the Cancer Redox Code. Front Oncol, 7, 319. Jiang, J., Peng, L., Wang, K., & Huang, C. (2021). Moonlighting Metabolic Enzymes in Cancer: New Perspectives on the Redox Code. Antioxid Redox Signal, 34(13), 979-1003. Zuo, J., Zhang, Z., Li, M., Yang, Y., Zheng, B., Wang, P., . . . Zhou, S. (2022). The crosstalk between reactive oxygen species and noncoding RNAs: from cancer code to drug role. Molecular Cancer, 21(1), 30. Mittler, R., & Jones, D. P. (2024). The redox code of plants. Plant, Cell & Environment, 47(8), 2821- 2829. Percio, A., Cicchinelli, M., Masci, D., Summo, M., Urbani, A., & Greco, V. (2024). Oxidative Cysteine Post Translational Modifications Drive the Redox Code Underlying Neurodegeneration and Amyotrophic Lateral Sclerosis. Antioxidants, 13(8), 883. Thorley, J. (2024). Unraveling the redox code to improve physiological research in human health and disease. Physiological Reports, 12(21), e70105.","[""https://doi.org/10.1089/ars.2020.8123"", ""https://doi.org/10.1111/pce.14787"", ""https://doi.org/10.1186/s12943-021-01488-3"", ""https://doi.org/10.14814/phy2.70105"", ""https://doi.org/10.3389/fonc.2017.00319"", ""https://journals.physiology.org/doi/full/10.1152/physiol.00009.2004"", ""https://www.liebertpub.com/doi/10.1089/ars.2015.6247"", ""https://www.mdpi.com/2076-3921/13/8/883"", ""https://www.science.org/doi/10.1126/stke.2002.157.pe46""]"
328,Renal code,The Renal Codes,"Gawlik, A. and S. E. Quaggin (2004). ""Deciphering the renal code: advances in conditional gene targeting."" Physiology (Bethesda) 19: 245-252. Endre, Z. H. and M. Fernando (2016). ""Unlocking the code: mining the urinary proteome after renal transplantation."" Kidney Int 89(6): 1183-1185.","[""https://cdnsciencepub.com/doi/10.1139/o05-034"", ""https://journals.physiology.org/doi/full/10.1152/physiol.00009.2004"", ""https://linkinghub.elsevier.com/retrieve/pii/S0085-2538(16)30050-3""]"
329,Repair code,The DNA Repair / Damage Codes,"Hassa, P. O. and M. O. Hottiger (2005). ""An epigenetic code for DNA damage repair pathways?"" Biochem Cell Biol 83(3): 270-285. van Attikum, H. and S. M. Gasser (2005). “The histone code at DNA breaks: a guide to repair?” Nature Reviews Molecular Cell Biology 6(10): 757-765.","[""https://cdnsciencepub.com/doi/10.1139/o05-034"", ""https://www.nature.com/articles/nrm1737""]"
330,Representation code,The Representation Codes,"Floyd, B., T. Santander and W. Weimer (2017). Decoding the Representation of Code in the Brain: An th fMRI Study of Code Review and Expertise. 2017 IEEE/ACM 39 International Conference on Software Engineering (ICSE).","[""https://ieeexplore.ieee.org/document/7985660"", ""https://physoc.onlinelibrary.wiley.com/doi/abs/10.1113/jphysiol.1968.sp008457""]"
331,Retina code,The Retinal Codes,"Easter, S. S., Jr. (1968). ""Excitation in the goldfish retina: evidence for a non-linear intensity code."" J Physiol 195(2): 253-271. Bäckström, A. C., Hemilä, S., & Reuter, T. (1978). Directional selectivity and colour coding in the frog retina. Medical biology, 56(2), 72-83. Meister, M. (1996). Multineuronal codes in retinal signaling. Proceedings of the National Academy of Sciences, 93(2), 609-614. Meister, M. and M. J. Berry, 2nd (1999). ""The neural code of the retina."" Neuron 22(3): 435-450. Victor, J. D. (1999). Temporal aspects of neural coding in the retina and lateral geniculate. Network: Computation in Neural Systems, 10(4), R1-R66.","[""http://europepmc.org/abstract/MED/307098"", ""https://doi.org/10.1088/0954-898X_10_4_201"", ""https://doi.org/doi:10.1073/pnas.93.2.609"", ""https://physoc.onlinelibrary.wiley.com/doi/abs/10.1113/jphysiol.1968.sp008457"", ""https://www.cell.com/neuron/fulltext/S0896-6273(00)80700-X""]"
332,Retinoblastoma code,The pRb (Retinoblastoma) Code,"Munro, S., S. M. Carr and N. B. La Thangue (2012). ""Diversity within the pRb pathway: is there a code of conduct?"" Oncogene 31(40): 4343-4352. Rubin, S. M. (2013). Deciphering the retinoblastoma protein phosphorylation code. Trends Biochem Sci, 38(1), 12-19. Sanidas, I., Morris, R., Fella, K. A., Rumde, P. H., Boukhali, M., Tai, E. C., . . . Dyson, N. J. (2019). A Code of Mono-phosphorylation Modulates the Function of RB. Molecular Cell, 73(5), 985- 1000.e1006.","[""https://doi.org/10.1016/j.tibs.2012.10.007"", ""https://doi.org/10.1101/sqb.1966.031.01.008"", ""https://www.cell.com/molecular-cell/fulltext/S1097-2765(19)30004-8"", ""https://www.nature.com/articles/onc2011603""]"
333,RNA code -A (miscellaneous),The RNA Codes,"Nirenberg, M., Caskey, T., Marshall, R., Brimacombe, R., Kellogg, D., Doctor, B., . . . Anderson, F. (1966). The RNA code and protein synthesis. Cold Spring Harb Symp Quant Biol, 31, 11-24. José, M. V., E. R. Morgado and T. Govezensky (2006). “An Extended RNA Code and its Relationship to the Standard Genetic Code: An Algebraic and Geometrical Approach.” Bulletin of Mathematical Biology 69(1): 215.","[""https://doi.org/10.1101/sqb.1966.031.01.008"", ""https://link.springer.com/article/10.1007/s11538-006-9119-3""]"
334,RNA code -B (lnc),The lncRNA Codes,"Aprea, J., & Calegari, F. (2015). Long non-coding RNAs in corticogenesis: deciphering the non-coding code of the brain. Embo j, 34(23), 2865-2884. Zhao, X. Y., & Lin, J. D. (2015). Long Noncoding RNAs: A New Regulatory Code in Metabolic Control. Trends Biochem Sci, 40(10), 586-596.","[""https://doi.org/10.1016/j.tibs.2015.08.002"", ""https://doi.org/10.15252/embj.201592655""]"
335,RNA code -C (operational),The Operational RNA Code,"Schimmel, P., R. Giegé, D. Moras and S. Yokoyama (1993). “An operational RNA code for amino acids and possible relationship to genetic code.” Proceedings of the National Academy of Sciences 90(19): 8763-8768. Schimmel, P. (1995). An operational RNA code for amino acids and variations in critical nucleotide sequences in evolution. J Mol Evol, 40(5), 531-536. Schimmel, P., & Ripmaster, T. (1995). Modular design of components of the operational RNA code for alanine in evolution. Trends Biochem Sci, 20(9), 333-334. Stehlin, C., Burke, B., Yang, F., Liu, H., Shiba, K., & Musier-Forsyth, K. (1998). Species-specific differences in the operational RNA code for aminoacylation of tRNAPro. Biochemistry, 37(23), 8605- 8613. Xu, F., Chen, X., Xin, L., Chen, L., Jin, Y., & Wang, D. (2001). Species-specific differences in the operational RNA code for aminoacylation of tRNA(Trp). Nucleic Acids Res, 29(20), 4125-4133. Jones, T. E., Brown, C. L., Geslain, R., Alexander, R. W., & Ribas de Pouplana, L. (2008). An operational RNA code for faithful assignment of AUG triplets to methionine. Mol Cell, 29(3), 401-407. Shaul, S., D. Berel, Y. Benjamini and D. Graur (2010). “Revisiting the operational RNA code for amino acids: Ensemble attributes and their implications.” Rna 16(1): 141-153.","[""https://doi.org/10.1007/bf00166621"", ""https://doi.org/10.1016/j.molcel.2007.12.021"", ""https://doi.org/10.1016/s0968-0004(00)89067-2"", ""https://doi.org/10.1021/bi980364s"", ""https://doi.org/10.1093/nar/29.20.4125"", ""https://rnajournal.cshlp.org/content/16/1/141.long"", ""https://www.pnas.org/doi/10.1073/pnas.90.19.8763""]"
336,RNA code -D (sno),The snoRNA Code,"Li, Y., Chen, X., Xiao, S., Wang, H., Li, B., Zhang, M., & Wang, K. (2025). Unlocking the life code: a review of SnoRNA functional diversity and disease relevance. Cell Communication and Signaling, 23(1), 266.","[""https://doi.org/10.1016/j.molcel.2025.03.010"", ""https://doi.org/10.1186/s12964-025-02274-0""]"
337,RNA degradation code,The RNA Degradations Codes,"Soles, L. V., Liu, L., Zou, X., Yoon, Y., Li, S., Tian, L., . . . Shi, Y. (2025). A nuclear RNA degradation code is recognized by PAXT for eukaryotic transcriptome surveillance. Molecular Cell, 85(8), 1575- 1588.e1579.","[""https://doi.org/10.1016/j.molcel.2025.03.010"", ""https://doi.org/10.1146/annurev-biochem-052521-035330""]"
338,RNA editing/modification code,The RNA Editing/Modification Codes,"Flamand, M. N., Tegowski, M., & Meyer, K. D. (2023). The Proteins of mRNA Modification: Writers, Readers, and Erasers. Annu Rev Biochem, 92(Volume 92, 2023), 145-173. Xuan, J., Chen, L., Chen, Z., Pang, J., Huang, J., Lin, J., . . . Yang, J. (2023). RMBase v3.0: decode the landscape, mechanisms and functions of RNA modifications. Nucleic Acids Res, 52(D1), D273-D284. Yang, Y., Ritzenhofen, K., Otrzonsek, J., Xie, J., Schallenberg-Rüdinger, M., & Knoop, V. (2023). Beyond a PPR-RNA recognition code: Many aspects matter for the multi-targeting properties of RNA editing factor PPR56. PLoS Genet, 19(8), e1010733. Sachse, M., & Stellos, K. (2024). Unraveling the RNA code: a uridine RNA modification drives glycoRNA biogenesis. Signal Transduction and Targeted Therapy, 9(1), 334. Fang, H., He, J., Du, D., Wang, X., Xu, X., Lu, L., . . . Zhou, M. (2025). Deciphering the secret codes in N7-methylguanosine modification: Context-dependent function of methyltransferase-like 1 in human diseases. Clin Transl Med, 15(2), e70240. Yu, H., Ma, Z., Su, S., Xu, Z., & Yi, H. (2025). RNA modification: a promising code to unravel the puzzle of autoimmune diseases and CD4(+) T cell differentiation. Front Immunol, 16, 1563150. Min, D. J., Lee, S., Lee, Y.-s., & Cho, J. (2026). Two codes of RNA editing by deamination in human diseases. Experimental & Molecular Medicine, 58(2), 382-395.","[""https://doi.org/10.1002/ctm2.70240"", ""https://doi.org/10.1038/s12276-025-01633-8"", ""https://doi.org/10.1038/s41392-024-02056-z"", ""https://doi.org/10.1093/nar/gkad1070"", ""https://doi.org/10.1146/annurev-biochem-052521-035330"", ""https://doi.org/10.1371/journal.pgen.1010733"", ""https://doi.org/10.3389/fimmu.2025.1563150"", ""https://link.springer.com/chapter/10.1007/1-4020-4814-9_14""]"
339,RNAi code,The RNA-Interference Codes,"Faria, M. (2007). RNA As Code Makers: A Biosemiotic View Of RNAi And Cell Immunity. Introduction to Biosemiotics: The New Biological Synthesis. M. Barbieri. Dordrecht, Springer Netherlands: 347- 364. Siomi, H. and M. C. Siomi (2009). “On the road to reading the RNA-interference code.” Nature 457(7228): 396-404.","[""https://link.springer.com/chapter/10.1007/1-4020-4814-9_14"", ""https://www.nature.com/articles/nature07754""]"
340,RNA recognition code,The RNA Recognition Code,"Pitici, F., D. L. Beveridge and A. M. Baranger (2002). ""Molecular dynamics simulation studies of induced fit and conformational capture in U1A-RNA binding: do molecular substates code for specificity?"" Biopolymers 65(6): 424-435. Yeo, G. W., N. G. Coufal, T. Y. Liang, G. E. Peng, X. D. Fu and F. H. Gage (2009). ""An RNA code for the FOX2 splicing regulator revealed by mapping RNA-protein interactions in stem cells."" Nat Struct Mol Biol 16(2): 130-137. Yarus, M., J. J. Widmann and R. Knight (2009). ""RNA-amino acid binding: a stereochemical era for the genetic code."" J Mol Evol 69(5): 406-429. Filipovska, A., M. F. Razif, K. K. Nygård and O. Rackham (2011). “A universal code for RNA recognition by PUF proteins.” Nat Chem Biol 7(7): 425-427. Chen, Y. and G. Varani (2011). “Finding the missing code of RNA recognition by PUF proteins.” Chem Biol 18(7): 821-823. Barkan, A., M. Rojas, S. Fujii, A. Yap, Y. S. Chong, C. S. Bond and I. Small (2012). ""A combinatorial amino acid code for RNA recognition by pentatricopeptide repeat proteins."" PLoS Genet 8(8): e1002910. Cléry, A., J. Boudet and F. H. Allain (2013). “Single-stranded nucleic acid recognition: is there a code after all?” Structure 21(1): 4-6. Yagi, Y., Hayashi, S., Kobayashi, K., Hirayama, T., & Nakamura, T. (2013). Elucidation of the RNA Recognition Code for Pentatricopeptide Repeat Proteins Involved in Organelle RNA Editing in Plants. PLoS One, 8(3), e57286. Yin, P., Li, Q., Yan, C., Liu, Y., Liu, J., Yu, F., . . . Yan, N. (2013). Structural basis for the modular recognition of single-stranded RNA by PPR proteins. Nature, 504(7478), 168-171. Hennig, J., F. Gebauer and M. Sattler (2014). “Breaking the protein-RNA recognition code.” Cell Cycle 13(23): 3619-3620. Campbell, Z. T., C. T. Valley and M. Wickens (2014). ""A protein-RNA specificity code enables targeted activation of an endogenous human transcript."" Nat Struct Mol Biol 21(8): 732-738. Nahalka, J. (2014). Protein–RNA recognition: Cracking the code. J Theor Biol, 343, 9-15.","[""https://doi.org/10.1016/j.jtbi.2013.11.006"", ""https://doi.org/10.1038/nature12651"", ""https://doi.org/10.1371/journal.pone.0057286"", ""https://journals.plos.org/plosgenetics/article?id=10.1371/journal.pgen.1002910"", ""https://link.springer.com/article/10.1007/s00239-009-9270-1"", ""https://onlinelibrary.wiley.com/doi/10.1002/bip.10251"", ""https://www.cell.com/structure/fulltext/S0969-2126(12)00461-3"", ""https://www.nature.com/articles/nchembio.577"", ""https://www.nature.com/articles/nsmb.1545"", ""https://www.nature.com/articles/nsmb.2847"", ""https://www.sciencedirect.com/science/article/pii/S1074552111002304?"", ""https://www.tandfonline.com/doi/full/10.4161/15384101.2014.986625""]"
341,RNA Structure code,The RNA Structure Codes,"Hou, Y. M. and P. Schimmel (1988). “A simple structural feature is a major determinant of the identity of a transfer RNA.” Nature 333(6169): 140-145. Izumi, H., Nafie, L. A., & Dukor, R. K. (2025). Supersecondary Structure Code for RNA: Trace of Conformational Change on the Mycoplasma pneumoniae Ribosome and the R-Loop Formation of Cas9. ACS Omega, 10(5), 4998-5005.","[""https://doi.org/10.1016/j.immuni.2026.03.021"", ""https://doi.org/10.1021/acsomega.4c10681"", ""https://www.nature.com/articles/333140a0""]"
342,γ RORt code,The  RORt Code,"Brown, C. C. (2026). Runx writes the RORγt code for immune tolerance. Immunity, 59(4), 928-930.","[""https://doi.org/10.1002/bies.202400144"", ""https://doi.org/10.1016/j.immuni.2026.03.021""]"
343,R-Spondin code,The R-Spondin Signalling Code,"Niehrs, C., Seidl, C., & Lee, H. (2024). An 'R-spondin code' for multimodal signaling ON-OFF states. Bioessays, 46(10), 2400144.","[""https://besjournals.onlinelibrary.wiley.com/doi/full/10.1111/j.1365-2435.2009.01627.x"", ""https://doi.org/10.1002/bies.202400144""]"
344,Scent codes,The Mammalian Scent Codes SEE also Olfactory codes,"Wright, G. A. and F. P. Schiestl (2009). “The evolution of floral scent: the influence of olfactory learning by insect pollinators on the honest signalling of floral rewards.” Functional Ecology 23(5): 841-851. Ferrero, D. M. and S. D. Liberles (2010). “The secret codes of mammalian scents.” WIREs Systems Biology and Medicine 2(1): 23-33.","[""https://besjournals.onlinelibrary.wiley.com/doi/full/10.1111/j.1365-2435.2009.01627.x"", ""https://doi.org/10.1073/pnas.1100247108"", ""https://wires.onlinelibrary.wiley.com/doi/abs/10.1002/wsbm.39""]"
345,Second messenger code,The Second Messenger Codes,"Nicol, X., Hong, K. P., & Spitzer, N. C. (2011). Spatial and temporal second messenger codes for growth cone turning. Proceedings of the National Academy of Sciences, 108(33), 13776-13781.","[""https://doi.org/10.1073/pnas.1100247108""]"
346,Secretory code,The Neutrophil Secretory Code,"Weissmann, G., Korchak, H. M., Perez, H. D., Smolen, J. E., Goldstein, I. M., & Hoffstein, S. T. (1979). The secretory code of the neutrophil. J Reticuloendothel Soc, 26(Suppl), 687-700. Smolen, J. E., Korchak, H. M., & Weissmann, G. (1981). The ""secretory code"" of the neutrophil. Methods Cell Biol, 23, 461-481.","[""https://doi.org/10.1093/plcell/koaf072"", ""https://pubmed.ncbi.nlm.nih.gov/230347/""]"
347,Seed code,The Seed Germination Code SEE also Dormancy Codes,"Kamble, N. U. (2025). Cracking the seed code: How nitrate directly breaks ABA signaling for germination. Plant Cell, 37(6).","[""https://doi.org/10.1093/plcell/koaf072"", ""https://www.cell.com/current-biology/fulltext/S0960-9822(15)00659-4""]"
348,Segregation code,The Chromosome Segregation Code,"Monda, J. K. and I. M. Cheeseman (2015). “Chromosome Segregation: A Spatial Code to Correct Kinetochore-Microtubule Attachments.” Curr Biol 25(14): R601-603.","[""https://onlinelibrary.wiley.com/doi/10.1111/j.1460-9568.2005.04021.x"", ""https://www.cell.com/current-biology/fulltext/S0960-9822(15)00659-4""]"
349,Semaphorin code,The Semaphoring Codes,"Cohen, S., L. Funkelstein, J. Livet, G. Rougon, C. E. Henderson, V. Castellani and F. Mann (2005). ""A semaphorin code defines subpopulations of spinal motor neurons during mouse development."" Eur J Neurosci 21(7): 1767-1776. Berke, B. and H. Keshishian (2011). “Cracking the combinatorial semaphorin code.” Neuron 70(2): 175-177. Wu, Z., L. B. Sweeney, J. C. Ayoob, K. Chak, B. J. Andreone, T. Ohyama, R. Kerr, L. Luo, M. Zlatic and A. L. Kolodkin (2011). ""A combinatorial semaphorin code instructs the initial steps of sensory circuit assembly in the Drosophila CNS."" Neuron 70(2): 281-298.","[""https://onlinelibrary.wiley.com/doi/10.1111/j.1460-9568.2005.04021.x"", ""https://www.cell.com/neuron/fulltext/S0896-6273(11)00247-9"", ""https://www.cell.com/neuron/fulltext/S0896-6273(11)00312-6"", ""https://www.mdpi.com/2073-4409/9/2/466""]"
350,Senescence code,The (Molecular) Senescence Codes,"Paluvai, H., E. Di Giorgio and C. Brancolini (2020). ""The Histone Code of Senescence."" Cells 9(2). Suter, T., Friedman, M. J., Tazearslan, C., Gamliel, A., Merkurjev, D., Ohgi, K., . . . Suh, Y. (2026). A Histone Code Functionally Linked to Replicative Senescence. Aging Cell, 25(1), e70343.","[""https://doi.org/10.1111/acel.70343"", ""https://pubmed.ncbi.nlm.nih.gov/555552/"", ""https://www.mdpi.com/2073-4409/9/2/466""]"
351,Sensory code,The Photoreceptor Sensory Code,"Felsten, G. and G. S. Wasserman (1979). “The photoreceptor sensory code for pattern identification during visual masking.” Sens Processes 3(3): 230-239.","[""https://pubmed.ncbi.nlm.nih.gov/555552/""]"
352,SeqCode,The Nomenclatural Code,"Hedlund, B. P., M. Chuvochina, P. Hugenholtz, K. T. Konstantinidis, A. E. Murray, M. Palmer, D. H. Parks, A. J. Probst, A. L. Reysenbach, R. L. Rodriguez, R. Rossello-Mora, I. C. Sutcliffe, S. N. Venter and W. B. Whitman (2022). “SeqCode: a nomenclatural code for prokaryotes described from sequence data.” Nat Microbiol 7(10): 1702-1708.","[""https://www.sciencedirect.com/science/article/abs/pii/0022283687902415""]"
353,Sequence codes,The Nucleotide Sequence Codes,"Trifonov, E. N. (1987). “Translation framing code and frame-monitoring mechanism as suggested by the analysis of mRNA and 16 S rRNA nucleotide sequences.” Journal of Molecular Biology 194(4): 643-652. Trifonov, E. N. (1988). “Codes of nucleotide sequences.” Mathematical Biosciences 90(1): 507-517.","[""https://www.sciencedirect.com/science/article/abs/pii/0022283687902415"", ""https://www.sciencedirect.com/science/article/abs/pii/0025556488900806""]"
354,Serin code,The Serin Code,"Su, P., Yang, Y., & Zheng, H. (2026). The ""serine code"" of metabolic reprogramming: multidimensional roles of the serine synthesis pathway in tumors and novel breakthroughs for targeted therapy. Front Immunol, 17, 1779543.","[""https://doi.org/10.3389/fimmu.2026.1779543"", ""https://doi.org/10.3389/fnsyn.2016.00034""]"
355,Serotonin code,The Serotonin Code,"Tchenio, A., Valentinova, K., & Mameli, M. (2016). Can the Lateral Habenula Crack the Serotonin Code? [Mini Review]. Front Synaptic Neurosci, Volume 8 - 2016. Harkin, E. F., Grossman, C. D., Cohen, J. Y., Béïque, J.-C., & Naud, R. (2023). Serotonin predictively encodes value. bioRxiv, 2023.2009.2019.558526. Harkin, E. F., Béïque, J.-C., & Naud, R. (2025). Extracting Value Coding Features from Individual Serotonin Neurons. bioRxiv, 2025.2007.2028.667134. Harkin, E. F., Grossman, C. D., Cohen, J. Y., Béïque, J.-C., & Naud, R. (2025). A prospective code for value in the serotonin system. Nature, 641(8064), 952-959.","[""https://doi.org/10.1038/s41586-025-08731-7"", ""https://doi.org/10.1101/2023.09.19.558526"", ""https://doi.org/10.1101/2025.07.28.667134"", ""https://doi.org/10.3389/fnsyn.2016.00034"", ""https://www.pnas.org/doi/10.1073/pnas.0710343105""]"
356,Signal integration code,The Signal Integration Codes,"Kim, J. H., J. M. Lee, H. J. Nam, H. J. Choi, J. W. Yang, J. S. Lee, M. H. Kim, S. I. Kim, C. H. Chung, K. I. Kim and S. H. Baek (2007). “SUMOylation of pontin chromatin-remodeling complex reveals a signal integration code in prostate cancer cells.” Proc Natl Acad Sci U S A 104(52): 20793-20798.","[""https://www.pnas.org/doi/10.1073/pnas.0710343105"", ""https://www.sciencedirect.com/science/article/abs/pii/S0303264799000787""]"
357,Signal transduction code,The Signal Transduction Code,"Prank, K., F. Gabbiani and G. Brabant (2000). ""Coding efficiency and information rates in transmembrane signaling."" Biosystems 55(1): 15-22. Barbieri, M. (2003). The organic codes. An introduction to semantic biology., Cambridge University Press. Bruni, L. E. (2007). Cellular Semiotics And Signal Transduction. Introduction to Biosemiotics: The New Biological Synthesis. M. Barbieri. Dordrecht, Springer Netherlands: 365-408. Faria, M. (2008). Signal Transduction Codes and Cell Fate. The Codes of Life: The Rules of Macroevolution. M. Barbieri and J. Hoffmeyer. Dordrecht, Springer Netherlands: 265-283. Bengtsson, F. and H. Jörntell (2009). “Sensory transmission in cerebellar granule cells relies on similarly coded mossy fiber inputs.” Proc Natl Acad Sci U S A 106(7): 2389-2394. Maraldi, N. M. (2019). ""In search of a primitive signaling code."" Biosystems 183: 103984.","[""https://link.springer.com/chapter/10.1007/1-4020-4814-9_15"", ""https://link.springer.com/chapter/10.1007/978-1-4020-6340-4_12"", ""https://www.cambridge.org/core/books/organic-codes/7015316BD6B4F5F466CAC59FD31CD7F3"", ""https://www.pnas.org/doi/10.1073/pnas.0808428106"", ""https://www.sciencedirect.com/science/article/abs/pii/S0303264719301431"", ""https://www.sciencedirect.com/science/article/abs/pii/S0303264799000787""]"
358,Sirtuin code,The Sirtuin Code,"Zhao, Y., Han, Y., Wang, B., & Wang, T. (2025). Sirtuins in Osteosarcoma: Cracking the Code and Opening Up New Treatment Options. Current Pharmaceutical Biotechnology.","[""https://doi.org/10.2174/0113892010374421250419163509"", ""https://nyaspubs.onlinelibrary.wiley.com/doi/abs/10.1196/annals.1390.020""]"
359,Social information code,"The Neural, Social Information Code","Knutson, B. and G. E. Wimmer (2007). ""Splitting the difference: how does the brain code reward episodes?"" Ann N Y Acad Sci 1104: 54-69. Kahnt, T., J. Heinzle, S. Q. Park and J. D. Haynes (2010). “The neural code of reward anticipation in human orbitofrontal cortex.” Proc Natl Acad Sci U S A 107(13): 6010-6015. Hale, L. A., E. S. Lee, A. K. Pantazis, N. Chronis and S. H. Chalasani (2016). ""Altered Sensory Code Drives Juvenile-to-Adult Behavioral Maturation in Caenorhabditis elegans."" eNeuro 3(6). Ponsot, E., J. J. Burred, P. Belin and J. J. Aucouturier (2018). “Cracking the social code of speech prosody using reverse correlation.” Proc Natl Acad Sci U S A 115(15): 3972-3977. Dabney, W., Z. Kurth-Nelson, N. Uchida, C. K. Starkweather, D. Hassabis, R. Munos and M. Botvinick (2020). ""A distributional code for value in dopamine-based reinforcement learning."" Nature 577(7792): 671-675. Salazar, V. and A. Silva (2022). “Neural processing: Cracking the code to extract relevant social information.” Curr Biol 32(1): R32-r34.","[""https://academic.oup.com/chemse/article-lookup/doi/10.1093/chemse/bjq021"", ""https://nyaspubs.onlinelibrary.wiley.com/doi/abs/10.1196/annals.1390.020"", ""https://www.cell.com/current-biology/fulltext/S0960-9822(21)01535-9"", ""https://www.eneuro.org/content/3/6/ENEURO.0175-16.2016"", ""https://www.nature.com/articles/s41586-019-1924-6"", ""https://www.pnas.org/doi/10.1073/pnas.0912838107"", ""https://www.pnas.org/doi/abs/10.1073/pnas.1716090115""]"
