Code Number,Code Name,Paper Name,URL
141,Genetic code – D (alternative),"Matsumoto, T., S. A. Ishikawa, T. Hashimoto and Y. Inagaki (2011). “A deviant genetic code in the green alga-derived plastid in the dinoflagellate Lepidodinium chlorophorum.” Mol Phylogenet Evol 60(1): 68-72.",https://www.sciencedirect.com/science/article/abs/pii/S1055790311001941
141,Genetic code – D (alternative),"Santos, M. A., Gomes, A. C., Santos, M. C., Carreto, L. C., & Moura, G. R. (2011). The genetic code of the fungal CTG clade. C R Biol, 334(8-9), 607-611.",https://doi.org/10.1016/j.crvi.2011.05.008
141,Genetic code – D (alternative),"Sczepanski, J. T. and G. F. Joyce (2012). ""Synthetic evolving systems that implement a user-specified genetic code of arbitrary design."" Chem Biol 19(10): 1324-1332.",https://www.sciencedirect.com/science/article/pii/S1074552112003286
141,Genetic code – D (alternative),"Roukos, D. H. (2012). ""Biotechnological, genomics and systems-synthetic biology revolution: redesigning genetic code for a pragmatic systems medicine."" Expert Rev Med Devices 9(2): 97-101.",https://www.tandfonline.com/doi/full/10.1586/erd.11.68
141,Genetic code – D (alternative),"Bezerra, A. R., Simões, J., Lee, W., Rung, J., Weil, T., Gut, I. G., . . . Santos, M. A. (2013). Reversion of a fungal genetic code alteration links proteome instability with genomic and phenotypic diversification. Proc Natl Acad Sci U S A, 110(27), 11079-11084.",https://doi.org/10.1073/pnas.1302094110
141,Genetic code – D (alternative),"Hofer, U. (2013). Fungal genetics: Candida chooses its code. Nat Rev Microbiol, 11(8), 511.",https://doi.org/10.1038/nrmicro3073
141,Genetic code – D (alternative),"Mateus, D. D., Paredes, J. A., Español, Y., Ribas de Pouplana, L., Moura, G. R., & Santos, M. A. S. (2013). Molecular reconstruction of a fungal genetic code alteration. RNA Biol, 10(6), 968-980.",https://doi.org/10.4161/rna.24683
141,Genetic code – D (alternative),"Ling, J., O'Donoghue, P., & Söll, D. (2015). Genetic code flexibility in microorganisms: novel mechanisms and impact on physiology. Nature Reviews Microbiology, 13(11), 707-721.",https://doi.org/10.1038/nrmicro3568
141,Genetic code – D (alternative),"Nagao, A., Ohara, M., Miyauchi, K., Yokobori, S.-i., Yamagishi, A., Watanabe, K., & Suzuki, T. (2017). Hydroxylation of a conserved tRNA modification establishes non-universal genetic code in echinoderm mitochondria. Nature Structural & Molecular Biology, 24(9), 778-782.",https://doi.org/10.1038/nsmb.3449
141,Genetic code – D (alternative),"Ma, N. J., C. F. Hemez, K. W. Barber, J. Rinehart and F. J. Isaacs (2018). “Organisms with alternative genetic codes resolve unassigned codons via mistranslation and ribosomal rescue.” eLife 7: e34878.",https://elifesciences.org/articles/34878
141,Genetic code – D (alternative),"Fimmel, E. and L. Strüngmann (2019). ""Linear codes and the mitochondrial genetic code."" Biosystems 184: 103990.",https://www.sciencedirect.com/science/article/abs/pii/S0303264719301728
141,Genetic code – D (alternative),"Meng, K., C. Z. Chung, D. Söll and N. Krahn (2022). “Unconventional genetic code systems in archaea.” Front Microbiol 13: 1007832.",https://www.frontiersin.org/articles/10.3389/fmicb.2022.1007832/full
141,Genetic code – D (alternative),"Pfennig, A., Lomsadze, A., & Borodovsky, M. (2023). MgCod: Gene Prediction in Phage Genomes with Multiple Genetic Codes. J Mol Biol, 435(14), 168159.",https://doi.org/10.1016/j.jmb.2023.168159
142,"Genetic code, second","de Duve, C. (1988). The second genetic code. Nature, 333(6169), 117-118. de Duve, C. (1988). Transfer RNAs: the second genetic code. Nature, 333(6169), 117-118.",https://doi.org/10.1038/333117a0
142,"Genetic code, second","Waldrop, M. M. (1989). The structure of the ""second genetic code"". Science, 246(4934), 1122.",https://doi.org/10.1126/science.2479981
142,"Genetic code, second","Bistolfi, F. (1990). A hydrogen-harps model for intracellular communication and its implications for the second genetic code. Panminerva Med, 32(1), 4-9.",https://pubmed.ncbi.nlm.nih.gov/2263402/
142,"Genetic code, second","Tejedor, J. R., & Valcárcel, J. (2010). Gene regulation: Breaking the second genetic code. Nature, 465(7294), 45-46.",https://doi.org/10.1038/465045a
142,"Genetic code, second","Qu, L. (2013). Non-coding RNA annotation: deciphering the second genetic code. Sci China Life Sci, 56(10), 865-866.",https://doi.org/10.1007/s11427-013-4544-7
142,"Genetic code, second","Lee, J., Schwieter, K. E., Watkins, A. M., Kim, D. S., Yu, H., Schwarz, K. J., . . . Jewett, M. C. (2019). Expanding the limits of the second genetic code with ribozymes. Nat Commun, 10(1), 5097.",https://doi.org/10.1038/s41467-019-12916-w
142,"Genetic code, second","Mohanty, Bijan B (2025) Does a Second Genetic Code Really Exist? Available at SSRN.",http://dx.doi.org/10.2139/ssrn.5608711
142,"Genetic code, second","Mohanty, B. B. (2025). Reassessing the Notion of a Second Genetic Code, A Historical Review and a Path Toward Clearer Genomic Classification. International Journal of Science and Research (IJSR), 14(11), 1470-1473.",https://dx.doi.org/10.21275/SR251120184517
142,"Genetic code, second","Mohanty, Bijan B (2025) Discovery of the Second Genetic Code. Available at SSRN.",http://dx.doi.org/10.2139/ssrn.5801082
142,"Genetic code, second","Mohanty, Bijan B (2026) Preliminary Evidence of Correlations between the Second Genetic Code & the Standard Genetic Code. Available at SSRN.",http://dx.doi.org/10.2139/ssrn.6054895
143,"Genetic code, second (gene regulation)","Tejedor, J. R., & Valcárcel, J. (2010). Gene regulation: Breaking the second genetic code. Nature, 465(7294), 45-46.",https://doi.org/10.1038/465045a
144,Genome regulatory code,"Rister, J. and C. Desplan (2010). “Deciphering the genome’s regulatory code: the many languages of DNA.” Bioessays 32(5): 381-384.",https://onlinelibrary.wiley.com/doi/10.1002/bies.200900197
144,Genome regulatory code,"Willis, N. A., E. Rass and R. Scully (2015). “Deciphering the Code of the Cancer Genome: Mechanisms of Chromosome Rearrangement.” Trends Cancer 1(4): 217-230.",https://www.cell.com/trends/cancer/fulltext/S2405-8033(15)00054-0
144,Genome regulatory code,"Kelley, D. R., J. Snoek and J. L. Rinn (2016). “Basset: learning the regulatory code of the accessible genome with deep convolutional neural networks.” Genome Res 26(7): 990-999.",https://genome.cshlp.org/content/26/7/990.long
144,Genome regulatory code,"Istrail, S. (2019). “Eric Davidson’s Regulatory Genome for Computer Science: Causality, Logic, and Proof Principles of the Genomic cis-Regulatory Code.” J Comput Biol 26(7): 653-684.",https://www.liebertpub.com/doi/10.1089/cmb.2019.0144
144,Genome regulatory code,"Mozziconacci, J., M. Merle and A. Lesne (2020). “The 3D Genome Shapes the Regulatory Code of Developmental Genes.” J Mol Biol 432(3): 712-723.",https://www.sciencedirect.com/science/article/abs/pii/S0022283619306138?
144,Genome regulatory code,"Basu, A., D. G. Bobrovnikov, B. Cieza, J. P. Arcon, Z. Qureshi, M. Orozco and T. Ha (2022). ""Deciphering the mechanical code of the genome and epigenome."" Nat Struct Mol Biol.",https://www.nature.com/articles/s41594-022-00877-6
144,Genome regulatory code,"Riolo, J., & Steckl, A. J. (2022). Comparative analysis of genome code complexity and manufacturability with engineering benchmarks. Scientific Reports, 12(1), 2808.",https://doi.org/10.1038/s41598-022-06723-5
145,Genomic code,"Pennisi, E. (2004). “Searching for the genome’s second code.” Science 306(5696): 632-635.",https://www.science.org/doi/10.1126/science.306.5696.632
145,Genomic code,"Segal, E., Y. Fondufe-Mittendorf, L. Chen, A. Thåström, Y. Field, I. K. Moore, J.-P. Z. Wang and J. Widom (2006). “A genomic code for nucleosome positioning.” Nature 442(7104): 772-778.",https://www.nature.com/articles/nature04979/
145,Genomic code,"Lee, B., H. Song, K. Rizzoti, Y. Son, J. Yoon, K. Baek and Y. Jeong (2013). ""Genomic code for Sox2 binding uncovers its regulatory role in Six3 activation in the forebrain."" Dev Biol 381(2): 491-501.",https://www.sciencedirect.com/science/article/pii/S0012160613003333
145,Genomic code,"Ward, M. C. and Y. Gilad (2017). ""Human genomics: Cracking the regulatory code."" Nature 550(7675): 190-191.",https://www.nature.com/articles/550190a
145,Genomic code,"Bernardi, G. (2019). “The Genomic Code: A Pervasive Encoding/Molding of Chromatin Structures and a Solution of the “Non-Coding DNA” Mystery.” BioEssays 41(12): 1900106.",https://onlinelibrary.wiley.com/doi/10.1002/bies.201900106
145,Genomic code,"Dinh, T. T., Xiang, M., Rajaraman, A., Wang, Y., Salazar, N., Roper, W., . . . Butcher, E. C. (2022). An NKX-COUP-TFII genomic code for mucosal vascular addressins and organ morphogenesis. bioRxiv, 2022.2002.2017.480956.",https://doi.org/10.1101/2022.02.17.480956
145,Genomic code,"Riolo, J. and A. J. Steckl (2022). “Comparative analysis of genome code complexity and manufacturability with engineering benchmarks.” Sci Rep 12(1): 2808.",https://www.nature.com/articles/s41598-022-06723-5
145,Genomic code,"Anastasiadi, D., & Wellenreuther, M. (2023). A conserved genomic code underpins animal DNA methylation patterns. Trends in Ecology & Evolution, 38(11), 1016-1018.",https://doi.org/10.1016/j.tree.2023.08.010
145,Genomic code,"Wander, S. A., & Bardia, A. (2024). Cracking the Genomic Code of CDK4/6 Inhibitor Resistance. Clinical Cancer Research, 30(10), 2008-2010.",https://doi.org/10.1158/1078-0432.Ccr-23-3413
145,Genomic code,"Cheng, S., Wei, Y., Zhou, Y., Xu, Z., Wright, D. N., Liu, J., & Peng, Y. (2025). Deciphering genomic codes using advanced natural language processing techniques: a scoping review. Journal of the American Medical Informatics Association, 32(4), 761-772.",https://doi.org/10.1093/jamia/ocaf029
145,Genomic code,"Meralli, Sameer (2025). Adaptive Archaic Introgression and Phenotypic Modulation: A New Framework to Deciphering the Genomic Code of Denisovan-derived Haplotypes in Modern Humans",http://dx.doi.org/10.2139/ssrn.5730242
146,Ghrelin code,"Bouzo-Lorenzo, M., Santo-Zas, I., Lodeiro, M., Nogueiras, R., Casanueva, F. F., Castro, M., . . . Camiña, J. P. (2016). Distinct phosphorylation sites on the ghrelin receptor, GHSR1a, establish a code that determines the functions of ß-arrestins. Scientific Reports, 6(1), 22495.",https://doi.org/10.1038/srep22495
147,Gli code,"Ruiz i Altaba, A., V. Nguyên and V. Palma (2003). ""The emergent design of the neural tube: prepattern, SHH morphogen and GLI code."" Curr Opin Genet Dev 13(5): 513-521.",https://linkinghub.elsevier.com/retrieve/pii/S0959437X03001163
147,Gli code,"Ruiz i Altaba, A., C. Mas and B. Stecca (2007). ""The Gli code: an information nexus regulating cell fate, stemness and cancer."" Trends Cell Biol 17(9): 438-447.",https://www.cell.com/trends/cell-biology/fulltext/S0962-8924(07)00171-7
147,Gli code,"Devine, C. A., J. L. Sbrogna, B. Guner, M. Osgood, M. C. Shen and R. O. Karlstrom (2009). ""A dynamic Gli code interprets Hh signals to regulate induction, patterning, and endocrine cell specification in the zebrafish pituitary."" Dev Biol 326(1): 143-154.",https://www.sciencedirect.com/science/article/pii/S0012160608013420
147,Gli code,"Stecca, B. and A. Ruiz i Altaba (2010). ""Context-dependent regulation of the GLI code in cancer by HEDGEHOG and non-HEDGEHOG signals."" J Mol Cell Biol 2(2): 84-95.",https://academic.oup.com/jmcb/article/2/2/84/895115
147,Gli code,"Ruiz i Altaba, A. (2011). ""Hedgehog signaling and the Gli code in stem cells, cancer, and metastases."" Sci Signal 4(200): pt9.",https://www.science.org/doi/10.1126/scisignal.2002540
147,Gli code,"Aberger, F. and A. Ruiz i Altaba (2014). “Context-dependent signal integration by the GLI code: the oncogenic load, pathways, modifiers and implications for cancer therapy.” Semin Cell Dev Biol 33(100): 93-104.",https://www.sciencedirect.com/science/article/pii/S108495211400130X
147,Gli code,"Matz-Soja, M., C. Rennert, K. Schönefeld, S. Aleithe, J. Boettger, W. Schmidt-Heck, T. S. Weiss, A. Hovhannisyan, S. Zellmer, N. Klöting, A. Schulz, J. Kratzsch, R. Guthke and R. Gebhardt (2016). ""Hedgehog signaling is a potent regulator of liver lipid metabolism and reveals a GLI-code associated with steatosis."" Elife 5.",https://elifesciences.org/articles/13308
147,Gli code,"Timmis, A. J. and N. A. Riobo-Del Galdo (2020). ""Another twist to the GLI code."" Biochem J 477(22): 4343-4347.",https://portlandpress.com/biochemj/article-abstract/477/22/4343/227053/Another-twist-to-the-GLI-code
147,Gli code,"Unger, L., Mathisen, A., Chera, S., Legøy, T. A., & Ghila, L. (2024). The GLI code controls HNF1A levels during foregut differentiation. Int J Dev Biol, 68(4), 223-230.",https://doi.org/10.1387/ijdb.230220lg
148,Glioma code,"Lowenstein, P. R., G. J. Baker and M. G. Castro (2014). “Cracking the glioma-NK inhibitory code: toward successful innate immunotherapy.” Oncoimmunology 3(11): e965573.",https://www.tandfonline.com/doi/full/10.4161/21624011.2014.965573
149,Glycomic code,"Jones, C. J., & Larive, C. K. (2011). Cracking the glycan sequence code. Nat Chem Biol, 7(11), 758-759.",https://doi.org/10.1038/nchembio.696
149,Glycomic code,"Gupta, G. and A. Surolia (2012). Glycomics: An Overview of the Complex Glycocode. Biochemical Roles of Eukaryotic Cell Surface Macromolecules, New York, NY, Springer New York.",https://link.springer.com/chapter/10.1007/978-1-4614-3381-1_1
149,Glycomic code,"Buckeridge, M. S. and A. P. de Souza (2014). “Breaking the “Glycomic Code” of Cell Wall Polysaccharides May Improve Second-Generation Bioenergy Production from Biomass.” BioEnergy Research 7(4): 1065-1073.",https://link.springer.com/article/10.1007/s12155-014-9460-6
149,Glycomic code,"Simone, G. (2014). ""Micro analysis to map the glycome code."" Proteomics 14(9): 994-1000.",https://analyticalsciencejournals.onlinelibrary.wiley.com/doi/10.1002/pmic.201300324
149,Glycomic code,"Buckeridge, M. S. (2018). “The evolution of the Glycomic Codes of extracellular matrices.” Biosystems 164: 112-120.",https://www.sciencedirect.com/science/article/abs/pii/S0303264717302721
149,Glycomic code,"Josenhans, C., Müthing, J., Elling, L., Bartfeld, S., & Schmidt, H. (2020). How bacterial pathogens of the gastrointestinal tract use the mucosal glyco-code to harness mucus and microbiota: New ways to study an ancient bag of tricks. International Journal of Medical Microbiology, 310(2), 151392.",https://doi.org/10.1016/j.ijmm.2020.151392
149,Glycomic code,"Banerjee, D. K., Ed. (2021). Glycome: The Hidden Code in Biology, Nova Science Publishers, Inc.",https://novapublishers.com/shop/glycome-the-hidden-code-in-biology/
149,Glycomic code,"Buckeridge, M. S. (2023). The Glycomic Code of the Plant Cell Wall - How Structure Leads to Function In A. Geitmann (Ed.), Plant Cell Walls. CRC Press.",https://doi.org/10.1201/9781003178309
149,Glycomic code,"Sosa Cuevas, E., Roubinet, B., Mouret, S., Thépaut, M., de Fraipont, F., Charles, J., . . . Aspord, C. (2023). The melanoma tumor glyco-code impacts human dendritic cells' functionality and dictates clinical outcomes. Front Immunol, 14, 1120434.",https://www.frontiersin.org/journals/immunology/articles/10.3389/fimmu.2023.1120434/full
149,Glycomic code,"Mohammed Shibah, Sami Rashid (2025), Decoding the Glycomic Code: Beyond Genetic Centrality in Chemical Glycobiology Integrated with Bio-Inorganic Chemistry Available at SSRN.",http://dx.doi.org/10.2139/ssrn.6069106
149,Glycomic code,"Tvaroška, I. (2025). The Role of Glycans in Human Immunity—A Sweet Code. Molecules, 30(13), 2678.",https://www.mdpi.com/1420-3049/30/13/2678
150,Glycosylation code,"Gama, C. I. and L. C. Hsieh-Wilson (2005). “Chemical approaches to deciphering the glycosaminoglycan code.” Curr Opin Chem Biol 9(6): 609-619.",https://www.sciencedirect.com/science/article/abs/pii/S1367593105001365
150,Glycosylation code,"Hebert, D. N., S. C. Garman and M. Molinari (2005). ""The glycan code of the endoplasmic reticulum: asparagine-linked carbohydrates as protein maturation and quality-control tags."" Trends Cell Biol 15(7): 364-370.",https://www.cell.com/trends/cell-biology/fulltext/S0962-8924(05)00132-7
150,Glycosylation code,"Shental-Bechor, D. and Y. Levy (2009). “Folding of glycoproteins: toward understanding the biophysics of the glycosylation code.” Current Opinion in Structural Biology 19(5): 524-533.",https://www.sciencedirect.com/science/article/abs/pii/S0959440X09000980
150,Glycosylation code,"Becer, C. R. (2012). ""The glycopolymer code: synthesis of glycopolymers and multivalent carbohydrate-lectin interactions."" Macromol Rapid Commun 33(9): 742-752.",https://onlinelibrary.wiley.com/doi/10.1002/marc.201200055
150,Glycosylation code,"Ellis, C. R. and W. G. Noid (2014). “Deciphering the glycosylation code.” J Phys Chem B 118(39): 11462-11469.",https://pubs.acs.org/doi/10.1021/jp508535f
150,Glycosylation code,"Dumych, T., C. Bridot, S. G. Gouin, M. F. Lensink, S. Paryzhak, S. Szunerits, R. Blossey, R. Bilyy, J. Bouckaert and E. M. Krammer (2018). ""A Novel Integrated Way for Deciphering the Glycan Code for the FimH Lectin."" Molecules 23(11).",https://www.mdpi.com/1420-3049/23/11/2794
150,Glycosylation code,"Rodriguez, E., K. Boelaars, K. Brown, K. Madunić, T. van Ee, F. Dijk, J. Verheij, R. J. E. Li, S. T. T. Schetters, L. L. Meijer, T. Y. S. Le Large, E. Driehuis, H. Clevers, S. C. M. Bruijns, T. O'Toole, S. J. van Vliet, M. F. Bijlsma, M. Wuhrer, G. Kazemier, E. Giovannetti, J. J. Garcia-Vallejo and Y. van Kooyk (2022). ""Analysis of the glyco-code in pancreatic ductal adenocarcinoma identifies glycan-mediated immune regulatory circuits."" Commun Biol 5(1): 41.",https://www.nature.com/articles/s42003-021-02934-0
150,Glycosylation code,"Wisnovsky, S. and C. R. Bertozzi (2022). ""Reading the glyco-code: New approaches to studying protein-carbohydrate interactions."" Curr Opin Struct Biol 75: 102395.",https://www.sciencedirect.com/science/article/pii/S0959440X22000744
150,Glycosylation code,"Dai, J., Ma, M., Niu, Q., Eisert, R. J., Wang, X., Das, P., . . . Brown, A. (2024). Mastigoneme structure reveals insights into the O-linked glycosylation code of native hydroxyproline-rich helices. Cell, 187(8), 1907-1921.e1916.",https://doi.org/10.1016/j.cell.2024.03.005
150,Glycosylation code,"Gędaj, A., Gregorczyk, P., Żukowska, D., Chorążewska, A., Ciura, K., Kalka, M., . . . Opaliński, Ł. (2024). Glycosylation of FGF/FGFR: An underrated sweet code regulating cellular signaling programs. Cytokine Growth Factor Rev, 77, 39-55.",https://www.sciencedirect.com/science/article/pii/S1359610124000340
150,Glycosylation code,"Wei, Y., Wei, A., Li, Y., Yang, Y., Si, Y., Li, Y., . . . Jiang, J. (2024). Deciphering the cell surface glyco- code: a promising perspective on unveiling the vulnerability of cancer stem cells. Cancer Biol Med, 21(11), 963-969.",https://doi.org/10.20892/j.issn.2095-3941.2024.0408
150,Glycosylation code,"Yang, H., Lin, Z., Wu, B., Xu, J., Tao, S. C., & Zhou, S. (2024). Deciphering disease through glycan codes: leveraging lectin microarrays for clinical insights. Acta biochimica et biophysica Sinica, 56(8), 1145-1155.",https://doi.org/10.3724/abbs.2024123
150,Glycosylation code,"Yehuda, S., & Padler-Karavani, V. (2024). Cracking the diversity of sweet drugs. Nat Chem Biol, 20(11), 1397-1398.",https://doi.org/10.1038/s41589-024-01755-6
150,Glycosylation code,"Li, X., & Tan, Z. (2026). Mapping the glycosylation code through synthetic chemistry. Cell Reports Physical Science, 7(2).",https://www.cell.com/cell-reports-physical-science/fulltext/S2666-3864(26)00040-8
151,Growth code,"Erland, L. A. E., C. E. Turi, P. K. Saxena and S. J. Murch (2020). “Metabolomics and hormonomics to crack the code of filbert growth.” Metabolomics 16(5): 62.",https://link.springer.com/article/10.1007/s11306-020-01684-0
152,Grb2 code,"Neumann, K., Oellerich, T., Urlaub, H., & Wienands, J. (2009). The B-lymphoid Grb2 interaction code. Immunological Reviews, 232(1), 135-149.",https://doi.org/10.1111/j.1600-065X.2009.00845.x
153,GRP code,"Tan, E. S., E. S. Groban, M. P. Jacobson and T. S. Scanlan (2008). ""Toward deciphering the code to aminergic G protein-coupled receptor drug design."" Chem Biol 15(4): 343-353.",https://www.sciencedirect.com/science/article/pii/S1074552108001154
153,GRP code,"Butcher, A. J., R. Prihandoko, K. C. Kong, P. McWilliams, J. M. Edwards, A. Bottrill, S. Mistry and A. B. Tobin (2011). ""Differential G-protein-coupled receptor phosphorylation provides evidence for a signaling bar code."" J Biol Chem 286(13): 11506-11518.",https://linkinghub.elsevier.com/retrieve/pii/S0021-9258(20)53772-1
153,GRP code,"Gough, N. R. (2011). “Focus issue: Cracking the G protein-coupled receptor code.” Sci Signal 4(185): eg7.",https://www.science.org/doi/10.1126/scisignal.2002388
153,GRP code,"Zhou, X. E., He, Y., de Waal, P. W., Gao, X., Kang, Y., Van Eps, N., . . . Xu, H. E. (2017). Identification of Phosphorylation Codes for Arrestin Recruitment by G Protein-Coupled Receptors. Cell, 170(3), 457- 469.e413",https://www.cell.com/cell/fulltext/S0092-8674(17)30773-0
153,GRP code,"Chen, H., Zhang, S., Zhang, X., & Liu, H. (2022). QR code model: a new possibility for GPCR phosphorylation recognition. Cell Communication and Signaling, 20(1), 23.",https://link.springer.com/article/10.1186/s12964-022-00832-4
154,Guanidine code,"Guo, S., Gao, Y., Wang, J., Yuan, Q., & Shen, X. (2026). Deciphering the guanidine code: from core metabolism to biosynthesis of its derivatives. Curr Opin Biotechnol, 98, 103453.",https://doi.org/10.1016/j.copbio.2026.103453
155,Gut code,"Liu, C. Y. (2020). Beta-7 Gives Tregs a Gut Area Code. Cell Mol Gastroenterol Hepatol, 9(3), 543-544.",https://doi.org/10.1016/j.jcmgh.2019.11.010
155,Gut code,"Braszczyńska-Sochacka, J., Sochacki, J., & Mik, M. (2025). The Gut’s Secret Code: Bowel Microbiota as a Biomarker for Adaptation. Nutrients, 17(13), 2117.",https://www.mdpi.com/2072-6643/17/13/2117
155,Gut code,"Hwang, D., Chong, E., Li, Y., Li, Y., & Roh, K. (2025). Deciphering the gut microbiome’s metabolic code: pathways to bone health and novel therapeutic avenues [Review]. Front Endocrinol (Lausanne), Volume 16 - 2025.",https://doi.org/10.3389/fendo.2025.1553655
155,Gut code,"Ye, L. (2026). Cracking the code of gut–brain sensing. Nature Reviews Neuroscience, 27(3), 158-158.",https://doi.org/10.1038/s41583-026-01023-7
156,Healing code,"Kumar, A., Kumar, D., Kondaveeti, S. B., Dabburu, K., Awasthi, A., Singh, T. G., . . . Kumar, M. (2025). Unlocking healing codes: Nanocarriers and signalling pathways modulation for wound repair. Materials Today Communications, 49, 114149.",https://doi.org/10.1016/j.mtcomm.2025.114149
157,Hearing code,"Cremers, C. W. (2000). “Hearing: cracking the code.” J Laryngol Otol 114(1): 6-16.",https://www.cambridge.org/core/journals/journal-of-laryngology-and-otology/article/abs/hearing-cracking-the-code/268C4A673449D0189EA1D807A607CA5F
158,Hepatocyte code,"Willenbring, H. (2011). A simple code for installing hepatocyte function. Cell Stem Cell, 9(2), 89-91.",https://doi.org/10.1016/j.stem.2011.07.009
158,Hepatocyte code,"Rombaut, M., Boeckmans, J., Rodrigues, R. M., van Grunsven, L. A., Vanhaecke, T., & De Kock, J. (2021). Direct reprogramming of somatic cells into induced hepatocytes: Cracking the Enigma code. J Hepatol, 75(3), 690-705.",https://doi.org/10.1016/j.jhep.2021.04.048
159,Herbivore defense code,"Hedrich, R., & Roelfsema, M. R. G. (2023). Cracking the code of plant herbivore defense. Cell, 186(7), 1300-1302.",https://doi.org/10.1016/j.cell.2023.02.025
160,Hidden protein code,"Baker, M. (2010). “Hidden code in the protein code.” Nature Methods 7(11): 874-874.",https://www.nature.com/articles/nmeth1110-874
160,Hidden protein code,"Weatheritt, R. J. and M. M. Babu (2013). “The Hidden Codes That Shape Protein Evolution.” Science 342(6164): 1325-1326.",https://www.science.org/doi/10.1126/science.1248425
161,Hippocampal code,"Jensen, O. (2005). “Reading the hippocampal code by theta phase-locking.” Trends Cogn Sci 9(12): 551-553.",https://www.cell.com/trends/cognitive-sciences/fulltext/S1364-6613(05)00292-5?_returnURL=https%3A%2F%2Flinkinghub.elsevier.com%2Fretrieve%2Fpii%2FS1364661305002925%3Fshowall%3Dtrue
161,Hippocampal code,"Tsanov, M. (2015). “Septo-hippocampal signal processing: breaking the code.” Prog Brain Res 219: 103-120.",https://www.sciencedirect.com/science/article/abs/pii/S007961231500059X
161,Hippocampal code,"Liberti, W. A., Schmid, T. A., Forli, A., Snyder, M., & Yartsev, M. M. (2022). A stable hippocampal code in freely flying bats. Nature, 604(7904), 98-103.",https://doi.org/10.1038/s41586-022-04560-0
161,Hippocampal code,"Liu, C., Todorova, R., Tang, W., Oliva, A., & Fernandez-Ruiz, A. (2023). Associative and predictive hippocampal codes support memory-guided behaviors. Science, 382(6668), eadi8237.",https://doi.org/doi:10.1126/science.adi8237
161,Hippocampal code,"Graves, K. N., Letrou, A., Gray, T. E., Quraishi, I. H., & Turk-Browne, N. B. (2023). Hippocampal Codes for Real-World Human Navigation. bioRxiv, 2023.2006.2022.545396.",https://doi.org/10.1101/2023.06.22.545396
161,Hippocampal code,"Kolibius, L. D., Roux, F., Parish, G., Ter Wal, M., Van Der Plas, M., Chelvarajah, R., . . . Hanslmayr, S. (2023). Hippocampal neurons code individual episodic memories in humans. Nat Hum Behav, 7(11), 1968-1979.",https://doi.org/10.1038/s41562-023-01706-6
162,Histone code – A (general),"Strahl, B. D. and C. D. Allis (2000). “The language of covalent histone modifications.” Nature 403(6765): 41-45.",https://www.nature.com/articles/47412
