Code Number,Code Name,Paper Name,URL
250,Neural Code – C (perception & recognition),"Roach, N. W., J. Heron, D. Whitaker and P. V. McGraw (2011). ""Asynchrony adaptation reveals neural population code for audio-visual timing."" Proc Biol Sci 278(1710): 1314-1322.",https://royalsocietypublishing.org/doi/full/10.1098/rspb.2010.1737
250,Neural Code – C (perception & recognition),"Wilson, S. P., J. A. Bednar, T. J. Prescott and B. Mitchinson (2011). ""Neural computation via neural geometry: a place code for inter-whisker timing in the barrel cortex?"" PLoS Comput Biol 7(10): e1002188.",https://journals.plos.org/ploscompbiol/article?id=10.1371/journal.pcbi.1002188
250,Neural Code – C (perception & recognition),"Lyons-Warren, A. M., M. Hollmann and B. A. Carlson (2012). ""Sensory receptor diversity establishes a peripheral population code for stimulus duration at low intensities."" J Exp Biol 215(Pt 15): 2586- 2600.",https://journals.biologists.com/jeb/article/215/15/2586/10958/Sensory-receptor-diversity-establishes-a
250,Neural Code – C (perception & recognition),"Lee, J. and J. M. Groh (2014). ""Different stimuli, different spatial codes: a visual map and an auditory rate code for oculomotor space in the primate superior colliculus."" PLoS One 9(1): e85017.",https://journals.plos.org/plosone/article?id=10.1371/journal.pone.0085017
250,Neural Code – C (perception & recognition),"El-Shamayleh, Y. and A. Pasupathy (2016). ""Contour Curvature As an Invariant Code for Objects in Visual Area V4."" J Neurosci 36(20): 5532-5543.",https://www.jneurosci.org/content/36/20/5532.long
250,Neural Code – C (perception & recognition),"Vergara, J., N. Rivera, R. Rossi-Pool and R. Romo (2016). ""A Neural Parametric Code for Storing Information of More than One Sensory Modality in Working Memory."" Neuron 89(1): 54-62.",https://www.cell.com/neuron/fulltext/S0896-6273(15)01032-6
250,Neural Code – C (perception & recognition),"Vass, L. K., M. S. Copara, M. Seyal, K. Shahlaie, S. T. Farias, P. Y. Shen and A. D. Ekstrom (2016). ""Oscillations Go the Distance: Low-Frequency Human Hippocampal Oscillations Code Spatial Distance in the Absence of Sensory Cues during Teleportation."" Neuron 89(6): 1180-1186.",https://www.cell.com/neuron/fulltext/S0896-6273(16)00092-1
250,Neural Code – C (perception & recognition),"Gau, P., A. Curtright, L. Condon, D. W. Raible and A. Dhaka (2017). ""An ancient neurotrophin receptor code; a single Runx/Cbfβ complex determines somatosensory neuron fate specification in zebrafish."" PLoS Genet 13(7): e1006884.",https://journals.plos.org/plosgenetics/article?id=10.1371/journal.pgen.1006884
250,Neural Code – C (perception & recognition),"Panzeri, S., C. D. Harvey, E. Piasini, P. E. Latham and T. Fellin (2017). “Cracking the Neural Code for Sensory Perception by Combining Statistics, Intervention, and Behavior.” Neuron 93(3): 491-507.",https://www.cell.com/neuron/fulltext/S0896-6273(16)31009-1
250,Neural Code – C (perception & recognition),"Esfahany, K., I. Siergiej, Y. Zhao and I. M. Park (2018). ""Organization of Neural Population Code in Mouse Visual System."" eNeuro 5(4).",https://www.eneuro.org/content/5/4/ENEURO.0414-17.2018
250,Neural Code – C (perception & recognition),"Follmann, R., C. J. Goldsmith and W. Stein (2018). ""Multimodal sensory information is represented by a combinatorial code in a sensorimotor system."" PLoS Biol 16(10): e2004527",https://journals.plos.org/plosbiology/article?id=10.1371/journal.pbio.2004527
250,Neural Code – C (perception & recognition),"Mittal, A. M., S. S. Singh and N. Gupta (2018). ""Sensory Coding: Neurons That Wire Together Fire Longer."" Curr Biol 28(10): R608-r610.",https://www.cell.com/current-biology/fulltext/S0960-9822(18)30431-7
250,Neural Code – C (perception & recognition),"Arguin, M., I. Marleau, M. Aubin, S. Zahabi and E. C. Leek (2019). ""A surface-based code contributes to visual shape perception."" J Vis 19(11): 6.",https://jov.arvojournals.org/article.aspx?articleid=2751278
250,Neural Code – C (perception & recognition),"James, B., L. Darnet, J. Moya-Díaz, S. H. Seibel and L. Lagnado (2019). ""An amplitude code transmits information at a visual synapse."" Nat Neurosci 22(7): 1140-1147.",https://www.nature.com/articles/s41593-019-0403-6
250,Neural Code – C (perception & recognition),"Kindel, W. F., E. D. Christensen and J. Zylberberg (2019). ""Using deep learning to probe the neural code for images in primary visual cortex."" J Vis 19(4): 29.",https://jov.arvojournals.org/article.aspx?articleid=2732380
250,Neural Code – C (perception & recognition),"Verschooten, E., S. Shamma, A. J. Oxenham, B. C. J. Moore, P. X. Joris, M. G. Heinz and C. J. Plack (2019). ""The upper frequency limit for the use of phase locking to code temporal fine structure in humans: A compilation of viewpoints."" Hear Res 377: 109-121.",https://www.sciencedirect.com/science/article/pii/S0378595518305604
250,Neural Code – C (perception & recognition),"Downer, J. D., J. R. Verhein, B. C. Rapone, K. N. O'Connor and M. L. Sutter (2021). ""An Emergent Population Code in Primary Auditory Cortex Supports Selective Attention to Spectral and Temporal Sound Features."" J Neurosci 41(36): 7561-7577.",https://www.jneurosci.org/content/41/36/7561.long
250,Neural Code – C (perception & recognition),"Snyder, A. C., B. M. Yu and M. A. Smith (2021). ""A Stable Population Code for Attention in Prefrontal Cortex Leads a Dynamic Attention Code in Visual Cortex."" J Neurosci 41(44): 9163-9176.",https://www.jneurosci.org/content/41/44/9163.long
250,Neural Code – C (perception & recognition),"Sharma, D., K. K. W. Ng, I. Birznieks and R. M. Vickery (2022). ""The burst gap is a peripheral temporal code for pitch perception that is shared across audition and touch."" Sci Rep 12(1): 11014.",https://www.nature.com/articles/s41598-022-15269-5
250,Neural Code – C (perception & recognition),"Zhang, N., R. M. Grieves and K. J. Jeffery (2022). ""Environment symmetry drives a multidirectional code in rat retrosplenial cortex."" J Neurosci.",https://www.jneurosci.org/content/42/49/9227.long
250,Neural Code – C (perception & recognition),"Zhao, Q., Yu, C. D., Wang, R., Xu, Q. J., Dai Pra, R., Zhang, L., & Chang, R. B. (2022). A multidimensional coding architecture of the vagal interoceptive system. Nature, 603(7903), 878-884.",https://doi.org/10.1038/s41586-022-04515-5
250,Neural Code – C (perception & recognition),"Zhao, X., C. L. Hsu and N. Spruston (2022). ""Rapid synaptic plasticity contributes to a learned conjunctive code of position and choice-related information in the hippocampus."" Neuron 110(1): 96-108.e104.",https://www.cell.com/neuron/fulltext/S0896-6273(21)00771-6
250,Neural Code – C (perception & recognition),"Wang, R. L., & Chang, R. B. (2024). The Coding Logic of Interoception. Annual Review of Physiology, 86, 301-327.",https://doi.org/10.1146/annurev-physiol-042222-023455
250,Neural Code – C (perception & recognition),"Plitt, M. H., Kaganovsky, K., Say, E., Sosa, M., Südhof, T. C., & Giocomo, L. M. (2026). Hippocampal place code plasticity in CA1 requires postsynaptic membrane fusion. Neuron.",https://doi.org/10.1016/j.neuron.2026.03.006
250,Neural Code – C (perception & recognition),"Shin, H. (2026). The neural code of perceptual inference. Mol Brain, 19(1).",https://doi.org/10.1186/s13041-026-01299-x
250,Neural Code – C (perception & recognition),"Wadia, V. S., Reed, C. M., Chung, J. M., Bateman, L. M., Mamelak, A. N., Rutishauser, U., & Tsao, D. Y. (2026). A shared code for perceiving and imagining objects in human ventral temporal cortex. Science, 392(6794), 207-215.",https://doi.org/10.1126/science.adt8343
250,Neural Code – C (perception & recognition),"Zhupa, M., Mückschel, M., Frings, C., Prochnow, A., & Beste, C. (2026). A Multiplexed Neural Code Governs Dynamic Perception-Action Reconfiguration during Response Inhibition. J Cogn Neurosci, 1- 16.",https://doi.org/10.1162/JOCN.a.2613
251,Neural code – D (tactile),"Goodwin, A. W. (1993). ""Touch: the code for roughness."" Curr Biol 3(6): 378-379.",https://www.cell.com/current-biology/pdf/0960-9822(93)90207-5
251,Neural code – D (tactile),"Johansson, R. S. and I. Birznieks (2004). ""First spikes in ensembles of human tactile afferents code complex spatial fingertip events."" Nat Neurosci 7(2): 170-177.",https://www.nature.com/articles/nn1177
251,Neural code – D (tactile),"Vázquez, Y., E. Salinas and R. Romo (2013). ""Transformation of the neural code for tactile detection from thalamus to cortex."" Proc Natl Acad Sci U S A 110(28): E2635-2644.",https://www.pnas.org/doi/10.1073/pnas.1309728110
251,Neural code – D (tactile),"Rossi-Pool, R., E. Salinas, A. Zainos, M. Alvarez, J. Vergara, N. Parga and R. Romo (2016). ""Emergence of an abstract categorical code enabling the discrimination of temporally structured tactile stimuli."" Proc Natl Acad Sci U S A 113(49): E7966-e7975.",https://www.pnas.org/doi/10.1073/pnas.1618196113
251,Neural code – D (tactile),"Birznieks, I., & Vickery, R. M. (2017). Spike Timing Matters in Novel Neuronal Code Involved in Vibrotactile Frequency Perception. Current Biology, 27(10), 1485-1490.e1482.",https://doi.org/10.1016/j.cub.2017.04.011
251,Neural code – D (tactile),"Goodman, J. M., & Bensmaia, S. J. (2017). A Variation Code Accounts for the Perceived Roughness of Coarsely Textured Surfaces. Scientific Reports, 7(1), 46699.",https://doi.org/10.1038/srep46699
251,Neural code – D (tactile),"Lieber, J. D., X. Xia, A. I. Weber and S. J. Bensmaia (2017). “The neural code for tactile roughness in the somatosensory nerves.” J Neurophysiol 118(6): 3107-3117.",https://journals.physiology.org/doi/full/10.1152/jn.00374.2017
251,Neural code – D (tactile),"Perks, K. M. and J. T. Pierce (2019). ""A quantal code for touch intensity in C. elegans."" J Gen Physiol 151(12): 1343-1346.",https://rupress.org/jgp/article/151/12/1343/132554/A-quantal-code-for-touch-intensity-in-C-elegansA
251,Neural code – D (tactile),"Bollini, A., C. Campus, D. Esposito and M. Gori (2020). ""The Magnitude Effect on Tactile Spatial Representation: The Spatial-Tactile Association for Response Code (STARC) Effect."" Front Neurosci 14: 557063.",https://www.frontiersin.org/articles/10.3389/fnins.2020.557063/full
251,Neural code – D (tactile),"Ng, K. K. W., C. Olausson, R. M. Vickery and I. Birznieks (2020). ""Temporal patterns in electrical nerve stimulation: Burst gap code shapes tactile frequency perception."" PLoS One 15(8): e0237440.",https://journals.plos.org/plosone/article?id=10.1371/journal.pone.0237440
251,Neural code – D (tactile),"Ng, K. K. W., I. N. Snow, I. Birznieks and R. M. Vickery (2021). ""Burst gap code predictions for tactile frequency are valid across the range of perceived frequencies attributed to two distinct tactile channels."" J Neurophysiol 125(2): 687-692.",https://journals.physiology.org/doi/full/10.1152/jn.00662.2020
252,Neural code – E (specific),"Sakagami, M., K. Tsutsui, J. Lauwereyns, M. Koizumi, S. Kobayashi and O. Hikosaka (2001). ""A code for behavioral inhibition on the basis of color, but not motion, in ventrolateral prefrontal cortex of macaque monkey."" J Neurosci 21(13): 4801-4808.",https://www.jneurosci.org/content/21/13/4801.long
252,Neural code – E (specific),"Meyer-Luehmann, M., J. F. Thompson, K. C. Berridge and J. W. Aldridge (2002). ""Substantia nigra pars reticulata neurons code initiation of a serial pattern: implications for natural action sequences and sequential disorders."" Eur J Neurosci 16(8): 1599-1608.",https://onlinelibrary.wiley.com/doi/abs/10.1046/j.1460-9568.2002.02210.x
252,Neural code – E (specific),"Paz, R. and E. Vaadia (2004). “Specificity of sensorimotor learning and the neural code: neuronal representations in the primary motor cortex.” J Physiol Paris 98(4-6): 331-348.",https://www.sciencedirect.com/science/article/abs/pii/S0928425705000227
252,Neural code – E (specific),"van Duuren, E., J. Lankelma and C. M. Pennartz (2008). ""Population coding of reward magnitude in the orbitofrontal cortex of the rat."" J Neurosci 28(34): 8590-8603.",https://www.jneurosci.org/content/28/34/8590.long
252,Neural code – E (specific),"Zheng, Y., & Escabí, M. A. (2008). Distinct Roles for Onset and Sustained Activity in the Neuronal Code for Temporal Periodicity and Acoustic Envelope Shape. The Journal of Neuroscience, 28(52), 14230-14244.",https://doi.org/10.1523/jneurosci.2882-08.2008
252,Neural code – E (specific),"di Giancamillo, A., Vitari, F., Bosi, G., Savoini, G., & Domeneghini, C. (2010). The chemical code of porcine enteric neurons and the number of enteric glial cells are altered by dietary probiotics. Neurogastroenterol Motil, 22(9), e271-278.",https://doi.org/10.1111/j.1365-2982.2010.01529.x
252,Neural code – E (specific),"Siddiqui, T. J., R. Pancaroglu, Y. Kang, A. Rooyakkers and A. M. Craig (2010). ""LRRTMs and neuroligins bind neurexins with a differential code to cooperate in glutamate synapse development."" J Neurosci 30(22): 7495-7506.",https://www.jneurosci.org/content/30/22/7495.long
252,Neural code – E (specific),"Hu, Z., X. J. Tong and J. M. Kaplan (2013). ""UNC-13L, UNC-13S, and Tomosyn form a protein code for fast and slow neurotransmitter release in Caenorhabditis elegans."" Elife 2: e00967.",https://elifesciences.org/articles/00967
252,Neural code – E (specific),"Schlaffke, L., A. Golisch, L. M. Haag, M. Lenz, S. Heba, S. Lissek, T. Schmidt-Wilcke, U. T. Eysel and M. Tegenthoff (2015). ""The brain's dress code: How The Dress allows to decode the neuronal pathway of an optical illusion."" Cortex 73: 271-275.",https://www.sciencedirect.com/science/article/abs/pii/S0010945215003226
252,Neural code – E (specific),"Li, M. and J. Z. Tsien (2017). ""Neural Code-Neural Self-information Theory on How Cell-Assembly Code Rises from Spike Time and Neuronal Variability."" Front Cell Neurosci 11: 236.",https://www.frontiersin.org/articles/10.3389/fncel.2017.00236/full
252,Neural code – E (specific),"Lee, J. S., J. J. Briguglio, J. D. Cohen, S. Romani and A. K. Lee (2020). ""The Statistical Structure of the Hippocampal Code for Space as a Function of Time, Context, and Value."" Cell 183(3): 620-635.e622.",https://www.cell.com/cell/fulltext/S0092-8674(20)31165-X
252,Neural code – E (specific),"Huang, H., Rubenstein, J. L., & Qiu, M. (2021). Cracking the Codes of Cortical Glial Progenitors: Evidence for the Common Lineage of Astrocytes and Oligodendrocytes. Neurosci Bull, 37(4), 437-439.",https://doi.org/10.1007/s12264-021-00675-y
252,Neural code – E (specific),"Noborn, F. and F. H. Sterky (2021). ""Role of neurexin heparan sulfate in the molecular assembly of synapses - Expanding the neurexin code?"" FEBS J.",https://febs.onlinelibrary.wiley.com/doi/10.1111/febs.16251
252,Neural code – E (specific),"Prag, M. (2022). THESIS Deciphering the regulatory code driving neural crest evolution and development OpenUCT.",http://hdl.handle.net/11427/36536
252,Neural code – E (specific),"Çimen, S., Çam, F. B. C., Kurtuluş, S., Toksoy, Ş. E., Eser, H. Y., & Ozyurt, O. (2026). Discovery of a product’s unconscious culture code and testing with fMRI [Original Research]. Front Behav Neurosci, Volume 20 - 2026.",https://doi.org/10.3389/fnbeh.2026.1737998
253,Neural code – F (phase codes),"Hasselmo, M. E., M. P. Brandon, M. Yoshida, L. M. Giocomo, J. G. Heys, E. Fransen, E. L. Newman and E. A. Zilli (2009). ""A phase code for memory could arise from circuit mechanisms in entorhinal cortex."" Neural Netw 22(8): 1129-1138.",https://www.sciencedirect.com/science/article/abs/pii/S0893608009001695
253,Neural code – F (phase codes),"Heusser, A. C., D. Poeppel, Y. Ezzyat and L. Davachi (2016). ""Episodic sequence memory is supported by a theta-gamma phase code."" Nat Neurosci 19(10): 1374-1380.",https://www.nature.com/articles/nn.4374
253,Neural code – F (phase codes),"Jaramillo, J. and R. Kempter (2017). ""Phase precession: a neural code underlying episodic memory?"" Curr Opin Neurobiol 43: 130-138.",https://www.nature.com/articles/s41598-017-08053-3
253,Neural code – F (phase codes),"Costa, M., D. Lozano-Soldevilla, A. Gil-Nagel, R. Toledano, C. R. Oehrn, L. Kunz, M. Yebra, C. Mendez- Bertolo, L. Stieglitz, J. Sarnthein, N. Axmacher, S. Moratti and B. A. Strange (2022). ""Aversive memory formation in humans involves an amygdala-hippocampus phase code."" Nat Commun 13(1): 6403.",https://www.nature.com/articles/s41467-022-33828-2
254,Neuroinflammation code,"Latif M., Noreen S., Fatima H., Ahmad H., & Sheikh N.(2025). Neuroinflammation: The hidden code through the brain.Albus Scientia, 2025,Article ID e250508,1-9.",http://doi.org/10.56512/AS.2025.1.e250508
255,Neuronal crest code,"Nitzan, E., S. Krispin, E. R. Pfaltzgraff, A. Klar, P. A. Labosky and C. Kalcheim (2013). “A dynamic code of dorsal neural tube genes regulates the segregation between neurogenic and melanogenic neural crest cells.” Development 140(11): 2269-2279.",https://journals.biologists.com/dev/article/140/11/2269/45718/A-dynamic-code-of-dorsal-neural-tube-genes
256,Neuronal wiring code,"Kovalenko, A. and A. Yaron (2022). “Cracking the combinatorial code of neuronal wiring.” Neuron 110(14): 2204-2206.",https://www.sciencedirect.com/science/article/abs/pii/S0896627322005050
257,Neuropeptide code,"Chen, Z.-F. (2021). A neuropeptide code for itch. Nature Reviews Neuroscience, 22(12), 758-776.",https://doi.org/10.1038/s41583-021-00526-9
257,Neuropeptide code,"Das Gupta, R. R., L. Scheurer, P. Pelczar, H. Wildner and H. U. Zeilhofer (2021). “Neuron-specific spinal cord translatomes reveal a neuropeptide code for mouse dorsal horn excitatory neurons.” Sci Rep 11(1): 5232.",https://www.nature.com/articles/s41598-021-84667-y
258,Neurotransmitter code,"Furness, J. B., Costa, M., Morris, J. L., & Gibbins, I. L. (1987). Novel Neurotransmitters and the Chemical Coding of Neurones. In H. McLennan, J. R. Ledsome, C. H. S. McIntosh, & D. R. Jones (Eds.), Advances in Physiological Research (pp. 143-165). Springer US.",https://doi.org/10.1007/978-1-4615-9492-5_9
259,Neurotrophin code,"Gau, Philia (2016) THESIS An ancient neurotrophin code in zebrafish; the Runx/Cbfβ complex specifies the fate switch from TrkB+ to TrkC+ nociceptors and sensory receptor expression. University of Washington",http://hdl.handle.net/1773/36496
260,NF-kappa-B code,"Calao, M., Burny, A., Quivy, V., Dekoninck, A., & Van Lint, C. (2008). A pervasive role of histone acetyltransferases and deacetylases in an NF-kappaB-signaling code. Trends Biochem Sci, 33(7), 339- 349.",https://www.cell.com/trends/biochemical-sciences/fulltext/S0968-0004(08)00124-2
260,NF-kappa-B code,"Tkach, K. E., J. E. Oyler and G. Altan-Bonnet (2014). “Cracking the NF-κB code.” Sci Signal 7(313): pe5.",https://www.science.org/doi/10.1126/scisignal.2005108
261,Niche codes,"Reen, F. J., Almagro-Moreno, S., Ussery, D., & Boyd, E. F. (2006). The genomic code: inferring Vibrionaceae niche specialization. Nat Rev Microbiol, 4(9), 697-704.",https://doi.org/10.1038/nrmicro1476
261,Niche codes,"Forsberg, E. C. and S. Smith-Berdan (2009). “Parsing the niche code: the molecular mechanisms governing hematopoietic stem cell adhesion and differentiation.” Haematologica 94(11): 1477-1481.",https://haematologica.org/article/view/5395
261,Niche codes,"Chaker, Z., Makarouni, E., & Doetsch, F. (2024). The Organism as the Niche: Physiological States Crack the Code of Adult Neural Stem Cell Heterogeneity. Annu Rev Cell Dev Biol, 40(1), 381-406.",https://doi.org/10.1146/annurev-cellbio-120320-040213
262,NKL code,"Nagel, S., Pommerenke, C., MacLeod, R. A. F., Meyer, C., Kaufmann, M., & Drexler, H. G. (2020). The NKL-code for innate lymphoid cells reveals deregulated expression of NKL homeobox genes HHEX and HLX in anaplastic large cell lymphoma (ALCL). Oncotarget, 11(34), 3208-3226.",https://doi.org/10.18632/oncotarget.27683
262,NKL code,"Nagel, S. (2021). ""NKL-Code in Normal and Aberrant Hematopoiesis."" Cancers (Basel) 13(8).",https://www.mdpi.com/2072-6694/13/8/1961
262,NKL code,"Nagel, S. (2022). The NKL- and TALE-Codes Represent Hematopoietic Gene Signatures to Evaluate Deregulated Homeobox Genes in Hodgkin Lymphoma. Hemato, 3(1), 122-130.",https://www.mdpi.com/2673-6357/3/1/11
263,NKX code,"Stanfel, M. N., K. A. Moses, R. J. Schwartz and W. E. Zimmer (2005). ""Regulation of organ development by the NKX-homeodomain factors: an NKX code."" Cell Mol Biol (Noisy-le-grand) Suppl 51: Ol785-799.",https://pubmed.ncbi.nlm.nih.gov/16405855/
263,NKX code,"Dinh, T. T., M. Xiang, A. Rajaraman, Y. Wang, N. Salazar, Y. Zhu, W. Roper, S. Rhee, K. Brulois, E. O'Hara, H. Kiefel, T. M. Dinh, Y. Bi, D. Gonzalez, E. P. Bao, K. Red-Horse, P. Balogh, F. Gábris, B. Gaszner, G. Berta, J. Pan and E. C. Butcher (2022). ""An NKX-COUP-TFII morphogenetic code directs mucosal endothelial addressin expression."" Nat Commun 13(1): 7448.",https://www.nature.com/articles/s41467-022-34991-2
264,NLRP3 code,"Weber, A. N. R., Tortola, M. M., & Kuemmerle-Deschner, J. B. (2024). Cracking the NLRP3 code: Pioneering precision medicine for inflammation. Journal of Experimental Medicine, 221(5).",https://doi.org/10.1084/jem.20240221
264,NLRP3 code,"Tang, X., He, Y., Bao, X., Peng, Z., Xu, H., He, Y., . . . Wei, J. (2025). The Anti-Pulmonary Fibrosis Code of Plant Anthocyanins—A Multi-Targeted Anti-Fibrotic Bioactive Compound by Inhibiting the NLRP3 Inflammasome. Molecular Nutrition & Food Research, 69(23), e70275.",https://doi.org/10.1002/mnfr.70275
265,Non-ribosomal code,"von Döhren, H., R. Dieckmann and M. Pavela-Vrancic (1999). “The nonribosomal code.” Chem Biol 6(10): R273-279.",https://www.cell.com/cell-chemical-biology/pdf/S1074-5521(00)80014-9.pdf?_returnURL=https%3A%2F%2Flinkinghub.elsevier.com%2Fretrieve%2Fpii%2FS1074552100800149%3Fshowall%3Dtrue
265,Non-ribosomal code,"Ackerley, D. F. (2016). “Cracking the Nonribosomal Code.” Cell Chem Biol 23(5): 535-537.",https://www.cell.com/cell-chemical-biology/fulltext/S2451-9456(16)30127-1
265,Non-ribosomal code,"Stanišić, A., Svensson, C. M., Müll, M., Bernal, F. A., Zeihe, H., Ettelt, U., & Kries, H. (2026). Mapping the nonribosomal specificity code through promiscuity-guided A-domain engineering. Chem Sci, 17(16), 8168-8181.",https://doi.org/10.1039/d6sc00250a
266,NOS code,"Costa, M., Furness, J. B., Pompolo, S., Brookes, S. J. H., Bornstein, J. C., Bredt, D. S., & Snyder, S. H. (1992). Projections and chemical coding of neurons with immunoreactivity for nitric oxide synthase in the guinea-pig small intestine. Neurosci Lett, 148(1), 121-125.",https://doi.org/10.1016/0304-3940(92)90819-S
266,NOS code,"Anderson, C. R., McAllen, R. M., & Edwards, S. L. (1995). Nitric oxide synthase and chemical coding in cat sympathetic postganglionic neurons. Neuroscience, 68(1), 255-264.",https://doi.org/10.1016/0306-4522(95)00143-7
267,Notch Code,"Cave, J. W., F. Loh, J. W. Surpris, L. Xia and M. A. Caudy (2005). “A DNA transcription code for cell- specific gene activation by notch signaling.” Curr Biol 15(2): 94-104.",https://www.cell.com/current-biology/fulltext/S0960-9822(04)01051-6
267,Notch Code,"Cave, J. W., L. Xia and M. A. Caudy (2009). “The Daughterless N-terminus directly mediates synergistic interactions with Notch transcription complexes via the SPS+A DNA transcription code.” BMC Res Notes 2: 65.",https://bmcresnotes.biomedcentral.com/articles/10.1186/1756-0500-2-65
267,Notch Code,"Kakuda, S. and R. S. Haltiwanger (2017). “Deciphering the Fringe-Mediated Notch Code: Identification of Activating and Inhibiting Sites Allowing Discrimination between Ligands.” Dev Cell 40(2): 193-201.",https://linkinghub.elsevier.com/retrieve/pii/S1534-5807(16)30877-2
268,Nuclear rigidity code,"Tagay, Y. (2025). BPS2025 - Cracking the code of nuclear rigidity: New frontiers in cell migration and therapy. Biophysical Journal, 124(3), 302a-303a.",https://doi.org/10.1016/j.bpj.2024.11.1686
269,Nuclear signalling code,"Maraldi, N. M. (2008). A Lipid-based Code in Nuclear Signalling. The Codes of Life: The Rules of Macroevolution. M. Barbieri and J. Hoffmeyer. Dordrecht, Springer Netherlands: 207-221.",https://link.springer.com/chapter/10.1007/978-1-4020-6340-4_9
270,Nucleoprotein code,"Moreira É, A., A. Weber, H. Bolte, L. Kolesnikova, S. Giese, S. Lakdawala, M. Beer, G. Zimmer, A. García-Sastre, M. Schwemmle and M. Juozapaitis (2016). ""A conserved influenza A virus nucleoprotein code controls specific viral genome packaging."" Nat Commun 7: 12861.",https://www.nature.com/articles/ncomms12861
271,Nucleosome code,"Segal, E., Y. Fondufe-Mittendorf, L. Chen, A. Thåström, Y. Field, I. K. Moore, J.-P. Z. Wang and J. Widom (2006). “A genomic code for nucleosome positioning.” Nature 442(7104): 772-778.",https://www.nature.com/articles/nature04979/
271,Nucleosome code,"Segal, M. R. (2008). “Re-cracking the nucleosome positioning code.” Stat Appl Genet Mol Biol 7(1): Article14.",https://www.degruyter.com/document/doi/10.2202/1544-6115.1367/html
271,Nucleosome code,"Warnecke, T., Batada, N. N., & Hurst, L. D. (2008). The impact of the nucleosome code on protein- coding sequence evolution in yeast. PLoS Genet, 4(11), e1000250.",https://doi.org/10.1371/journal.pgen.1000250
271,Nucleosome code,"Choi, J. K. and Y. J. Kim (2009). ""Implications of the nucleosome code in regulatory variation, adaptation and evolution."" Epigenetics 4(5): 291-295.",https://www.tandfonline.com/doi/abs/10.4161/epi.4.5.9281
271,Nucleosome code,"Cohanim, A. B. and T. E. Haran (2009). “The coexistence of the nucleosome positioning code with the genetic code on eukaryotic genomes.” Nucleic acids research 37(19): 6466-6476.",https://academic.oup.com/nar/article/37/19/6466/2409553
