Number,Code Name,Description,Citations,URLs
111,Endocrine codes,The Endocrine Signalling Codes,"Leong, D. A. and M. O. Thorner (1991). ""A potential code of luteinizing hormone-releasing hormone- induced calcium ion responses in the regulation of luteinizing hormone secretion among individual gonadotropes."" J Biol Chem 266(14): 9016-9022. Dygalo, N. N. (2010). “[Evolution of endocrine glands and neuroendocrine systems: the “humoral code”].” Ross Fiziol Zh Im I M Sechenova 96(7): 675-685. Burnstock, G. (2014). “Purinergic signalling in endocrine organs.” Purinergic Signalling 10(1): 189-231. Gribble, F. M. and F. Reimann (2017). “Signalling in the gut endocrine axis.” Physiology & Behavior 176: 183-188. Lee, S., J. Choi, J. Mohanty, L. P. Sousa, F. Tome, E. Pardon, J. Steyaert, M. A. Lemmon, I. Lax and J. Schlessinger (2018). “Structures of β-klotho reveal a ‘zip code’-like mechanism for endocrine FGF signalling.” Nature 553(7689): 501-505. Kuang, H. and J. D. Lin (2019). “GPNMB: expanding the code for liver–fat communication.” Nature Metabolism 1(5): 507-508. Hah, Y.-S., Hwang, J., Lee, S.-J., & Kwag, S.-J. (2026). Decoding the Endocrine Code of Skeletal Muscle: Myokines, Exerkines, and Inter-Organ Crosstalk in Metabolic Health and Disease. Cells, 15(4), 318.","[""https://doi.org/10.1016/S0021-9258(19)36515-9"", ""https://link.springer.com/article/10.1007/s11302-013-9396-x"", ""https://linkinghub.elsevier.com/retrieve/pii/S0021-9258(18)31545-X"", ""https://pubmed.ncbi.nlm.nih.gov/20973172/"", ""https://pubmed.ncbi.nlm.nih.gov/29342135/"", ""https://www.mdpi.com/2073-4409/15/4/318"", ""https://www.nature.com/articles/s42255-019-0069-0"", ""https://www.sciencedirect.com/science/article/abs/pii/S0031938416311143""]"
112,Endocytic code,The Endocytic Code,"Chang, C. P., Lazar, C. S., Walsh, B. J., Komuro, M., Collawn, J. F., Kuhn, L. A., . . . Rosenfeld, M. G. (1993). Ligand-induced internalization of the epidermal growth factor receptor is mediated by multiple endocytic codes analogous to the tyrosine motif found in constitutively internalized receptors. Journal of Biological Chemistry, 268(26), 19312-19320. Vleurick, L., Pezet, A., Kühn, E. R., Decuypere, E., & Edery, M. (1999). A β-Turn Endocytic Code Is Required for Optimal Internalization of the Growth Hormone Receptor but Not for α-Adaptin Association. Molecular Endocrinology, 13(11), 1823-1831. Qualmann, B., Koch, D., & Kessels, M. M. (2011). Let's go bananas: revisiting the endocytic BAR code. Embo j, 30(17), 3501-3515.","[""https://doi.org/10.1016/S0021-9258(19)36515-9"", ""https://doi.org/10.1038/emboj.2011.266"", ""https://doi.org/10.1210/mend.13.11.0371""]"
113,Endothelial code,The Endothelial (Iron) Code,"Pantopoulos, K. (2025). Foxo1 unlocks the liver endothelial code to iron sensing. Blood, 146(14), 1639-1641.","[""https://doi.org/10.1002/9780470720110.ch10"", ""https://doi.org/10.1182/blood.2025030281""]"
114,Epigenetic code – A (general),The Epigenetic (Chromatin) Code SEE alsoHistone Code,"Kauffman, S. (1975). Control circuits for determination and transdetermination: interpreting positional information in a binary epigenetic code. Ciba Found Symp, 0(29), 201-221. Imhof, A., & Becker, P. B. (2001). Modifications of the histone N-terminal domains - Evidence for an “epigenetic code”? Molecular Biotechnology, 17(1), 1-13. Benecke, A. (2006). ""Chromatin code, local non-equilibrium dynamics, and the emergence of transcription regulatory programs."" Eur Phys J E Soft Matter 19(3): 353-366. Fatemi, M. and P. A. Wade (2006). ""MBD family proteins: reading the epigenetic code."" J Cell Sci 119(Pt 15): 3033-3037. Lesne, A. (2006). ""The chromatin regulatory code: beyond a histone code."" Eur Phys J E Soft Matter 19(3): 375-377. Nightingale, K. P., L. P. O'Neill and B. M. Turner (2006). ""Histone modifications: signalling receptors and potential elements of a heritable epigenetic code."" Curr Opin Genet Dev 16(2): 125-136. Turner, B. M. (2007). “Defining an epigenetic code.” Nature Cell Biology 9(1): 2-6. Lennartsson, A. and K. Ekwall (2009). “Histone modification patterns and epigenetic codes.” Biochim Biophys Acta 1790(9): 863-868. Dhanak, D. (2012). Cracking the Code: The Promise of Epigenetics. ACS Medicinal Chemistry Letters, 3(7), 521-523. Marx, V. (2012). “Epigenetics: Reading the second genomic code.” Nature 491(7422): 143-147. The EPIC Planning Committee (2012). “Reading the second code: mapping epigenomes to understand plant growth, development, and adaptation to the environment.” Plant Cell 24(6): 2257- 2261. Karpathakis, A., Dibra, H., & Thirlwell, C. (2013). Neuroendocrine tumours: cracking the epigenetic code. Endocr Relat Cancer, 20(3), R65-82.","[""https://academic.oup.com/plcell/article/24/6/2257/6100785"", ""https://doi.org/10.1002/9780470720110.ch10"", ""https://doi.org/10.1021/ml300141h"", ""https://doi.org/10.1385/MB:17:1:01"", ""https://doi.org/10.1530/erc-12-0338"", ""https://journals.biologists.com/jcs/article/119/15/3033/29098/MBD-family-proteins-reading-the-epigenetic-code"", ""https://link.springer.com/article/10.1140/epje/i2005-10064-0"", ""https://link.springer.com/article/10.1140/epje/i2005-10068-8"", ""https://linkinghub.elsevier.com/retrieve/pii/S0959-437X(06)00037-2"", ""https://www.nature.com/articles/491143a"", ""https://www.nature.com/articles/ncb0107-2"", ""https://www.sciencedirect.com/science/article/abs/pii/S0304416509000038""]"
115,Epigenetic code – B (stem cell),The Epigenetic Stem Cell Codes,"Yamada, Y., & Watanabe, A. (2010). 7 - Epigenetic Codes in Stem Cells and Cancer Stem Cells. In Z. Herceg & T. Ushijima (Eds.), Advances in Genetics (Vol. 70, pp. 177-199). Academic Press. Bayarsaihan, D. (2016). ""Deciphering the Epigenetic Code in Embryonic and Dental Pulp Stem Cells."" Yale J Biol Med 89(4): 539-563.","[""https://doi.org/10.1016/B978-0-12-380866-0.60007-1"", ""https://pubmed.ncbi.nlm.nih.gov/28018144/""]"
116,Epigenetic code – C (behaviour),The Epigenetic Behaviour Codes SEE also Depression code,"Gräff, J. and I. M. Mansuy (2008). “Epigenetic codes in cognition and behaviour.” Behav Brain Res 192(1): 70-87. Maleszka, R. (2016). ""Epigenetic code and insect behavioural plasticity."" Curr Opin Insect Sci 15: 45- 52. Fustin, J. M., R. Kojima, K. Itoh, H. Y. Chang, S. Ye, B. Zhuang, A. Oji, S. Gibo, R. Narasimamurthy, D. Virshup, G. Kurosawa, M. Doi, I. Manabe, Y. Ishihama, M. Ikawa and H. Okamura (2018). ""Two Ck1δ transcripts regulated by m6A methylation code for two antagonistic kinases in the control of the circadian clock."" Proc Natl Acad Sci U S A 115(23): 5980-5985.","[""https://doi.org/10.2217/fnl.11.67"", ""https://linkinghub.elsevier.com/retrieve/pii/S0166-4328(08)00073-9"", ""https://www.pnas.org/doi/abs/10.1073/pnas.1721371115"", ""https://www.sciencedirect.com/science/article/abs/pii/S2214574516300189""]"
117,Epigenetic code – D (miscellaneous),The Epigenetic Code Miscellaneous,"Jiang, Y., & Hsieh, J. (2012). Harnessing Adult Neurogenesis By Cracking the Epigenetic Code. Future Neurology, 7(1), 65-79. Treas, J. N., T. Tyagi and K. P. Singh (2012). ""Effects of chronic exposure to arsenic and estrogen on epigenetic regulatory genes expression and epigenetic code in human prostate epithelial cells."" PLoS One 7(8): e43880. Bronner, C., M. Krifa and M. Mousli (2013). ""Increasing role of UHRF1 in the reading and inheritance of the epigenetic code as well as in tumorogenesis."" Biochem Pharmacol 86(12): 1643-1649. Santoni, F. A. (2013). ""EMdeCODE: a novel algorithm capable of reading words of epigenetic code to predict enhancers and retroviral integration sites and to identify H3R2me1 as a distinctive mark of coding versus non-coding genes."" Nucleic Acids Res 41(3): e48. Allan, R. S., & Nutt, S. L. (2014). Deciphering the epigenetic code of T lymphocytes. Immunological Reviews, 261(1), 50-61. Infante, T., F. P. Mancini, A. Lanza, A. Soricelli, F. de Nigris and C. Napoli (2015). “Polycomb YY1 is a critical interface between epigenetic code and miRNA machinery after exposure to hypoxia in malignancy.” Biochim Biophys Acta 1853(5): 975-986. Biot, M. and B. de Massy (2020). ""Reading the epigenetic code for exchanging DNA."" Elife 9. Kawaguchi, A., Wang, J., Knapp, D., Murawala, P., Nowoshilow, S., Masselink, W., . . . Tanaka, E. M. (2024). A chromatin code for limb segment identity in axolotl limb regeneration. Dev Cell, 59(16), 2239-2253.e2239.","[""https://academic.oup.com/nar/article/41/3/e48/2902501"", ""https://doi.org/10.1016/j.devcel.2024.05.002"", ""https://doi.org/10.1111/imr.12207"", ""https://doi.org/10.2217/fnl.11.67"", ""https://elifesciences.org/articles/61820"", ""https://journals.plos.org/plosone/article?id=10.1371/journal.pone.0043880"", ""https://www.sciencedirect.com/science/article/abs/pii/S0006295213006527"", ""https://www.sciencedirect.com/science/article/pii/S016748891500018X""]"
118,Episode code,The episodic memory code,"Sakabe, E. Y., Camargo, E., Simões, A., Colombini, E., Costa, P., & Gudwin, R. (2025). An episode encoding mechanism for cognitive architectures. Cognitive Systems Research, 101397.","[""https://doi.org/10.1016/j.jaci.2025.10.014"", ""https://www.sciencedirect.com/science/article/abs/pii/S1389041725000774""]"
119,Epitope code,The Epitope Codes,"Konstantinou, G. N., Yin Wong, L. S., & Nowak-Wegrzyn, A. (2025). Reading the code of epitope- specific IgE: Predicting persistence and resolution in peanut allergy. Journal of Allergy and Clinical Immunology, 156(6), 1520-1522.","[""https://doi.org/10.1016/j.jaci.2025.10.014"", ""https://www.sciencedirect.com/science/article/abs/pii/S1874939918300476""]"
120,Epitranscriptomic code,The Epitranscriptomic Code,"Berlivet, S., J. Scutenaire, J. M. Deragon and C. Bousquet-Antonelli (2019). ""Readers of the m(6)A epitranscriptomic code."" Biochim Biophys Acta Gene Regul Mech 1862(3): 329-342. Deng, L., J. Kumar, R. Rose, W. McIntyre and D. Fabris (2022). “Analyzing RNA posttranscriptional modifications to decipher the epitranscriptomic code.” Mass Spectrom Rev: e21798.","[""https://analyticalsciencejournals.onlinelibrary.wiley.com/doi/10.1002/mas.21798"", ""https://doi.org/10.1101/sqb.1999.64.45"", ""https://www.sciencedirect.com/science/article/abs/pii/S1874939918300476""]"
121,E-protein code,The Combinatorial E-Protein Code,"BARNDT, R. J., & ZHUANG, Y. (1999). Controlling Lymphopoiesis with a Combinatorial E-protein Code. Cold Spring Harbor Symposia on Quantitative Biology, 64, 45-50.","[""https://doi.org/10.1002/qua.1302"", ""https://doi.org/10.1101/sqb.1999.64.45""]"
122,Error correcting code,The Error Correcting Code,"Štambuk, N., & Konjevoda, P. (2001). New computational algorithm for the prediction of protein folding types. International Journal of Quantum Chemistry, 84(1), 13-22. Battail, G. (2007). Information Theory and Error-Correcting Codes In Genetics and Biological Evolution. Introduction to Biosemiotics: The New Biological Synthesis. M. Barbieri. Dordrecht, Springer Netherlands: 299-345. Faria, L. C., A. S. Rocha, J. H. Kleinschmidt, M. C. Silva-Filho, E. Bim, R. H. Herai, M. E. Yamagishi and R. Palazzo, Jr. (2012). “Is a genome a codeword of an error-correcting code?” PloS One 7(5): e36644.","[""https://doi.org/10.1002/qua.1302"", ""https://journals.plos.org/plosone/article?id=10.1371/journal.pone.0036644"", ""https://link.springer.com/chapter/10.1007/1-4020-4814-9_13""]"
123,ER stress code,The Endoplasmatic Reticulum Stress Code,"Varshney, V., Singh, J., & Mishra, V. (2024). Unlocking the plant ER stress code: IRE1-proteasome signaling cohort takes the lead. Trends Plant Sci, 29(6), 610-612.","[""https://doi.org/10.1016/j.tplants.2023.12.003"", ""https://doi.org/10.1210/er.2010-0016""]"
124,Estrogen code,The Estrogen (Receptor) Code,"Le Romancer, M., Poulard, C., Cohen, P., Sentis, S., Renoir, J.-M., & Corbo, L. (2011). Cracking the Estrogen Receptor's Posttranslational Code in Breast Tumors. Endocrine Reviews, 32(5), 597-622.","[""https://doi.org/10.1016/j.biosystems.2025.105546"", ""https://doi.org/10.1210/er.2010-0016""]"
125,Eukaryogenesis codes,The Eukaryogenesis Codes,"Igamberdiev, A. U. (2025). The development of code systems during eukaryogenesis and the rise of multicellularity. Biosystems, 255, 105546.","[""https://doi.org/10.1016/j.biosystems.2025.105546"", ""https://doi.org/10.1038/s44271-025-00211-y""]"
126,Event codes,Neural Event Tracking Code,"Collin, S. H. P., Kempner, R. P., Srivatsan, S., & Norman, K. A. (2025). Neural codes track prior events in a narrative and predict subsequent memory for details. Communications Psychology, 3(1), 26.","[""https://doi.org/10.1038/s44271-025-00211-y"", ""https://linkinghub.elsevier.com/retrieve/pii/S0021-9258(19)73109-3""]"
127,Export / Exit code,The Export & Exit Codes,"Nishimura, N., S. Bannykh, S. Slabough, J. Matteson, Y. Altschuler, K. Hahn and W. E. Balch (1999). ""A di-acidic (DXE) code directs concentration of cargo during export from the endoplasmic reticulum."" J Biol Chem 274(22): 15937-15946. Wang, X., J. Matteson, Y. An, B. Moyer, J. S. Yoo, S. Bannykh, I. A. Wilson, J. R. Riordan and W. E. Balch (2004). ""COPII-dependent export of cystic fibrosis transmembrane conductance regulator from the ER uses a di-acidic exit code."" J Cell Biol 167(1): 65-74. Roy, G., Chalfin, E. M., Saxena, A., & Wang, X. (2010). Interplay between ER Exit Code and Domain Conformation in CFTR Misprocessing and Rescue. Mol Biol Cell, 21(4), 597-609.","[""https://doi.org/10.1046/j.1365-313X.1994.05020157.x"", ""https://doi.org/10.1091/mbc.e09-05-0427"", ""https://linkinghub.elsevier.com/retrieve/pii/S0021-9258(19)73109-3"", ""https://rupress.org/jcb/article/167/1/65/51296/COPII-dependent-export-of-cystic-fibrosis""]"
128,Extensin code,The (Plant) Extensin Codes,"Kieliszewski, M. J., & Lamport, D. T. A. (1994). Extensin: repetitive motifs, functional sites, post- translational codes, and phylogeny. The Plant Journal, 5(2), 157-172.","[""https://doi.org/10.1046/j.1365-313X.1994.05020157.x"", ""https://doi.org/10.1101/2025.03.18.643915""]"
129,Fear code,The Thalamic Fear Code,"Tuna, T., Totty, M. S., Badarnee, M., Afonso Gonçalves Mourão, F., Peters, S., Milad, M. R., & Maren, S. (2025). Associative coding of conditioned fear in the thalamic nucleus reuniens in rodents and humans. bioRxiv, 2025.2003.2018.643915.","[""https://doi.org/10.1016/j.foodres.2026.118518"", ""https://doi.org/10.1101/2025.03.18.643915""]"
130,Feng-flavor baijiu code,The  Feng-Flavor Baijiu Code,"Zhang, Y., Liu, K., Ding, X., Feng, Y., Jing, C., Zhang, Y., & Bai, L. (2026). Unlocking the Feng-flavor baijiu code: Single-strain yeast inoculants outperform co-cultures in enhancing sweet honey-ester aroma. Food Res Int, 230, 118518.","[""https://doi.org/10.1016/j.foodres.2026.118518"", ""https://doi.org/10.1016/j.neuron.2021.10.003""]"
131,Ferroptosis code,The Ferroptosis Code,"Zhao, X., Hsu, C.-L., & Spruston, N. (2022). Rapid synaptic plasticity contributes to a learned conjunctive code of position and choice-related information in the hippocampus. Neuron, 110(1), 96- 108.e104.","[""https://doi.org/10.1016/j.neuron.2021.10.003""]"
132,Fiber code,The Fiber Code,"Dong, Y. (2026). The fiber code: AI predicts HCC in MASLD. Hepatology, 83(3).","[""https://doi.org/10.1016/j.jcmgh.2021.06.012"", ""https://journals.lww.com/hep/fulltext/2026/03000/the_fiber_code__ai_predicts_hcc_in_masld.3.aspx""]"
133,Fibrogenic code,The Fibrogenic Code SEE also Inflammation Codes,"Friedersdorf, M., & Diehl, A. M. (2021). Inflammation Writes the Fibrogenic Code. Cell Mol Gastroenterol Hepatol, 12(3), 1147-1148.","[""https://doi.org/10.1016/j.biomaterials.2025.123738"", ""https://doi.org/10.1016/j.jcmgh.2021.06.012""]"
134,Fibrotic code,The Fibrotic Code,"Liu, M., Li, X., Gao, Y., Wei, Z., Ma, J., Zhang, L., . . . Liu, T. (2026). Breaking the fibrotic code: Nanotechnology-driven advances in renal fibrosis therapy. Biomaterials, 327, 123738.","[""https://doi.org/10.1016/j.biomaterials.2025.123738"", ""https://doi.org/10.1016/j.devcel.2010.05.010""]"
135,Flower code,The (Cancer) Flower Code SEE also Cancer Code,"Rhiner, C., López-Gay, J. M., Soldini, D., Casas-Tinto, S., Martín, F. A., Lombardía, L., & Moreno, E. (2010). Flower Forms an Extracellular Code that Reveals the Fitness of a Cell to its Neighbors in Drosophila. Dev Cell, 18(6), 985-998. Casas-Tinto, S., Torres, M., & Moreno, E. (2011). The flower code and cancer development. Clinical and Translational Oncology, 13(1), 5-9.","[""https://doi.org/10.1007/s12094-011-0610-4"", ""https://doi.org/10.1016/j.devcel.2010.05.010"", ""https://www.nature.com/articles/onc200821""]"
136,FoxO code,The Forkhead Transcription Factor Code,"Calnan, D. R. and A. Brunet (2008). “The FoxO code.” Oncogene 27(16): 2276-2288.","[""https://doi.org/10.1016/j.neuropharm.2015.06.005"", ""https://www.nature.com/articles/onc200821""]"
137,GABA code,The GABA Receptor Code,"Jang, H. J., Park, K., Lee, J., Kim, H., Han, K. H., & Kwag, J. (2015). GABAA receptor-mediated feedforward and feedback inhibition differentially modulate the gain and the neural code transformation in hippocampal CA1 pyramidal cells. Neuropharmacology, 99, 177-186. Iorio, M. T., F. D. Vogel, F. Koniuszewski, P. Scholze, S. Rehman, X. Simeone, M. Schnürch, M. D. Mihovilovic and M. Ernst (2020). “GABA(A) Receptor Ligands Often Interact with Binding Sites in the Transmembrane Domain and in the Extracellular Domain-Can the Promiscuity Code Be Cracked?” Int J Mol Sci 21(1).","[""https://doi.org/10.1016/j.neuropharm.2015.06.005"", ""https://pubmed.ncbi.nlm.nih.gov/13033864/"", ""https://www.mdpi.com/1422-0067/21/1/334""]"
138,Genetic code – A (historical),The Historical Papers on the Genetic Code,"Dounce, A. L. (1952). “[Duplicating mechanism for peptide chain and nucleic acid synthesis].” Enzymologia 15(5): 251-258. Dounce, A. L. (1953). “Nucleic Acid Template Hypotheses.” Nature 172(4377): 541-541. Gamow, G. (1954). “Possible Relation between Deoxyribonucleic Acid and Protein Structures.” Nature 173(4398): 318-318. Berg, P. and E. J. Offengand (1958). “An Enzymatic Mechanism for Linking Amino Acids to RNA.” Proc Natl Acad Sci U S A 44(2): 78-86.","[""https://pubmed.ncbi.nlm.nih.gov/13033864/"", ""https://www.nature.com/articles/172541a0"", ""https://www.nature.com/articles/173318a0"", ""https://www.pnas.org/doi/abs/10.1073/pnas.44.2.78""]"
139,Genetic code – B (research),Research Papers on the Genetic Code,"Taylor, F. J. R. and D. Coates (1989). ""The code within the codons."" Biosystems 22(3): 177-187. Jukes, T. H. and S. Osawa (1990). “The genetic code in mitochondria and chloroplasts.” Experientia 46(11-12): 1117-1126. Osawa, S., Muto, A., Ohama, T., Andachi, Y., Tanaka, R., & Yamao, F. (1990). Prokaryotic genetic code. Experientia, 46(11-12), 1097-1106. Haig, D. and L. D. Hurst (1991). “A quantitative measure of error minimization in the genetic code.” J Mol Evol 33(5): 412-417.","[""https://doi.org/10.1007/bf01936919"", ""https://link.springer.com/article/10.1007/BF01936921"", ""https://link.springer.com/article/10.1007/BF02103132"", ""https://www.sciencedirect.com/science/article/abs/pii/0303264789900592""]"
140,Genetic Code – C (expanded),The Expanded Genetic Code,"Moore, B., B. C. Persson, C. C. Nelson, R. F. Gesteland and J. F. Atkins (2000). “Quadruplet codons: implications for code expansion and the specification of translation step size.” J Mol Biol 298(2): 195- 209. Budisa, N. (2004). “Prolegomena to Future Experimental Efforts on Genetic Code Engineering by Expanding Its Amino Acid Repertoire.” Angewandte Chemie International Edition 43(47): 6426-6463. Wang, L. and P. G. Schultz (2005). “Expanding the Genetic Code.” AngewandteChemie International Edition 44(1): 34-66. Cropp, T. A., J. C. Anderson and J. W. Chin (2007). ""Reprogramming the amino-acid substrate specificity of orthogonal aminoacyl-tRNA synthetases to expand the genetic code of eukaryotic cells."" Nat Protoc 2(10): 2590-2600. Liu, C. C., A. V. Mack, M. L. Tsao, J. H. Mills, H. S. Lee, H. Choe, M. Farzan, P. G. Schultz and V. V. Smider (2008). “Protein evolution with an expanded genetic code.” Proc Natl Acad Sci U S A 105(46): 17688-17693.","[""https://onlinelibrary.wiley.com/doi/10.1002/anie.200300646"", ""https://www.annualreviews.org/doi/10.1146/annurev.biophys.35.101105.121507"", ""https://www.nature.com/articles/nprot.2007.378"", ""https://www.pnas.org/doi/10.1073/pnas.0809543105"", ""https://www.sciencedirect.com/science/article/abs/pii/S0022283600936581""]"
141,Genetic code – D (alternative),The Alternative Genetic Codes,"Doerfler, W. (1982). “In search of more complex genetic codes—can linguistics be a guide?” Med Hypotheses 9(6): 563-579. Parker, J. (1989). ""Errors and alternatives in reading the universal genetic code."" Microbiol Rev 53(3): 273-298. Osawa, S., Muto, A., Ohama, T., Andachi, Y., Tanaka, R., & Yamao, F. (1990). Prokaryotic genetic code. Experientia, 46(11-12), 1097-1106. Osawa, S., D. Collins, T. Ohama, T. H. Jukes and K. Watanabe (1990). ""Evolution of the mitochondrial genetic code. III. Reassignment of CUN codons from leucine to threonine during evolution of yeast mitochondria."" J Mol Evol 30(4): 322-328.","[""https://doi.org/10.1007/bf01936919"", ""https://journals.asm.org/doi/10.1128/mr.53.3.273-298.1989"", ""https://link.springer.com/article/10.1007/BF02101886"", ""https://www.sciencedirect.com/science/article/abs/pii/0306987782900494""]"
142,"Genetic code, second",The Second Genetic Code (tRNA Loading),"de Duve, C. (1988). The second genetic code. Nature, 333(6169), 117-118. de Duve, C. (1988). Transfer RNAs: the second genetic code. Nature, 333(6169), 117-118. Waldrop, M. M. (1989). The structure of the ""second genetic code"". Science, 246(4934), 1122. Bistolfi, F. (1990). A hydrogen-harps model for intracellular communication and its implications for the second genetic code. Panminerva Med, 32(1), 4-9. Tejedor, J. R., & Valcárcel, J. (2010). Gene regulation: Breaking the second genetic code. Nature, 465(7294), 45-46. Qu, L. (2013). Non-coding RNA annotation: deciphering the second genetic code. Sci China Life Sci, 56(10), 865-866.","[""https://doi.org/10.1007/s11427-013-4544-7"", ""https://doi.org/10.1038/333117a0"", ""https://doi.org/10.1038/465045a"", ""https://doi.org/10.1126/science.2479981"", ""https://pubmed.ncbi.nlm.nih.gov/2263402/""]"
143,"Genetic code, second (gene regulation)",The Second Genetic Code (Gene Regulation) SEE also Genomic Regulatory Code,"Tejedor, J. R., & Valcárcel, J. (2010). Gene regulation: Breaking the second genetic code. Nature, 465(7294), 45-46.","[""https://doi.org/10.1038/465045a"", ""https://onlinelibrary.wiley.com/doi/10.1002/bies.200900197""]"
144,Genome regulatory code,The Genomic Regulatory Code,"Rister, J. and C. Desplan (2010). “Deciphering the genome’s regulatory code: the many languages of DNA.” Bioessays 32(5): 381-384. Willis, N. A., E. Rass and R. Scully (2015). “Deciphering the Code of the Cancer Genome: Mechanisms of Chromosome Rearrangement.” Trends Cancer 1(4): 217-230. Kelley, D. R., J. Snoek and J. L. Rinn (2016). “Basset: learning the regulatory code of the accessible genome with deep convolutional neural networks.” Genome Res 26(7): 990-999. Istrail, S. (2019). “Eric Davidson’s Regulatory Genome for Computer Science: Causality, Logic, and Proof Principles of the Genomic cis-Regulatory Code.” J Comput Biol 26(7): 653-684. Mozziconacci, J., M. Merle and A. Lesne (2020). “The 3D Genome Shapes the Regulatory Code of Developmental Genes.” J Mol Biol 432(3): 712-723. Basu, A., D. G. Bobrovnikov, B. Cieza, J. P. Arcon, Z. Qureshi, M. Orozco and T. Ha (2022). ""Deciphering the mechanical code of the genome and epigenome."" Nat Struct Mol Biol. Riolo, J., & Steckl, A. J. (2022). Comparative analysis of genome code complexity and manufacturability with engineering benchmarks. Scientific Reports, 12(1), 2808.","[""https://doi.org/10.1038/s41598-022-06723-5"", ""https://genome.cshlp.org/content/26/7/990.long"", ""https://onlinelibrary.wiley.com/doi/10.1002/bies.200900197"", ""https://www.cell.com/trends/cancer/fulltext/S2405-8033(15)00054-0"", ""https://www.liebertpub.com/doi/10.1089/cmb.2019.0144"", ""https://www.nature.com/articles/s41594-022-00877-6"", ""https://www.science.org/doi/10.1126/science.306.5696.632"", ""https://www.sciencedirect.com/science/article/abs/pii/S0022283619306138?""]"
145,Genomic code,The Genomic Code,"Pennisi, E. (2004). “Searching for the genome’s second code.” Science 306(5696): 632-635. Segal, E., Y. Fondufe-Mittendorf, L. Chen, A. Thåström, Y. Field, I. K. Moore, J.-P. Z. Wang and J. Widom (2006). “A genomic code for nucleosome positioning.” Nature 442(7104): 772-778.","[""https://www.nature.com/articles/nature04979/"", ""https://www.science.org/doi/10.1126/science.306.5696.632""]"
146,Ghrelin code,The Ghrelin Receptor Code,"Bouzo-Lorenzo, M., Santo-Zas, I., Lodeiro, M., Nogueiras, R., Casanueva, F. F., Castro, M., . . . Camiña, J. P. (2016). Distinct phosphorylation sites on the ghrelin receptor, GHSR1a, establish a code that determines the functions of ß-arrestins. Scientific Reports, 6(1), 22495.","[""https://doi.org/10.1038/srep22495"", ""https://linkinghub.elsevier.com/retrieve/pii/S0959437X03001163""]"
