Number,Code Name,Description,Citations,URLs
1,14-3-3 code,The 14-3-3 Protein (Phosphorylation Code) SEE also Phosphorylation Code,"Winter, S., Simboeck, E., Fischle, W., Zupkovitz, G., Dohnal, I., Mechtler, K., . . . Seiser, C. (2008). 14-3- 3 Proteins recognize a histone code at histone H3 and are required for transcriptional activation. Embo j, 27(1), 88-99.","[""https://doi.org/10.1038/sj.emboj.7601954"", ""https://link.springer.com/article/10.1007/s12304-014-9213-0""]"
2,Acoustic code,The Acoustic Codes,"Farina, A. and N. Pieretti (2014). ""Acoustic Codes in Action in a Soundscape Context."" Biosemiotics 7(2): 321-328. Malavasi, R., K. Kull and A. Farina (2014). ""The Acoustic Codes: How Animal Sign Processes Create Sound-Topes and Consortia via Conflict Avoidance."" Biosemiotics 7(1): 89-95. Curé, C., N. Mathevon and T. Aubin (2016). ""Mate vocal recognition in the Scopoli's shearwater Calonectris diomedea: do females and males share the same acoustic code?"" Behav Processes 128: 96-102. Farina, A. (2018). ""Ecoacoustic codes and ecological complexity."" Biosystems 164: 147-154. Farina, A. (2019). ""Acoustic codes from a rural sanctuary: How ecoacoustic events operate across a landscape scale."" Biosystems 183: 103986. Farina, A., & Villa, A. E. P. (2023). On the semantics of ecoacoustic codes. Biosystems, 232, 105002.","[""https://doi.org/10.1016/j.biosystems.2023.105002"", ""https://journals.biologists.com/jcs/article/131/9/jcs215509/57120/The-makings-of-the-actin-code-regulation-of-actin"", ""https://link.springer.com/article/10.1007/s12304-013-9177-5"", ""https://link.springer.com/article/10.1007/s12304-014-9213-0"", ""https://www.sciencedirect.com/science/article/abs/pii/S0303264717302228"", ""https://www.sciencedirect.com/science/article/abs/pii/S030326471930156X"", ""https://www.sciencedirect.com/science/article/abs/pii/S0376635716300912""]"
3,Actin code,The Actin Code SEE also Cytoskeleton Code,"Vedula, P. and A. Kashina (2018). ""The makings of the 'actin code': regulation of actin's biological function at the amino acid and nucleotide level."" J Cell Sci 131(9). A, M., Latario, C. J., Pickrell, L. E., & Higgs, H. N. (2020). Lysine acetylation of cytoskeletal proteins: Emergence of an actin code. Journal of Cell Biology, 219(12).","[""https://doi.org/10.1083/jcb.202006151"", ""https://journals.biologists.com/jcs/article/131/9/jcs215509/57120/The-makings-of-the-actin-code-regulation-of-actin"", ""https://linkinghub.elsevier.com/retrieve/pii/S1074-5521(99)80082-9""]"
4,Adenylation code,The Adenylation Code,"Stachelhaus, T., H. D. Mootz and M. A. Marahiel (1999). ""The specificity-conferring code of adenylation domains in nonribosomal peptide synthetases."" Chem Biol 6(8): 493-505. Davis, R. and Y. Shi (2014). ""The polyadenylation code: a unified model for the regulation of mRNA alternative polyadenylation."" J Zhejiang UnivSci B 15(5): 429-437. Zhang, F., Y. Wang, Q. Jiang, Q. Chen, L. Karthik, Y.-L. Zhao and Z. Li (2018). ""Substrate selection of adenylation domains for nonribosomal peptide synthetase (NRPS) in bacillamide C biosynthesis by marine Bacillus atrophaeus C89."" Journal of Industrial Microbiology & Biotechnology 45(5): 335-344.","[""https://academic.oup.com/jimb/article/45/5/335/5996667"", ""https://link.springer.com/article/10.1631/jzus.B1400076"", ""https://linkinghub.elsevier.com/retrieve/pii/S1074-5521(99)80082-9""]"
5,Adhesion code,The Adhesion Code SEE also Synaptic code(s) SEE also Cadherin code(s),"Bedzhov, I., Alotaibi, H., Basilicata, M. F., Ahlborn, K., Liszewska, E., Brabletz, T., & Stemmler, M. P. (2013). Adhesion, but not a specific cadherin code, is indispensable for ES cell and induced pluripotency. Stem Cell Research, 11(3), 1250-1263. Faria, M. (2018). “Aggregating, polarizing, networking – The evolution of cell adhesion codes.” Biosystems 164: 60-67. Tsai, T. Y., M. Sikora, P. Xia, T. Colak-Champollion, H. Knaut, C. P. Heisenberg and S. G. Megason (2020). ""An adhesion code ensures robust pattern formation during tissue morphogenesis."" Science 370(6512): 113-116. Ferreira-Pinto, M., Aguilar-Aragón, M., Rhiner, C., & Moreno, E. (2026). Hbs and Rst adhesion molecules provide a regional code that regulates cell elimination during epithelial remodeling. iScience, 29(3). Ko, J. (2026). A decade of discovery: Deciphering the synaptic adhesion code. Mol Cells, 49(5), 100341.","[""https://doi.org/10.1016/j.isci.2026.114971"", ""https://doi.org/10.1016/j.mocell.2026.100341"", ""https://doi.org/10.1016/j.scr.2013.08.009"", ""https://doi.org/10.1126/science.1553532"", ""https://www.science.org/doi/10.1126/science.aba6637"", ""https://www.sciencedirect.com/science/article/abs/pii/S0303264717302800""]"
6,Allosteric code -A (hemoglobin),The Allosteric Code Hemoglobin,"Ackers, G. K., Doyle, M. L., Myers, D., & Daugherty, M. A. (1992). Molecular Code for Cooperativity in Hemoglobin. Science, 255(5040), 54-63. Edelstein, S. J. (1996). ""An allosteric theory for hemoglobin incorporating asymmetric states to test the putative molecular code for cooperativity."" J Mol Biol 257(4): 737-744. Ackers, G. K. (1998). Deciphering the Molecular Code of Hemoglobin Allostery. In E. Di Cera (Ed.), Advances in Protein Chemistry (Vol. 51, pp. 185-253). Academic Press. Daugherty, M. A., M. A. Shea, J. A. Johnson, V. J. LiCata, G. J. Turner and G. K. Ackers (1991). ""Identification of the intermediate allosteric species in human hemoglobin reveals a molecular code for cooperative switching."" Proc Natl Acad Sci U S A 88(4): 1110-1114. Goldbeck, R. A., Esquerra, R. M., Holt, J. M., Ackers, G. K., & Kliger, D. S. (2004). The molecular code for hemoglobin allostery revealed by linking the thermodynamics and kinetics of quaternary structural change. 1. Microstate linear free energy relations. Biochemistry, 43(38), 12048-12064. Goldbeck, R. A., R. M. Esquerra, D. S. Kliger, J. M. Holt and G. K. Ackers (2004). ""The molecular code for hemoglobin allostery revealed by linking the thermodynamics and kinetics of quaternary structural change. 2. Cooperative free energies of (alphaFeCObetaFe)2 and (alphaFebetaFeCO)2 T- state tetramers."" Biochemistry 43(38): 12065-12080.","[""https://doi.org/10.1016/S0065-3233(08)60653-1"", ""https://doi.org/10.1021/bi049393v"", ""https://doi.org/10.1126/science.1553532"", ""https://pubs.acs.org/doi/10.1021/bi0493923"", ""https://www.pnas.org/doi/10.1073/pnas.88.4.1110"", ""https://www.sciencedirect.com/science/article/abs/pii/S0022283696901989""]"
7,Allosteric code -B (miscellaneous),The Allosteric Code Miscellaneous,"Armour-Garb, I., I. S. M. Han, B. S. Cowan and K. M. Thayer (2022). “Variable Regions of p53 Isoforms Allosterically Hard Code DNA Interaction.” J Phys Chem B.","[""https://journals.lww.com/nrronline/fulltext/2026/06000/lymphatic_venous_anastomosis__cracking_the_code_of.48.aspx"", ""https://pubs.acs.org/doi/10.1021/acs.jpcb.2c06229""]"
8,Alzheimer´s code,The Alzheimer´s Disease Code,"Fan, F., Zhao, N., & Guo, M. (2026). Lymphatic–venous anastomosis: Cracking the code of Alzheimer’s disease treatment? Neural Regen Res, 21(6).","[""https://doi.org/10.1038/s41594-026-01792-w"", ""https://journals.lww.com/nrronline/fulltext/2026/06000/lymphatic_venous_anastomosis__cracking_the_code_of.48.aspx""]"
9,Amyloid code,The Amyloid Fibril Code SEE also Prion Code,"Lashuel, H. A. (2026). Cracking the code of native amyloid fibrils: advances and next steps to enable pathology-informed therapeutic and diagnostic. Nat Struct Mol Biol, 33(4), 567-576.","[""https://doi.org/10.1038/s41594-026-01792-w"", ""https://www.cell.com/structure/fulltext/S0969-2126(20)30076-9""]"
10,Angiotensin code,The Angiotensin Receptor Code,"Sadybekov, A. and V. Katritch (2020). ""Breaking the Enigma Code of Angiotensin II Type 2 Receptor Signaling."" Structure 28(4): 390-392.","[""https://doi.org/10.1093/eurheartj/ehl322"", ""https://www.cell.com/structure/fulltext/S0969-2126(20)30076-9""]"
11,Annexin code,The Annexin Codes,"Kietselaer, B. L., Narula, J., & Hofstra, L. (2007). The Annexin code: revealing endocarditis. Eur Heart J, 28(8), 948. Ganesan, T., Sinniah, A., Ramasamy, T. S., & Alshawsh, M. A. (2024). Cracking the code of Annexin A1-mediated chemoresistance. Biochem Biophys Res Commun, 725, 150202.","[""https://doi.org/10.1016/j.bbrc.2024.150202"", ""https://doi.org/10.1093/eurheartj/ehl322"", ""https://www.nature.com/articles/nrmicro.2018.33""]"
12,Antibiotic resistance code,The Antibiotic Resistance Codes,"Lo, S. W., N. Kumar and N. E. Wheeler (2018). ""Breaking the code of antibiotic resistance."" Nat Rev Microbiol 16(5): 262. Al Fadhli, A. H., Mouftah, S. F., Jamal, W. Y., Rotimi, V. O., & Ghazawi, A. (2023). Cracking the Code: Unveiling the Diversity of Carbapenem-Resistant Klebsiella pneumoniae Clones in the Arabian Peninsula through Genomic Surveillance. Antibiotics, 12(7), 1081.","[""https://doi.org/10.1016/j.compbiomed.2025.111044"", ""https://www.mdpi.com/2079-6382/12/7/1081"", ""https://www.nature.com/articles/nrmicro.2018.33""]"
13,Anticancer code,The Anticancer Codes,"Pei, Z., Zhou, W., Zhong, M., Xi, R., Li, F., & Li, H. (2025). Unlocking the anticancer code of gambogic acid: Multidimensional strategies to overcome tumor treatment challenges. Computers in Biology and Medicine, 197, 111044.","[""https://doi.org/10.1016/j.compbiomed.2025.111044"", ""https://doi.org/10.1016/j.jctube.2024.100436""]"
14,Antigen code,The Antigen Codes SEE also Immune code,"Krasilnikov, I., Lehnherr-Ilyina, T., Djonovic, M., Artamonova, I., Nikitin, M., & Kislichkin, N. (2024). Cracking the antigenic code of mycobacteria: CFP-10/ESAT-6 tuberculosis skin test and misleading results. Journal of Clinical Tuberculosis and Other Mycobacterial Diseases, 36, 100436.","[""https://doi.org/10.1016/j.jctube.2024.100436"", ""https://journals.plos.org/plosbiology/article?id=10.1371/journal.pbio.0060154""]"
15,Apoptosis code,The Apoptosis Code,"Basañez, G. and J. M. Hardwick (2008). “Unravelling the bcl-2 apoptosis code with a simple model system.” PLoSBiol 6(6): e154. Füllgrabe, J., N. Hajji and B. Joseph (2010). ""Cracking the death code: apoptosis-related histone modifications."" Cell Death Differ 17(8): 1238-1243. Biermann, M., C. Maueröder, J. M. Brauner, R. Chaurio, C. Janko, M. Herrmann and L. E. Muñoz (2013). ""Surface code--biophysical signals for apoptotic cell clearance."" Phys Biol 10(6): 065007.","[""https://iopscience.iop.org/article/10.1088/1478-3975/10/6/065007"", ""https://journals.plos.org/plosbiology/article?id=10.1371/journal.pbio.0060154"", ""https://www.nature.com/articles/cdd201058""]"
16,Archetype codes,The Archetype Codes,"Bemowski, Karen (1995) Codes, cultural archetypes, and the collective cultural unconscious.  Quality Progress; Milwaukee Vol 28, Issue 1, p33. Major, J. C. (2021). “Archetypes and code biology.” Biosystems 208: 104501. Major, J. C. (2025). From code to archetype: Toward a unified theory of biological, neural, and artificial artifacts. Biosystems, 254, 105516. Major, João Carlos, (2025) Jung 4.0 - The Code Architecture of the Archetype: Reframing Analytical Psychology through Code Biology. Available at SSRN. Major, João Carlos, From Archetype-as-Code to the Code-Mediator-Artifact Framework: Empirical Extensions Across Biological, Neural, and Symbolic Systems (October 22, 2025). Available at SSRN. Sacco, Rob G., Marks-Tarlow, T., & Beitman, Bernard D. (2026). Archetypes as Codes: Jungian Psychology, Biological Organization, and the Fractal Logic of Synchronicity. International Journal of Jungian Studies, 1-21.","[""http://dx.doi.org/10.2139/ssrn.5678942"", ""http://dx.doi.org/10.2139/ssrn.5783922"", ""https://doi.org/10.1163/19409060-bja10063"", ""https://onlinelibrary.wiley.com/doi/10.1002/jss.400070321"", ""https://www.proquest.com/openview/dea9aeef8972c6ba2ca047b08abdf53c/"", ""https://www.sciencedirect.com/science/article/abs/pii/S0303264721001489"", ""https://www.sciencedirect.com/science/article/abs/pii/S0303264725001261""]"
17,Area code,The Area / Cell Recognition Code,"Hood, L., H. V. Huang and W. J. Dreyer (1977). “The area-code hypothesis: The immune system provides clues to understanding the genetic and molecular basis of cell recognition during development.” Journal of Supramolecular Structure 7(3-4): 531-559.","[""https://onlinelibrary.wiley.com/doi/10.1002/jss.400070321""]"
18,Arrestin code,The Arrestin Receptor Code,"Draper-Joyce, C. J. and A. Christopoulos (2018). ""Strength in numbers-an arrestin interaction code."" Nat Struct Mol Biol 25(6): 437-439.","[""https://portlandpress.com/biochemj/article-abstract/474/3/427/49582/Functional-consequences-of-B-repeat-sequence"", ""https://www.nature.com/articles/s41594-018-0077-x""]"
19,Assembly code,The Assembly Code,"Shelton, C. L., D. G. Conrady and A. B. Herr (2017). ""Functional consequences of B-repeat sequence variation in the staphylococcal biofilm protein Aap: deciphering the assembly code."" Biochem J 474(3): 427-443. van Gen Hassend, P. M., & Schindelin, H. (2026). A structural code for assembly specificity in GID/CTLH-type E3 ligases. Elife, 15.","[""https://doi.org/10.3389/fcell.2026.1762891"", ""https://doi.org/10.7554/eLife.110152"", ""https://portlandpress.com/biochemj/article-abstract/474/3/427/49582/Functional-consequences-of-B-repeat-sequence""]"
20,ATG8 code,The ATG8 Paralog Code,"Choi, H., Lee, S. M., & Lee, J. A. (2026). Decoding the brain's ATG8 paralog code: LC3-GABARAP specialization at synapses and the astrocyte-neuron interface. Front Cell Dev Biol, 14, 1762891.","[""https://doi.org/10.3389/fcell.2026.1762891"", ""https://www.jneurosci.org/content/4/10/2621.long""]"
21,Auditory Code,The Auditory Codes,"Middlebrooks, J. C. and E. I. Knudsen (1984). ""A neural code for auditory space in the cat's superior colliculus."" J Neurosci 4(10): 2621-2634. Schwarz, D. W. and R. W. Tomlinson (1987). ""A complex tone code in the auditory cortex."" J Otolaryngol 16(5): 316-321. Sterbing, S. J., U. Schmidt and R. Rübsamen (1994). ""The postnatal development of frequency-place code and tuning characteristics in the auditory midbrain of the phyllostomid bat, Carollia perspicillata."" Hear Res 76(1-2): 133-146. Thompson, V. A., & Paivio, A. (1994). Memory for pictures and sounds: independence of auditory and visual codes. Can J Exp Psychol, 48(3), 380-398. Schwarz, D. W., F. Tennigkeit, T. Adam, P. Finlayson and E. Puil (1998). ""Membrane properties that shape the auditory code in three nuclei of the central nervous system."" J Otolaryngol 27(6): 311-317. Lalwani, A. K. and C. M. Castelein (1999). ""Cracking the auditory genetic code: nonsyndromic hereditary hearing impairment."" Am J Otol 20(1): 115-132.","[""https://doi.org/10.1037/1196-1961.48.3.380"", ""https://pubmed.ncbi.nlm.nih.gov/3119868/"", ""https://pubmed.ncbi.nlm.nih.gov/9857314/"", ""https://pubmed.ncbi.nlm.nih.gov/9918184/"", ""https://www.jneurosci.org/content/4/10/2621.long"", ""https://www.sciencedirect.com/science/article/abs/pii/0378595594900957""]"
22,Autophagic code,The Autophagic Code,"Dong, N., & Yue, H. (2025). Decoding the autophagic code in obstructive sleep apnea: a multi-organ mechanistic dissection. Biochem Biophys Res Commun, 777, 152324.","[""https://academic.oup.com/plphys/article/187/1/7/6364284"", ""https://doi.org/10.1016/j.bbrc.2025.152324""]"
23,Auxin code,The Auxin Metabolism Code,"Campos, M. L. (2021). ""Breaking the code of auxin metabolism: an additional role for DIOXYGENASE FOR AUXIN OXIDATION 1."" Plant Physiol 187(1): 7-8. Martin-Arevalillo, R., & Vernoux, T. (2023). Decoding the Auxin Matrix: Auxin Biology Through the Eye of the Computer. Annu Rev Plant Biol, 74(Volume 74, 2023), 387-413. Martin-Arevalillo, R., Guillotin, B., Schön, J., Hugues, A., Gerentes, M.-F., Tang, K., . . . Vernoux, T. (2025). Synthetic deconvolution of an auxin-dependent transcriptional code. Cell, 188(11), 2872- 2889.e2824.","[""https://academic.oup.com/plphys/article/187/1/7/6364284"", ""https://direct.mit.edu/neco/article-abstract/15/3/549/6709/A-Theoretical-Model-of-Axon-Guidance-by-the-Robo"", ""https://doi.org/10.1016/j.cell.2025.03.028"", ""https://doi.org/10.1146/annurev-arplant-102720-033523""]"
24,Axon guidance code,The Axon Guidance Codes,"Goodhill, G. J. (2003). ""A theoretical model of axon guidance by the Robo code."" Neural Comput 15(3): 549-564. Kinrade, E. F. and A. Hidalgo (2004). ""Lateral neuron--glia interactions steer the response of axons to the Robo code."" Neuron Glia Biol 1(2): 101-112. Shirasaki, R., J. W. Lewcock, K. Lettieri and S. L. Pfaff (2006). ""FGF as a target-derived chemoattractant for developing motor axons genetically programmed by the LIM code."" Neuron 50(6): 841-853. Chatterjee, M., Li, K., Chen, L., Maisano, X., Guo, Q., Gan, L., & Li, J. Y. H. (2012). Gbx2 regulates thalamocortical axon guidance by modifying the LIM and Robo codes. Development, 139(24), 4633- 4643. Zarin, A. A., A. C. Daly, J. Hülsmeier, J. Asadzadeh and J. P. Labrador (2012). ""A GATA/homeodomain transcriptional code regulates axon guidance through the Unc-5 receptor."" Development 139(10): 1798-1805. Kohl, A., T. Marquardt, A. Klar and D. Sela-Donenfeld (2015). “Control of axon guidance and neurotransmitter phenotype of dB1 hindbrain interneurons by Lim-HD code.” J Neurosci 35(6): 2596- 2611.","[""https://direct.mit.edu/neco/article-abstract/15/3/549/6709/A-Theoretical-Model-of-Axon-Guidance-by-the-Robo"", ""https://doi.org/10.1016/j.ejcped.2025.100458"", ""https://journals.biologists.com/dev/article/139/10/1798/45027/A-GATA-homeodomain-transcriptional-code-regulates"", ""https://journals.biologists.com/dev/article/139/24/4633/45472/Gbx2-regulates-thalamocortical-axon-guidance-by"", ""https://www.cambridge.org/core/journals/neuron-glia-biology/article/abs/lateral-neuronglia-interactions-steer-the-response-of-axons-to-the-robo-code/"", ""https://www.cell.com/neuron/fulltext/S0896-6273(06)00348-5"", ""https://www.jneurosci.org/content/35/6/2596.long""]"
25,BAF code,The BRG1/BRM-associated factor (BAF) Code,"de Rojas, I., Miera, M., Molero, A., Jinménez, C., Pérez, M. J., Moreno, L., & Segura, M. F. (2026). Cracking the BAF code: a new therapeutic strategy in neuroblastoma (was selected for Fire-session). EJC Paediatric Oncology, 7.","[""https://doi.org/10.1016/j.ejcped.2025.100458""]"
26,BAFF code,The B cell activating factor (BAFF) Immune Code,"Mackay, F. and P. Schneider (2009). “Cracking the BAFF code.” Nat Rev Immunol 9(7): 491-502.","[""https://doi.org/10.1016/j.bcp.2018.01.007"", ""https://www.nature.com/articles/nri2572""]"
27,BGC code,The (Cryptic) Biosynthetic Gene Cluster Codes,"Rigali, S., Anderssen, S., Naômé, A., & van Wezel, G. P. (2018). Cracking the regulatory code of biosynthetic gene clusters as a strategy for natural product discovery. Biochem Pharmacol, 153, 24- 34.","[""https://doi.org/10.1016/j.bcp.2018.01.007"", ""https://journals.sagepub.com/doi/10.1177/000313481508101035""]"
28,Bile code,The Bile Acid Code,"Vuong, B., Tejirian, T., Chen, G. L., & Collins, J. C. (2015). Cracking the Code: The Unexpected Challenge of Identifying Major Bile Duct Injuries. Am Surg, 81(10), 1088-1092. Gadaleta, R. M., M. Cariello, L. Crudele and A. Moschetta (2022). ""Bile Salt Hydrolase-Competent Probiotics in the Management of IBD: Unlocking the ""Bile Acid Code""."" Nutrients 14(15).","[""https://doi.org/10.1007/bf01153509"", ""https://journals.sagepub.com/doi/10.1177/000313481508101035"", ""https://www.mdpi.com/2072-6643/14/15/3212""]"
29,Binaural code,The Binaural Code,"Harnischfeger, G. (1980). Brainstem units of echolocating bats code binaural time differences in the microsecond range. Naturwissenschaften, 67(6), 314-316. Młynarski, W. (2015). The Opponent Channel Population Code of Sound Location Is an Efficient Representation of Natural Binaural Sounds. PLOS Computational Biology, 11(5), e1004294. Bouse, J., Vencovský, V., Rund, F., & Marsalek, P. (2019). Functional rate-code models of the auditory brainstem for predicting lateralization and discrimination data of human binaural perception. J Acoust Soc Am, 145(1), 1. Encke, J. and M. Dietz (2022). “A hemispheric two-channel code accounts for binaural unmasking in humans.” CommunBiol 5(1): 1122.","[""https://doi.org/10.1007/bf01153509"", ""https://doi.org/10.1121/1.5084264"", ""https://doi.org/10.1371/journal.pcbi.1004294"", ""https://www.cabidigitallibrary.org/doi/full/10.5555/20113083064"", ""https://www.nature.com/articles/s42003-022-04098-x""]"
30,Biodiversity code,The Biodiversity Codes,"Ab’Sáber, A. (2010). Evolving from a Forest Code to a Biodiversity Code [Do código florestal para o código da biodiversidade.]. Biota Neotropica, 10(4), 331–336. Nogués-Bravo, D., Rodríguez-Sánchez, F., Orsini, L., de Boer, E., Jansson, R., Morlon, H., . . . Jackson, S. T. (2018). Cracking the Code of Biodiversity Responses to Past Climate Change. Trends in Ecology & Evolution, 33(10), 765-776.","[""https://doi.org/10.1016/j.tree.2018.07.005"", ""https://www.cabidigitallibrary.org/doi/full/10.5555/20113083064"", ""https://www.tandfonline.com/doi/abs/10.4161/cib.22595""]"
31,Bioelectric code,The Bioelectric Code,"Tseng, A. and M. Levin (2013). “Cracking the bioelectric code: Probing endogenous ionic controls of pattern formation.” Commun Integr Biol 6(1): e22595. Levin, M. and C. J. Martyniuk (2018). “The bioelectric code: An ancient computational medium for dynamic control of growth and form.” Biosystems 164: 76-93. Silver, B. B. and C. M. Nelson (2018). “The Bioelectric Code: Reprogramming Cancer and Aging From the Interface of Mechanical and Chemical Microenvironments.” Front Cell Dev Biol 6: 21.","[""https://www.frontiersin.org/articles/10.3389/fcell.2018.00021/full"", ""https://www.sciencedirect.com/science/article/abs/pii/S0303264717302848"", ""https://www.tandfonline.com/doi/abs/10.4161/cib.22595""]"
32,Bioremediation code,The Bioremediation Codes,"Fu, Y., Zhou, X., Shi, J., & Zhuang, H. (2026). Bacterial-algae biofilm formation deciphering phenolic wastewater degradation code: Revealing microbial community succession and tripartite synergistic networks. Journal of Water Process Engineering, 86, 109967.","[""https://chemistry-europe.onlinelibrary.wiley.com/doi/10.1002/cbic.201402071"", ""https://doi.org/10.1016/j.jwpe.2026.109967""]"
33,Biosysnthetic code,The Biosynthetic Code,"Xu, Z., M. Baunach, L. Ding, H. Peng, J. Franke and C. Hertweck (2014). “Biosynthetic code for divergolide assembly in a bacterial mangrove endophyte.” Chembiochem 15(9): 1274-1279.","[""https://chemistry-europe.onlinelibrary.wiley.com/doi/10.1002/cbic.201402071"", ""https://doi.org/10.1007/s00246-009-9608-x""]"
34,bHLH code,The bHLH Codes,"Conway, S. J., Firulli, B., & Firulli, A. B. (2010). A bHLH Code for Cardiac Morphogenesis. Pediatric Cardiology, 31(3), 318-324. Sallee, M. D., H. E. Littleford and I. Greenwald (2017). “A bHLH Code for Sexually Dimorphic Form and Function of the C. elegans Somatic Gonad.” Curr Biol 27(12): 1853-1860.e1855. Borba, A. R., Serra, T. S., Górska, A., Gouveia, P., Cordeiro, A. M., Reyna-Llorens, I., . . . Saibo, N. J. M. (2018). Synergistic Binding of bHLH Transcription Factors to the Promoter of the Maize NADP-ME Gene Used in C4 Photosynthesis Is Based on an Ancient Code Found in the Ancestral C3 State. Mol Biol Evol, 35(7), 1690-1705. Puig-Barbe, A., Dettmann, S., Nirello, V. D., Moor, H., Azami, S., Edgar, B. A., . . . de Navascués, J. (2025). A bHLH interaction code controls bipotential differentiation and self-renewal in the Drosophila gut. Cell Rep, 44(3).","[""https://doi.org/10.1007/s00246-009-9608-x"", ""https://doi.org/10.1016/j.celrep.2025.115398"", ""https://doi.org/10.1093/molbev/msy060"", ""https://www.cell.com/current-biology/fulltext/S0960-9822(17)30625-5?_returnURL=https%3A%2F%2Flinkinghub.elsevier.com%2Fretrieve%2Fpii%2FS0960982217306255%3Fshowall%3Dtrue"", ""https://www.mdpi.com/1999-4923/17/9/1169""]"
35,Blood-Brain Barrier code,The Blood-Brain Barrier Code,"Nájera-Maldonado, L., Parra-González, M., Peralta-Cuevas, E., Gutierrez-Onofre, A. J., Garcia-Atutxa, I., & Villanueva-Flores, F. (2025). Cracking the Blood–Brain Barrier Code: Rational Nanomaterial Design for Next-Generation Neurological Therapies. Pharmaceutics, 17(9), 1169.","[""https://www.mdpi.com/1999-4923/17/9/1169"", ""https://www.sciencedirect.com/science/article/abs/pii/S0301468111612711""]"
36,Body plan code,The (Epigenetic) Body Plan Code,"Elder D (1979) An epigenetic code. Differentiation, 14, 119-122.","[""https://linkinghub.elsevier.com/retrieve/pii/S0022-510X(21)00769-3"", ""https://www.sciencedirect.com/science/article/abs/pii/S0301468111612711""]"
37,Brain code,The Universal Brain Code,"Rosenberg, R. N. (2021). “The universal brain code a genetic mechanism for memory.” J Neurol Sci 429: 118073.","[""https://doi.org/10.1016/j.immuni.2025.03.006"", ""https://linkinghub.elsevier.com/retrieve/pii/S0022-510X(21)00769-3""]"
38,Brain immune code,The Brain Immune Code,"Kim, M. W., & Kipnis, J. (2025). Glymphatics and meningeal lymphatics unlock the brain-immune code. Immunity, 58(5), 1040-1051.","[""https://doi.org/10.1016/j.immuni.2025.03.006"", ""https://www.sciencedirect.com/science/article/abs/pii/S0736574800000307""]"
39,Cadherin code,The Cadherin Neuronal Code SEE also The Synaptic / Adhesive Code,"Ranscht, B. (2000). Cadherins: molecular codes for axon guidance and synapse formation. International Journal of Developmental Neuroscience, 18(7), 643-651. Hertel, N., Krishna, K., Nuernberger, M., & Redies, C. (2008). A cadherin-based code for the divisions of the mouse basal ganglia. Journal of Comparative Neurology, 508(4), 511-528.","[""https://doi.org/10.1002/cne.21696"", ""https://www.sciencedirect.com/science/article/abs/pii/S0736574800000307""]"
